Drunk Elephant,Rescue Party™ Kit,"A team of products brought together to rescue different areas of dry dehydrated damaged skin from harsh environmental elements: sun wind cold and the effects of using ""the suspicious six"". ",['- Dryness- Loss of firmness and elasticity- Fine lines and wrinkles'],How to play: there are five players each with their own skin territory on the face. When the game begins the players must rescue their designated areas from dryness and dehydration.- Lala Retro™ rescues skin from surface dryness.- Beste™ No. 9 rescues skin barrier from dirt and debris without stripping.- B-Hydra™ rescues skin from dehydration.- C-Tango™ rescues the eyes from dullness and loss of elasticity due to sun damage.- Lippe Balm rescues lips from dryness and dehydration.,"Lala Retro™ Whipped Cream:,Water, Glycerin, Caprylic/ Capric Triglyceride, Isopropyl Isostearate, Pseudozyma Epicola/Camellia Sinensis Seed Oil/Glucose/Glycine Soja Meal/Malt Extract/Yeast Extract Ferment Filtrate (Pseudozyma Epicola/Camellia Sinensis Seed Oil/Glucose/Yeast Extract Ferment Filtrate), Stearic Acid, Glyceryl Stearate SE, Cetearyl Alcohol, Pentylene Glycol, Plantago Lanceolata Leaf Extract, Adansonia Digitata Seed Oil, Citrullus Lanatus (Watermelon) Seed Oil, Passiflora Edulis Seed Oil, Schinziophyton Rautanenii Kernel Oil, Sclerocarya Birrea Seed Oil, Polyglyceryl-6 Ximenia Americana Seedate, Sodium Hyaluronate Crosspolymer, Ceteareth-20, Trisodium Ethylenediamine Disuccinate, Sodium Hydroxide, Citric Acid, Carbomer, Xanthan Gum, Caprylyl Glycol, Chlorphenesin, Phenoxyethanol, Ethylhexylglycerin.,,Beste™ No. 9:,Water, Glycerin, Cocamidopropyl Betaine, Coco-Glucoside, Sodium Lauroyl Methyl Isethionate, Cocamidopropyl Hydroxysultaine, Sodium Methyl Oleoyl Taurate, Propanediol, Aloe Barbadensis Leaf Extract, Glycolipids, Linoleic Acid, Linolenic Acid, Lauryl Glucoside, Cucumis Melo Cantalupensis Fruit Extract, Sclerocarya Birrea Seed Oil, Dipotassium Glycyrrhizate, Tocopherol, Citric Acid, Phenoxyethanol, Sodium Hydroxide, Sodium Benzoate, Sodium Chloride, Polylysine,,B-Hydra™ Intensive Hydration Serum:,Water, Coconut Alkanes, Ammonium Acryloyldimethyltaurate/VP Copolymer, Glycerin, Pentylene Glycol, Sclerocarya Birrea Seed Oil, Wheat Amino Acids, Ananas Sativus (Pineapple) Fruit Extract, Berberis Vulgaris Root Extract, Citrullus Lanatus (Watermelon) Fruit Extract, Lens Esculenta (Lentil) Fruit Extract, Pyrus Malus (Apple) Fruit Extract, Coco-Caprylate/Caprate, Panthenol, Sodium PCA, Sodium Hyaluronate Crosspolymer, Dipotassium Glycyrrhizate, Niacinamide, Cyclodextrin, Sodium Hyaluronate, Sodium Lactate, Phenoxyethanol, Hydroxyproline, Trisodium Ethylenediamine Disuccinate, Citric Acid, Caprylyl Glycol, Chlorphenesin, Ethylhexylglycerin,,C-Tango™ Multivitamin Eye Cream:,Water, Dicaprylyl Carbonate, Cetearyl Alcohol, Caprylic/Capric Triglyceride, Hydroxyethyl Acrylate/Sodium Acryloyldimethyl Taurate Copolymer, Sodium Ascorbyl Phosphate, Cetearyl Olivate, Sorbitan Olivate, Sclerocarya Birrea Seed Oil, Persea Gratissima (Avocado) Oil, Plukenetia Volubilis Seed Oil, Magnesium Ascorbyl Phosphate, Ceteareth-6 Olivate, Tetrahexyldecyl Ascorbate, Ascorbyl Glucoside, Ascorbyl Palmitate, Palmitoyl Tripeptide-1, Glycine Soja (Soybean) Sterols, Linoleic Acid, Phospholipids, Ceramide NP, Glycine Soja (Soybean) Protein, Ceramide AP, Phytosphingosine, Cholesterol, Ceramide EOP, Cucumis Sativus (Cucumber) Fruit Extract, Camellia Sinensis Leaf Extract, Palmitoyl Dipeptide-5 Diaminobutyroyl Hydroxythreonine, Palmitoyl Dipeptide-5 Diaminohydroxybutyrate, Dipeptide Diaminobutyroyl Benzylamide Diacetate, Sodium Hyaluronate Crosspolymer, C12-15 Alkyl Benzoate, Panthenol, Dipotassium Glycyrrhizate, Hesperidin Methyl Chalcone, Dipeptide-2, Palmitoyl Tetrapeptide-7, Fragaria Ananassa (Strawberry) Seed Extract, Medicago Sativa (Alfalfa) Extract, Morus Alba Leaf Extract, Hydrolyzed Rice Protein, Spilanthes Acmella Flower Extract, Aloe Barbadensis Leaf Juice, Ubiquinone, Superoxide Dismutase, Palmitoyl Tripeptide-38, Acetyl Hexapeptide-8, Pyrus Malus (Apple) Fruit Extract, Phytic Acid, Actinidia Chinensis (Kiwi) Fruit Extract, Vaccinium Myrtillus Leaf Extract, Tocopherol, Thioctic Acid, N-Hydroxysuccinimide, Chrysin, Mica, Ethylhexyl Palmitate, Phenoxyethanol, Pentylene Glycol, Sodium Lauroyl Lactylate, Titanium Dioxide, Hydroxypropyl Cyclodextrin, Sodium Benzoate, Xanthan Gum, Carbomer, Tocopheryl Acetate, Sodium Dextran Sulfate, Sorbitan Isostearate, Caprylyl Glycol, Steareth-20, Chlorhexidine Digluconate, Citric Acid, Chlorphenesin, Polysorbate 60, Potassium Sorbate, Ethylhexylglycerin.,,Lippe Balm:,Cocos Nucifera (Coconut) Oil, Sclerocarya Birrea Seed Oil, Butyrospermum Parkii (Shea) Butter, Caprylic/Capric Triglyceride, Bis-Diglyceryl Polyacyladipate-2, Beeswax/Cera Alba/Cire d’abeille, Ozokerite, Polyisobutene, Glycine Soja (Soybean) Oil, Copernicia Cerifera (Carnauba) Wax/Cera Carnauba/Cire de carnauba, Euphorbia Cerifera (Candelilla) Wax/Candelilla Cera/Cire de candelilla, Camellia Oleifera Leaf Extract, Dictyopteris Membranacea Extract, Magnolia Grandiflora Bark Extract, Carthamus Tinctorius (Safflower) Seed Oil, Persea Gratissima (Avocado) Oil, Schinziophyton Rautanenii (Mongongo) Kernel Oil, Vaccinium Macrocarpon (Cranberry) Seed Oil, Tocopheryl Acetate, Dipotassium Glycyrrhizate, Palmitoyl Tripeptide-1, Tetrahexyldecyl Ascorbate, Ethylhexyl Palmitate, Dicaprylyl Ether, Tribehenin, Sorbitan Isostearate, Lauryl Alcohol, Linoleic Acid, Linolenic Acid, Caprylyl Glycol, Phenoxyethanol.",https://www.sephora.com/product/rescue-party-P436100?icid2=products%20grid:p436100:product
Drunk Elephant,Rise + Glow™ Duo,['  A must-have duo that delivers a daily dose of vitamins for your skin.  '],[' - Dryness - Dullness and uneven texture - Loss of firmness and elasticity  '],  You take your vitamins every morning so why stop there? This daily dose for your complexion delivers powerful antioxidants to firm and brighten while replenishing essential hydration. Witness your glow every day. The Rise + Glow™ travel-sized duo is your skin's daily dose of vitamins B and C for an all-day quenched and glowing complexion. This set contains: - 0.27 oz/ 8 mL B-Hydra™ Intensive Hydration Serum - 0.27 oz/ 8 mL C-Firma™ Day Serum  ,"B-Hydra™ Intensive Hydration Serum:,-Sodium Hyaluronate Crosspolymer: Penetrates skin deeply to deliver excellent hydration, reducing the appearance of fine lines and wrinkles, while promoting firmness.,-Pro-Vitamin B5: Attracts and holds hydration to the skin; helps to support skin’s barrier function.,,Water, Coconut Alkanes, Ammonium Acryloyldimethyltaurate/VP Copolymer, Glycerin, Pentylene Glycol, Sclerocarya Birrea Seed Oil, Wheat Amino Acids, Ananas Sativus (Pineapple) Fruit Extract, Berberis Vulgaris Root Extract, Citrullus Lanatus (Watermelon) Fruit Extract, Lens Esculenta (Lentil) Fruit Extract, Pyrus Malus (Apple) Fruit Extract, Coco-Caprylate/Caprate, Panthenol, Sodium PCA, Sodium Hyaluronate Crosspolymer, Dipotassium Glycyrrhizate, Niacinamide, Cyclodextrin, Sodium Hyaluronate, Sodium Lactate, Phenoxyethanol, Hydroxyproline, Trisodium Ethylenediamine Disuccinate, Citric Acid, Caprylyl Glycol, Chlorphenesin, Ethylhexylglycerin.,,C-Firma™ Day Serum:,-Potent Antioxidant Complex (15% L-Ascorbic Acid Plus Ferulic Acid And 1% Vitamin E): Works to firm and brighten the look and feel of skin while defending against the signs of photoaging, pollution, and other environmental stressors.,,Water, Ethoxydiglycol, Ascorbic Acid, Glycerin, Laureth-23, Lactobacillus/Pumpkin Ferment Extract, Sclerocarya Birrea Seed Oil, Ferulic Acid, Sodium Hyaluronate, Chondrus Crispus Extract, Camellia Sinensis Leaf Extract, Lactobacillus/Punica Granatum Fruit Ferment Extract, Glycyrrhiza Glabra (Licorice) Root Extract, Vitis Vinifera (Grape) Juice Extract, Phyllanthus Emblica Fruit Extract, Hydrolyzed Wheat Protein, Tocopherol, Caprylhydroxamic Acid, Acetyl Glucosamine, Hydrolyzed Quinoa, Glutamylamidoethyl Imidazole, Dipotassium Glycyrrhizate, Tetrahydrodiferuloylmethane, Tetrahydrodemethoxydiferuloylmethane, Tetrahydrobisdemethoxydiferuloylmethane, Sodium Hyaluronate Crosspolymer, Glycine, Sucrose, Maltodextrin, Propanediol, Caprylyl Glycol, Sodium Hydroxide, Xanthan gum, Hydroxyethyl Acrylate/Sodium Acryloyldimethyl Taurate Copolymer, Isohexadecane, Polysorbate 60.",https://www.sephora.com/product/rise-and-glow-P414671?icid2=products%20grid:p414671:product
Drunk Elephant,B-Hydra™ Intensive Hydration Serum,['B-Hydra™ is a cool drink of water for your thirsty skin. This ultra-hydrating vitamin B5 serum replenishes nutrients while delivering hydration throughout the day to improve the look of skin texture and tone.'],['- Dryness- Dullness and uneven texture- Uneven skin tone'], Formulated with pro-vitamin B5 and pineapple ceramide B-Hydra™ delivers steady hydration throughout the day leaving the skin looking healthy and more illuminated. Blended with a unique lentil/apple/watermelon complex BHydra™ helps diminish drabness dryness and the appearance of fine lines. Your complexion will appear brighter and more youthful upon every application. This lightweight hard-hitting serum is ideal for all skin.,"-Pro-vitamin B5: Hydrates and helps to improve skin’s barrier function.,-Pineapple Ceramide: Helps boost luminosity and improve the appearance of skin texture and tone.,-Sodium Hyaluronate Crosspolymer: Hydrates to help reduce the appearance of fine lines; promotes firmness.,-Watermelon Rind, Apple, and Lentil Complex: Provides hydration, improves moisture retention, and reduces the appearance of fine lines.,,Water, Coconut Alkanes, Ammonium Acryloyldimethyltaurate/VP Copolymer, Glycerin, Pentylene Glycol, Sclerocarya Birrea Seed Oil, Wheat Amino Acids, Ananas Sativus (Pineapple) Fruit Extract, Berberis Vulgaris Root Extract, Citrullus Lanatus (Watermelon) Fruit Extract, Lens Esculenta (Lentil) Fruit Extract, Pyrus Malus (Apple) Fruit Extract, Coco-Caprylate/Caprate, Panthenol, Sodium PCA, Sodium Hyaluronate Crosspolymer, Dipotassium Glycyrrhizate, Niacinamide, Cyclodextrin, Sodium Hyaluronate, Sodium Lactate, Phenoxyethanol, Hydroxyproline, Trisodium Ethylenediamine Disuccinate, Citric Acid, Caprylyl Glycol, Chlorphenesin, Ethylhexylglycerin.,,This product is vegan and gluten-free.",https://www.sephora.com/product/b-hydra-intensive-hydration-gel-P406712?icid2=products%20grid:p406712:product
Drunk Elephant,NightBright™ Duo,['A set with a serum and facial oil for an overnight trip from dull to dreamy.'],['- Dullness and uneven texture- Uneven skin tone- Fine lines and wrinkles'],This dreamy duo works while you sleep to refine skin texture and tone while it thoroughly hydrates and nourishes for a gorgeous youthful glow by morning. The T.L.C. Framboos™ Glycolic Night Serum refines and resurfaces skin by gently dissolving dead skin cells and supporting the skin’s natural collagen production. The Virgin Marula Luxury Facial Oil is an antioxidant-rich skin treatment that hydrates preserves and calms with no greasy residue. Both products work together to visibly restore a healthy youthful glow.,"T.L.C. Framboos™:,-Virgin Marula Oil: Helps nourish and rejuvenate skin for a youthful glow; high in critical antioxidants and omegas 6 and 9.,-T.L.C. Framboos AHA blend: Exfoliates built-up dead skin cells, resurfacing dull, uneven skin for a smoother, brighter, more even-looking complexion.,-Salicylic Acid (BHA): Loosens sebum to unclog pores while soothing.,,Water, Glycolic Acid, Butylene Glycol, Glycerin, Sodium Hydroxide, Salicylic Acid, Lactic Acid, Citric Acid, Vitis Vinifera (Grape) Juice Extract, Aloe Barbadensis Leaf Juice, Opuntia Ficus-Indica Extract, Aesculus Hippocastanum (Horse Chestnut) Seed Extract, Camellia Sinensis Leaf Extract, Rubus Idaeus (Raspberry) Fruit Extract, Saccharomyces Cerevisiae Extract, Buddleja Davidii Meristem Cell Culture, Sclerocarya Birrea Seed Oil, Sodium Hyaluronate Crosspolymer, Allantoin, Hydroxyethylcellulose, Galactoarabinan, Propanediol, Disodium EDTA, Xanthan Gum, Hexylene Glycol, Phenoxyethanol, Caprylyl Glycol, Ethylhexylglycerin, Sodium Nitrate, Potassium Sorbate, Pentylene Glycol, Sodium Benzoate.,,Virgin Marula Oil:,100% Unrefined Sclerocraya Birrea (Marula) Kernel Oil.",https://www.sephora.com/product/nightbright-P414672?icid2=products%20grid:p414672:product
Drunk Elephant,Virgin Marula Luxury Facial Oil Mini,A wonder-working luxury facial oil high in critical antioxidants to deeply moisturize nourish soothe and rejuvenate your skin while restoring its youthful glow.,['- Dryness- Uneven skin tone- Fine lines and wrinkles '],[],"-Virgin Marula Oil: Helps nourish and rejuvenate skin for a youthful glow while providing critical antioxidants and omegas 6 and 9, thanks to its super-absorbent qualities. ,,100% Unrefined Sclerocraya Birrea (Marula) Kernel Oil.,,This product is vegan and gluten-free.",https://www.sephora.com/product/virgin-marula-luxury-facial-oil-mini-P424378?icid2=products%20grid:p424378:product
Drunk Elephant,Out of Office,['A kit to achieve a vacation face—even if you’re not on vacation.'],['- Fine lines and wrinkles- Uneven skin tone- Dryness'], A Drunk Elephant Kit that delivers moisture and nourishment with a bronzy finish and a dose of hydration to the lips. A just-got-back-from-somewhere glow always at your fingertips.Lippe Balm offers a slick rich finish that clings to lips and stays a while. D-Bronzi™ Anti-pollution Sunshine Serum acts like sunshine in a bottle without the damage. Virgin Marula Luxury Facial Oil is pure unrefined and rich in omegas 6 and 9. This set contains:- 0.13 oz/ 3.8 g Lippe Balm- 0.1 oz/ 3 mL Virgin Marula Luxury Facial Oil- 0.27 oz/ 8 mL D-Bronzi™ Anti-Pollution Sunshine Drops,"Lippe Balm:,Cocos Nucifera (Coconut) Oil, Sclerocarya Birrea Seed Oil, Butyrospermum Parkii (Shea) Butter, Caprylic/Capric Triglyceride, Bis-Diglyceryl Polyacyladipate-2, Beeswax/Cera Alba/Cire d’abeille, Ozokerite, Polyisobutene, Glycine Soja (Soybean) Oil, Copernicia Cerifera (Carnauba) Wax/Cera Carnauba/Cire de carnauba, Euphorbia Cerifera (Candelilla) Wax/Candelilla Cera/Cire de candelilla, Camellia Oleifera Leaf Extract, Dictyopteris Membranacea Extract, Magnolia Grandiflora Bark Extract, Carthamus Tinctorius (Safflower) Seed Oil, Persea Gratissima (Avocado) Oil, Schinziophyton Rautanenii (Mongongo) Kernel Oil, Vaccinium Macrocarpon (Cranberry) Seed Oil, Tocopheryl Acetate, Dipotassium Glycyrrhizate, Palmitoyl Tripeptide-1, Tetrahexyldecyl Ascorbate, Ethylhexyl Palmitate, Dicaprylyl Ether, Tribehenin, Sorbitan Isostearate, Lauryl Alcohol, Linoleic Acid, Linolenic Acid, Caprylyl Glycol, Phenoxyethanol.,,Virgin Marula Luxury Facial Oil:,100% Unrefined Sclerocraya Birrea (Marula) Kernel Oil.,,D-Bronzi™ Anti-Pollution Sunshine Drops:,Water, Hydrogenated Polyisobutene, Glyceryl Oleate Citrate, Mica, Hydroxyethyl Acrylate/Sodium Acryloyldimethyl Taurate Copolymer, Glycerin, Ribes Nigrum (Black Currant) Seed Oil, Sclerocarya Birrea Seed Oil, Theobroma Cacao (Cocoa) Extract, Caprylic/Capric Triglyceride, Vitis Vinifera (Grape) Seed Extract, Lecithin, Acetyl Tetrapeptide-17, Linoleic Acid, Linolenic Acid, Sorbitan Isostearate, Camellia Sinensis Leaf Extract, Maltodextrin, Sodium Hyaluronate Crosspolymer, Magnolia Officinalis Bark Extract, Glutamylamidoethyl Imidazole, Colloidal Platinum [nano], Tocopherol, Phenoxyethanol, Pentylene Glycol, Sodium Benzoate, Sorbic Acid, Caprylyl Glycol, Boron Nitride, Hexylene Glycol, Polysorbate 60, Ethylhexylglycerin, CI 77491 (Iron Oxides), CI 77492 (Iron Oxides), CI 77499 (Iron Oxides), Sodium C14-16 Olefin Sulfonate.",https://www.sephora.com/product/out-office-duo-P436101?icid2=products%20grid:p436101:product
Drunk Elephant,Beste™ No. 9 Jelly Cleanser,An innovative jelly cleanser that removes all traces of makeup excess oil pollution and any other grime from the day.,['- Oiliness- Makeup removal'],[],"-Mild Surfactant Blend: A stack of mild cleansing agents—including coconut-based surfactants rich in fatty acids—that work together to create a rich foam that effectively dissolves even stubborn makeup, sunscreen, and oils while supporting the healthy barrier of skin.,-Virgin Marula Oil: High in critical antioxidants and omegas 6 and 9, this nourishing oil supports Beste’s cleansing and makeup-removal power.,-Glycerin: Helps replenish hydration levels that are normally lost in skin during the cleansing process.,-Cantaloupe Fruit Extract: Rich in antioxidants to soothe and hydrate skin.,,Water, Sodium Lauroyl Methyl Isethionate, Glycerin, Cocamidopropyl Betaine, Cocamidopropyl Hydroxysultaine, Sodium Methyl Oleoyl Taurate, Propanediol, Aloe Barbadensis Leaf Extract, Coco-Glucoside, Lauryl Glucoside, Cucumis Melo Cantalupensis Fruit Extract, Sclerocarya Birrea Seed Oil, Dipotassium Glycyrrhizate, Citric Acid, Phenoxyethanol, Sodium Benzoate, Sodium Chloride.",https://www.sephora.com/product/beste-no-9-jelly-cleanser-P426836?icid2=products%20grid:p426836:product
Drunk Elephant,Shaba Complex™ Eye Serum,[' A silky eye serum formulated with a powerhouse of ingredients to tackle the major signs of aging under and around the eyes.'],['- Fine lines and wrinkles- Loss of firmness and elasticity'],[],"-Copper Peptides: Reduce the appearance of wrinkles and promote a more elastic feel to the skin while providing antioxidant properties.,-Edelweiss Stem Cell Culture: Helps to combat visible signs of aging like wrinkles and loss of firmness, and are rich in leontopodic acids with powerful antioxidant properties.,-Black Tea Ferment: Smooths the look of roughness, improves radiance, and helps skin appear younger.,-Sea Buckthorn Oil: Easily absorbs and helps defend from free-radicals; possesses soothing properties to relieve redness.,,Water, Octyldodecanol, Glycerin, Boron Nitride, Saccharomyces/Xylinum/Black Tea Ferment, Coconut Alkanes, Cetyl Alcohol, Cetearyl Olivate, Sorbitan Olivate, Niacinamide, Copper Tripeptide-1, Leontopodium Alpinum Meristem Cell Culture, Dipeptide-2, Palmitoyl Tripeptide-1, Palmitoyl Tetrapeptide-7, Copper Lysinate/Prolinate, Hesperidin Methyl Chalcone, Chondrus Crispus (Carrageenan), Mangifera Indica (Mango) Seed Butter, Glycine Soja (Soybean) Oil, Hippophae Rhamnoides Oil, Sclerocarya Birrea Seed Oil, Sodium Hyaluronate Crosspolymer, Hydroxyethylcellulose, Coco-Caprylate/Caprate, Steareth-20, Lecithin, Panthenol, N-Hydroxysuccinimide, Ubiquinone, Citric Acid, Thioctic Acid, Tocopherol, Chrysin, Sclerotium Gum, Methylglucoside Phosphate, Xanthan Gum, Potassium Sorbate, Sodium Benzoate, Chlorphenesin, Caprylyl Glycol, Sodium Hydroxide, Phenoxyethanol, Pentylene Glycol / Ethylhexylglycerin",https://www.sephora.com/product/shaba-complex-eye-serum-P419223?icid2=products%20grid:p419223:product
Drunk Elephant,D-Bronzi™ Anti-Pollution Sunshine Drops,A serum that immediately replenishes the delicate balance that supports a healthy barrier function of skin—like sunshine’s bronzy color delivered without the damage.,['- Fine lines and wrinkles- Uneven skin tone- Dullness and uneven texture'],[],"-Platinum Peptides: Help reduce the appearance of fine lines and wrinkles, while promoting elasticity and resilience.,-Cocoa Extract: Provides powerful antioxidant and soothing benefits.,-Chronocyclin: Mimics the antioxidant benefits of vitamin D for more youthful-looking skin.,-Vitamin F (Linoleic and Linolenic Acid): Works to improve skin’s texture and suppleness, while helping to calm signs of sensitivity.,,Water, Hydrogenated Polyisobutene, Glyceryl Oleate Citrate, Mica, Hydroxyethyl Acrylate/Sodium Acryloyldimethyl Taurate Copolymer, Glycerin, Ribes Nigrum (Black Currant) Seed Oil, Sclerocarya Birrea Seed Oil, Theobroma Cacao (Cocoa) Extract, Caprylic/Capric Triglyceride, Vitis Vinifera (Grape) Seed Extract, Lecithin, Acetyl Tetrapeptide-17, Linoleic Acid, Linolenic Acid, Sorbitan Isostearate, Camellia Sinensis Leaf Extract, Maltodextrin, Sodium Hyaluronate Crosspolymer, Magnolia Officinalis Bark Extract, Glutamylamidoethyl Imidazole, Colloidal Platinum [nano], Tocopherol, Phenoxyethanol, Pentylene Glycol, Sodium Benzoate, Sorbic Acid, Caprylyl Glycol, Boron Nitride, Hexylene Glycol, Polysorbate 60, Ethylhexylglycerin, CI 77491 (Iron Oxides), CI 77492 (Iron Oxides), CI 77499 (Iron Oxides), Sodium C14-16 Olefin Sulfonate.",https://www.sephora.com/product/d-bronzi-tm-anti-pollution-sunshine-serum-P432668?icid2=products%20grid:p432668:product
Drunk Elephant,Baby Pekee Bar™ + Juju Bar Travel Duo,['A Juju Bar and Pekee Bar™ as a travel-sized duo.'],['- Dullness and uneven texture- Uneven skin tone - Pores'], The JuJu Bar is a multitasking exfoliating bar designed to effectively cleanse while gently removing dead skin cells from the surface of the skin. Uniquely formulated with thermal mud and bamboo powder Juju Bar creates a creamy lather that dissolves unwanted oil rinsing away pore-clogging surface debris and any impurities. It refines skin texture brightens skin clarity and helps minimize the look of pores. Truly in a league of its own Pekee Bar™ is a gentle cleansing bar that moisturizes clarifies and balances the complexion. Infused with a blend of blueberry extract marula oil and honey Pekee Bar tones and promotes moisture retention.,"-Heilmoor Clay: Tones and detoxifies the skin. ,-Virgin Marula Oil: Hydrates, protects, heals, and rejuvenates the skin; high in antioxidants and omegas 6 and 9. ,-Blueberry Extract: Potent antioxidant with soothing and anti-glycation properties.,,Pekee Bar™:,Sodium Coco-Sulfate, Disodium Lauryl Sulfosuccinate, Triticum Vulgare (Wheat) Starch, Cetearyl Alcohol, Paraffin, Sclerocarya Birrea Seed Oil, Water, Titanium Dioxide (CI 77891), Honey/Mel/Miel, Glycerin, Vaccinium Angustifolium (Blueberry) Fruit Extract.,,Juju Bar:,Sodium Coco-Sulfate, Disodium Lauryl Sulfosuccinate, Triticum Vulgare (Wheat) Starch, Cetearyl Alcohol, Bambusa Vulgaris Leaf/Stem Extract, Paraffin, Sclerocarya Birrea Seed Oil, Water, Heilmoor Clay, Titanium Dioxide (CI 77891), Helianthus Annuus (Sunflower) Seed Oil, Euterpe Oleracea Fruit Extract, Lycium Barbarum Fruit Extract.",https://www.sephora.com/product/baby-pekee-bar-tm-juju-bar-tm-travel-duo-P405584?icid2=products%20grid:p405584:product
Drunk Elephant,Lippe Balm,A moisturizing volumizing lip balm that helps nourish super-delicate lips for noticeably plump youthful-looking lips. ,[],[],"-Virgin Marula Oil: Hydrates, heals, and rejuvenates the skin.,-Mongongo Oil: Provides moisture and UV protection and is a super antioxidant source. ,-Avocado Oil: Provides rich moisture and softens rough, chapped skin.,-Cranberry Seed Oil: Rich in essential fatty acids and Vitamin E.,,Cocos Nucifera (Coconut) Oil, Sclerocarya Birrea Seed Oil, Butyrospermum Parkii (Shea) Butter, Caprylic/Capric Triglyceride, Bis-Diglyceryl Polyacyladipate-2, Beeswax/Cera Alba/Cire d’abeille, Ozokerite, Polyisobutene, Glycine Soja (Soybean) Oil, Copernicia Cerifera (Carnauba) Wax/Cera Carnauba/Cire de carnauba, Euphorbia Cerifera (Candelilla) Wax/Candelilla Cera/Cire de candelilla, Camellia Oleifera Leaf Extract, Dictyopteris Membranacea Extract, Magnolia Grandiflora Bark Extract, Carthamus Tinctorius (Safflower) Seed Oil, Persea Gratissima (Avocado) Oil, Schinziophyton Rautanenii (Mongongo) Kernel Oil, Vaccinium Macrocarpon (Cranberry) Seed Oil, Tocopheryl Acetate, Dipotassium Glycyrrhizate, Palmitoyl Tripeptide-1, Tetrahexyldecyl Ascorbate, Ethylhexyl Palmitate, Dicaprylyl Ether, Tribehenin, Sorbitan Isostearate, Lauryl Alcohol, Linoleic Acid, Linolenic Acid, Caprylyl Glycol, Phenoxyethanol.",https://www.sephora.com/product/lippe-tm-P403818?icid2=products%20grid:p403818:product
Drunk Elephant,JuJu Bar,An ultra-mild three-in-one bar that cleanses subtly exfoliates and heals skin.  ,['- Uneven skin tone- Dullness and uneven texture- Oiliness'],[],"-Heilmoor Clay: Tones and detoxifies the skin. ,-Virgin Marula Oil: Hydrates, protects, heals, and rejuvenates the skin; high in antioxidants and omegas 6 and 9. ,-Bamboo Powder: Gently exfoliates away dead, dull skin cells.,,Sodium Coco-Sulfate, Disodium Lauryl Sulfosuccinate, Triticum Vulgare (Wheat) Starch, Cetearyl Alcohol, Bambusa Vulgaris Leaf/Stem Extract, Paraffin, Sclerocarya Birrea Seed Oil, Water, Heilmoor Clay, Titanium Dioxide (CI 77891), Helianthus Annuus (Sunflower) Seed Oil, Euterpe Oleracea Fruit Extract, Lycium Barbarum Fruit Extract.",https://www.sephora.com/product/juju-bar-P392249?icid2=products%20grid:p392249:product