Drunk Elephant,The Big Reveal™ Kit,['A set of five skincare products to help you reveal your youthful complexion. '],['- Dullness and uneven texture- Fine lines and wrinkles- Loss of firmness and elasticity']," T.L.C. Sukari Babyfacial™ is a pro-quality AHA/BHA mask that works as a ""facial"" to reveal greater clarity improved skin texture and tone and a more youthful-looking radiance. Beste™ No. 9 Jelly Cleanser is an innovative cleanser that removes all traces of makeup excess oil pollution and any other grime from the day. B-Hydra™ Intensive Hydration Serum replenishes nutrients while delivering hydration throughout the day to improve the look of skin texture and tone. Virgin Marula Luxury Facial Oil is high in critical antioxidants to moisturize nourish soothe and rejuvenate your skin while restoring its youthful glow. Lippe Balm helps nourish super-delicate lips for noticeably plump youthful-looking lips.This set contains:- 1.69 oz/ 50 mL T.L.C. Sukari Babyfacial™- 1 oz/ 30 mL Beste™ No. 9 Jelly Cleanser- 0.27 oz/ 8 mL B-Hydra™ Intensive Hydration Serum- 0.27 oz/ 8 mL Virgin Marula Luxury Facial Oil- 0.13 oz/ 3.7 g Lippe Balm","T.L.C. Sukari Babyfacial:,-Blend 25% (Glycolic + T.L.C. (T) Tartaric, (L) Lactic, (C) Citric Acids) and Salicylic Acid (BHA) 2%: Exfoliate surface dead skin cells and support surface turnover to smooth and brighten the appearance of skin; exfoliates pores as well as on the surface of the skin, refining pores and providing greater skin clarity while soothing redness.,-Gram/Chickpea Flour: Absorbs excess oil without over-drying, balances, and brightens skin’s appearance while combating dullness.,-Pumpkin Ferment Extract: Aids in gentle exfoliation with a rich source of fatty acids and antioxidant components, carotene, lutein, and carotenoids, and contains naturally occurring enzymes.,-Matcha (Green Tea Leaf Powder), Milk Thistle, and Apple Extracts: Contain potent antioxidant and anti-pollution properties, helping to condition and soothe.,,Water, Glycolic Acid, Hydroxyethyl Acrylate/Sodium Acryloyldimethyl Taurate Copolymer, Glycerin, Sodium Hydroxide, Salicylic Acid, Aloe Barbadensis Leaf Extract, Camellia Oleifera Leaf Extract, Lactobacillus/Pumpkin Ferment Extract, Lactobacillus/Punica Granatum Fruit Ferment Extract, Opuntia Ficus-Indica Extract, Pyrus Malus (Apple) Fruit Extract, Silybum Marianum Seed Extract, Saccharomyces Cerevisiae Extract, Vitis Vinifera (Grape) Juice Extract, Camellia Sinensis Leaf Powder, Cicer Arietinum Seed Powder, Sclerocarya Birrea Seed Oil, Passiflora Edulis Seed Oil, Leuconostoc/Radish Root Ferment Filtrate, Sodium Hyaluronate Crosspolymer, Sodium PCA, Allantoin, Dipotassium Glycyrrhizate, Dextrin, Polydextrose, Sorbitan Isostearate, Amylopectin, Niacinamide, Phytosphingosine, Lactic Acid, Propanediol, Citric Acid, Titanium Dioxide, Trisodium Ethylenediamine Disuccinate, Polysorbate 60, Caprylyl Glycol, Chlorphenesin, Phenoxyethanol.,,Beste No. 9 Jelly Cleanser:,-Mild Surfactant Blend: A stack of mild cleansing agents—including coconut-based surfactants rich in fatty acids—that work together to create a rich foam that effectively dissolves even stubborn makeup, sunscreen, and oils while supporting the healthy barrier of skin.,-Virgin Marula Oil: High in critical antioxidants and omegas 6 and 9, this nourishing oil supports Beste’s cleansing and makeup-removal power.,-Glycerin: Helps replenish hydration levels that are normally lost in skin during the cleansing process.,-Cantaloupe Fruit Extract: Rich in antioxidants to soothe and hydrate skin.,,Water, Sodium Lauroyl Methyl Isethionate, Glycerin, Cocamidopropyl Betaine, Cocamidopropyl Hydroxysultaine, Sodium Methyl Oleoyl Taurate, Propanediol, Aloe Barbadensis Leaf Extract, Coco-Glucoside, Lauryl Glucoside, Cucumis Melo Cantalupensis Fruit Extract, Sclerocarya Birrea Seed Oil, Dipotassium Glycyrrhizate, Citric Acid, Phenoxyethanol, Sodium Benzoate, Sodium Chloride.,,B-Hydra™ Intensive Hydration Serum:,-Pro-Vitamin B5: Attracts and holds hydration to the skin; helps to improve skin’s barrier function.,-Pineapple Ceramide: Helps boost luminosity and improve the appearance of skin texture and tone.,-Sodium Hyaluronate Crosspolymer: Delivers intense hydration to help reduce the appearance of fine lines and wrinkles and promote firmness.,-Watermelon Rind/Apple/Lentil Complex: Provides up to 24 hours of skin hydration, improves moisture retention, and reduces the appearance of fine lines.,,Water, Coconut Alkanes, Ammonium Acryloyldimethyltaurate/VP Copolymer, Glycerin, Pentylene Glycol, Sclerocarya Birrea Seed Oil, Wheat Amino Acids, Ananas Sativus (Pineapple) Fruit Extract, Berberis Vulgaris Root Extract, Citrullus Lanatus (Watermelon) Fruit Extract, Lens Esculenta (Lentil) Fruit Extract, Pyrus Malus (Apple) Fruit Extract, Coco-Caprylate/Caprate, Panthenol, Sodium PCA, Sodium Hyaluronate Crosspolymer, Dipotassium Glycyrrhizate, Niacinamide, Cyclodextrin, Sodium Hyaluronate, Sodium Lactate, Phenoxyethanol, Hydroxyproline, Trisodium Ethylenediamine Disuccinate, Citric Acid, Caprylyl Glycol, Chlorphenesin, Ethylhexylglycerin.,,Virgin Marula Luxury Facial Oil:,Virgin Marula Oil: Helps nourish and rejuvenate skin for a youthful glow while providing critical antioxidants and omegas 6 and 9, thanks to its super-absorbent qualities.,,100% Unrefined Sclerocraya Birrea (Marula) Kernel Oil.,,Lippe Balm:,-Mongongo Oil: Provides moisture and UV protection and is a super antioxidant source.,-Avocado Oil: Provides rich moisture and softens rough, chapped skin. Also an excellent source of omega-3 fatty acids, antioxidants and vitamins A, D, and E,-Cranberry Seed Oil: Rich in essential fatty acids and Vitamin E, which has been found to play a significant role in maintaining skin health,,Cocos Nucifera (Coconut) Oil, Sclerocarya Birrea Seed Oil, Butyrospermum Parkii (Shea) Butter, Caprylic/Capric Triglyceride, Bis-Diglyceryl Polyacyladipate-2, Beeswax/Cera Alba/Cire d’abeille, Ozokerite, Polyisobutene, Glycine Soja (Soybean) Oil, Copernicia Cerifera (Carnauba) Wax/Cera Carnauba/Cire de carnauba, Euphorbia Cerifera (Candelilla) Wax/Candelilla Cera/Cire de candelilla, Camellia Oleifera Leaf Extract, Dictyopteris Membranacea Extract, Magnolia Grandiflora Bark Extract, Carthamus Tinctorius (Safflower) Seed Oil, Persea Gratissima (Avocado) Oil, Schinziophyton Rautanenii (Mongongo) Kernel Oil, Vaccinium Macrocarpon (Cranberry) Seed Oil, Tocopheryl Acetate, Dipotassium Glycyrrhizate, Palmitoyl Tripeptide-1, Tetrahexyldecyl Ascorbate, Ethylhexyl Palmitate, Dicaprylyl Ether, Tribehenin, Sorbitan Isostearate, Lauryl Alcohol, Linoleic Acid, Linolenic Acid, Caprylyl Glycol, Phenoxyethanol.",https://www.sephora.com/product/the-big-reveal-P436099?icid2=products%20grid:p436099:product
Drunk Elephant,Agent Ellie™ Day Kit,['A kit that contains everything you need for a daytime skincare routine.'],['- Dullness and uneven texture- Uneven skin tone- Loss of firmness and elasticity'],Using the magnifying glass search the ingredients in your current beauty routine for the six suspects (the #suspicious6) listed on the enclosed playing cards. Once you have located and set aside any products containing them you may begin taking #acleanbreak using the Drunk Elephant Agent Ellie Day Kit to reset your skin back to a healthy balance. Products that do not contain the #suspicious6 may remain in the game. The winner is your skin.,"B-Hydra™ Intensive Hydration Serum:,Water, Coconut Alkanes, Ammonium Acryloyldimethyltaurate/VP Copolymer, Glycerin, Pentylene Glycol, Sclerocarya Birrea Seed Oil, Wheat Amino Acids, Ananas Sativus (Pineapple) Fruit Extract, Berberis Vulgaris Root Extract, Citrullus Lanatus (Watermelon) Fruit Extract, Lens Esculenta (Lentil) Fruit Extract, Pyrus Malus (Apple) Fruit Extract, Coco-Caprylate/Caprate, Panthenol, Sodium PCA, Sodium Hyaluronate Crosspolymer, Dipotassium Glycyrrhizate, Niacinamide, Cyclodextrin, Sodium Hyaluronate, Sodium Lactate, Phenoxyethanol, Hydroxyproline, Trisodium Ethylenediamine Disuccinate, Citric Acid, Caprylyl Glycol, Chlorphenesin, Ethylhexylglycerin.,,Protini™ Polypeptide Cream:,Water, Dicaprylyl Carbonate, Glycerin, Cetearyl Alcohol, Cetearyl Olivate, Sorbitan Olivate, Sclerocarya Birrea Seed Oil, Bacillus/Soybean/ Folic Acid Ferment Extract, Nymphaea Alba Root Extract, sh-Oligopeptide-1, sh-Oligopeptide-2, sh-Polypeptide-1, sh-Polypeptide-9, sh-Polypeptide-11, Copper Palmitoyl Heptapeptide-14, Heptapeptide-15 Palmitate, Palmitoyl Tetrapeptide-7, Palmitoyl Tripeptide-1,Alanine, Arginine, Glycine, Histidine, Isoleucine, Phenylalanine, Proline, Serine, Threonine, Valine, Acetyl Glutamine, Coconut Alkanes, Coco-Caprylate/Caprate, Sodium Hyaluronate, Aspartic Acid, Linoleic Acid, Linolenic Acid, Lecithin, Butylene Glycol, Polyvinyl Alcohol, Sodium Lactate, Sodium PCA, PCA, Sorbitan Isostearate, Carbomer, Polysorbate 20, Polysorbate 60, Lactic Acid/Glycolic Acid Copolymer, Hydroxyethyl Acrylate/Sodium Acryloyldimethyl Taurate Copolymer, Xanthan Gum, Isomalt, 1,2-Hexanediol, Caprylyl Glycol, Chlorphenesin, Phenoxyethanol, Tocopherol, Sodium Benzoate, Phenylpropanol, Glyceryl Caprylate, Symphytum Officinale Callus Culture Extract.,,C-Firma™ Day Serum:,Water, Ethoxydiglycol, Ascorbic Acid, Glycerin, Laureth-23, Lactobacillus/Pumpkin Ferment Extract, Sclerocarya Birrea Seed Oil, Ferulic Acid, Sodium Hyaluronate, Chondrus Crispus Extract, Camellia Sinensis Leaf Extract, Lactobacillus/Punica Granatum Fruit Ferment Extract, Glycyrrhiza Glabra (Licorice) Root Extract, Vitis Vinifera (Grape) Juice Extract, Phyllanthus Emblica Fruit Extract, Hydrolyzed Wheat Protein, Tocopherol, Caprylhydroxamic Acid, Acetyl Glucosamine, Hydrolyzed Quinoa, Glutamylamidoethyl Imidazole, Dipotassium Glycyrrhizate, Tetrahydrodiferuloylmethane, Tetrahydrodemethoxydiferuloylmethane, Tetrahydrobisdemethoxydiferuloylmethane, Sodium Hyaluronate Crosspolymer, Glycine, Sucrose, Maltodextrin, Propanediol, Caprylyl Glycol, Sodium Hydroxide, Xanthan gum, Hydroxyethyl Acrylate/Sodium Acryloyldimethyl Taurate Copolymer, Isohexadecane, Polysorbate 60.,,Umbra Tinte™ Physical DailyDefense SPF 30:,-Zinc Oxide 20%,,Water, Caprylic/Capric Triglyceride, Dicaprylyl Carbonate, Glycerin, Pentylene Glycol, Steareth-2, Propanediol, Steareth-21, Polyhydroxystearic Acid, Cetearyl Alcohol, Silica, Sclerocarya Birrea Seed Oil, Aloe Barbadensis Leaf Extract, Chondrus Crispus Extract, Haematococcus Pluvialis Extract, Helianthus Annuus (Sunflower) Sprout Extract, Vitis Vinifera (Grape) Juice Extract, Helianthus Annuus (Sunflower) Seed Oil, Simmondsia Chinensis (Jojoba) Seed Oil, Raspberry Seed Oil/Tocopheryl Succinate Aminopropanediol Esters, Hydrolyzed Wheat Protein, DL-Alpha Tocopheryl Acetate, Tocopherols, Sea Water, Acetyl Glucosamine, Cetearyl Glucoside, Sodium Stearoyl Glutamate, Tetrahexyldecyl Ascorbate, Glycine, Sucrose, Sodium C14·16 Olefin Sulfonate, Lecithin, Triethoxycaprylylsilane, Xanthan Gum, Trisodium Ethylenediamine Disuccinate, Caprylhydroxamic Acid, Mica, Tin Oxide (SnO2), Caprylyl Glycol, Phenoxyethanol, Titanium Dioxide (CI 77891), Iron Oxides (CI 77491, CI 77492, CI 77499).,,Shaba Complex™ Eye Serum:,Water, Octyldodecanol, Glycerin, Boron Nitride, Saccharomyces/Xylinum/Black Tea Ferment, Coconut Alkanes, Cetyl Alcohol, Cetearyl Olivate, Sorbitan Olivate, Niacinamide, Copper Tripeptide-1, Leontopodium Alpinum Meristem Cell Culture, Dipeptide-2, Palmitoyl Tripeptide-1, Palmitoyl Tetrapeptide-7, Copper Lysinate/Prolinate, Hesperidin Methyl Chalcone, Chondrus Crispus (Carrageenan), Mangifera Indica (Mango) Seed Butter, Glycine Soja (Soybean) Oil, Hippophae Rhamnoides Oil, Sclerocarya Birrea Seed Oil, Sodium Hyaluronate Crosspolymer, Hydroxyethylcellulose, Coco-Caprylate/Caprate, Steareth-20, Lecithin, Panthenol, N-Hydroxysuccinimide, Ubiquinone, Citric Acid, Thioctic Acid, Tocopherol, Chrysin, Sclerotium Gum, Methylglucoside Phosphate, Xanthan Gum, Potassium Sorbate, Sodium Benzoate, Chlorphenesin, Caprylyl Glycol, Sodium Hydroxide, Phenoxyethanol, Pentylene Glycol / Ethylhexylglycerin.",https://www.sephora.com/product/agent-ellie-day-kit-P436096?icid2=products%20grid:p436096:product
Drunk Elephant,Lala Retro™ Whipped Cream,A moisturizer that rescues dry dull skin while delivering a steady dose of barrier moisture.,['- Dryness- Loss of firmness and elasticity- Fine lines and wrinkles\xa0'],[],"-Blend of Six African Oils: Delivers intense hydration while brightening and rejuvenating skin.,-Plantain Extract: Aids in restoring moisture while brightening. ,-Sodium Hyaluronate Crosspolymer: Has a smaller molecular weight than hyaluronic acid and is able to deeply penetrate skin, delivering excellent hydration and reducing the appearance of fine lines and wrinkles.,-Fermentoil Green Tea Seed: Rich in antioxidants to provide moisturizing and nourishing benefits. ,,Water, Glycerin, Caprylic/ Capric Triglyceride, Isopropyl Isostearate, Pseudozyma Epicola/Camellia Sinensis Seed Oil/Glucose/Glycine Soja Meal/Malt Extract/Yeast Extract Ferment Filtrate (Pseudozyma Epicola/Camellia Sinensis Seed Oil/Glucose/Yeast Extract Ferment Filtrate), Stearic Acid, Glyceryl Stearate SE, Cetearyl Alcohol, Pentylene Glycol, Plantago Lanceolata Leaf Extract, Adansonia Digitata Seed Oil, Citrullus Lanatus (Watermelon) Seed Oil, Passiflora Edulis Seed Oil, Schinziophyton Rautanenii Kernel Oil, Sclerocarya Birrea Seed Oil, Polyglyceryl-6 Ximenia Americana Seedate, Sodium Hyaluronate Crosspolymer, Ceteareth-20, Trisodium Ethylenediamine Disuccinate, Sodium Hydroxide, Citric Acid, Carbomer, Xanthan Gum, Caprylyl Glycol, Chlorphenesin, Phenoxyethanol, Ethylhexylglycerin.",https://www.sephora.com/product/lala-retro-whipped-cream-P408645?icid2=products%20grid:p408645:product
Drunk Elephant,T.L.C. Sukari Babyfacial™,['An AHA/BHA facial that resurfaces to reveal a more youthful-looking radiance. '],['- Dullness and uneven texture- Fine lines and wrinkles- Pores'],[],"-25 Percent AHA Blend ( (G) Glycolic + (T) Tartaric, (L) Lactic, (C) Citric Acids): Exfoliates surface dead skin cells and revs up surface turnover to help smooth and brighten the appearance of skin.,-Chickpea Flour: Balances and brightens skin’s appearance while combating dullness.,-Pumpkin Ferment Extract: Aids in gentle exfoliation.,-Matcha (Green Tea Leaf), Milk Thistle, and Apple Extracts: Help to condition and soothe skin.,,Water, Glycolic Acid, Hydroxyethyl Acrylate/Sodium Acryloyldimethyl Taurate Copolymer, Glycerin, Sodium Hydroxide, Salicylic Acid, Aloe Barbadensis Leaf Extract, Camellia Oleifera Leaf Extract, Lactobacillus/Pumpkin Ferment Extract, Lactobacillus/Punica Granatum Fruit Ferment Extract, Opuntia Ficus-Indica Extract, Pyrus Malus (Apple) Fruit Extract, Silybum Marianum Seed Extract, Saccharomyces Cerevisiae Extract, Vitis Vinifera (Grape) Juice Extract, Camellia Sinensis Leaf Powder, Cicer Arietinum Seed Powder, Sclerocarya Birrea Seed Oil, Passiflora Edulis Seed Oil, Leuconostoc/Radish Root Ferment Filtrate, Sodium Hyaluronate Crosspolymer, Sodium PCA, Allantoin, Dipotassium Glycyrrhizate, Dextrin, Polydextrose, Sorbitan Isostearate, Amylopectin, Niacinamide, Phytosphingosine, Lactic Acid, Propanediol, Citric Acid, Titanium Dioxide, Trisodium Ethylenediamine Disuccinate, Polysorbate 60, Caprylyl Glycol, Chlorphenesin, Phenoxyethanol.",https://www.sephora.com/product/t-l-c-sukari-babyfacial-P415777?icid2=products%20grid:p415777:product
Drunk Elephant,Virgin Marula Luxury Facial Oil,A wonder-working luxury facial oil high in critical antioxidants to deeply moisturize nourish soothe and rejuvenate your skin while restoring its youthful glow.,['- Dryness- Uneven skin tone- Fine lines and wrinkles\xa0'],[],"-Virgin Marula Oil: Helps nourish and rejuvenate skin for a youthful glow while providing critical antioxidants and omegas 6 and 9, thanks to its super-absorbent qualities. ,,100% Unrefined Sclerocraya Birrea (Marula) Kernel Oil.,,This product is vegan and gluten-free.",https://www.sephora.com/product/virgin-marula-tm-luxury-facial-oil-P392245?icid2=products%20grid:p392245:product
Drunk Elephant,C-Tango™ Multivitamin Eye Cream,A rich and restorative eye cream featuring a brightening combination of eight peptides five forms of vitamin C and cucumber extract for firmer stronger-looking skin around the eye area.  ,['- Loss of firmness and elasticity- Fine lines and wrinkles'],[],"-Power Five C Vitamin Complex: Five forms of vitamin C work together to brighten uneven tone and firm; when paired with peptides and antioxidants like vitamin E and superoxide dismutase, it offers unparalleled defense against damaging UV rays, pollution, and other free radicals.,-Peptide Blend: Eight peptides with the power to rebuild, strengthen, and improve the appearance of fine lines and wrinkles.,-Cucumber: Antioxidant-rich, non-sensitizing plant extract.,-Ubiquinone: A vital antioxidant that decreases with age, and has been shown to reduce the depth of fine lines and wrinkles.,,Water, Glycerin, Dicaprylyl Carbonate, Cetearyl Alcohol, Caprylic/Capric Triglyceride, Hydroxyethyl Acrylate/Sodium Acryloyldimethyl Taurate Copolymer, Sodium Ascorbyl Phosphate, Cetearyl Olivate, Sorbitan Olivate, Sclerocarya Birrea Seed Oil, Persea Gratissima (Avocado) Oil, Plukenetia Volubilis Seed Oil, Magnesium Ascorbyl Phosphate, Ceteareth-6 Olivate, Tetrahexyldecyl Ascorbate, Ascorbyl Glucoside, Ascorbyl Palmitate, Palmitoyl Tripeptide-1, Glycine Soja (Soybean) Sterols, Linoleic Acid, Phospholipids, Ceramide NP, Glycine Soja (Soybean) Protein, Ceramide AP, Phytosphingosine, Cholesterol, Ceramide EOP, Cucumis Sativus (Cucumber) Fruit Extract, Camellia Sinensis Leaf Extract, Palmitoyl Dipeptide-5 Diaminobutyroyl Hydroxythreonine, Palmitoyl Dipeptide-5 Diaminohydroxybutyrate, Dipeptide Diaminobutyroyl Benzylamide Diacetate, Sodium Hyaluronate Crosspolymer, C12-15 Alkyl Benzoate, Panthenol, Dipotassium Glycyrrhizate, Hesperidin Methyl Chalcone, Dipeptide-2, Palmitoyl Tetrapeptide-7, Fragaria Ananassa (Strawberry) Seed Extract, Medicago Sativa (Alfalfa) Extract, Morus Alba Leaf Extract, Hydrolyzed Rice Protein, Spilanthes Acmella Flower Extract, Aloe Barbadensis Leaf Juice, Ubiquinone, Superoxide Dismutase, Palmitoyl Tripeptide-38, Acetyl Hexapeptide-8, Pyrus Malus (Apple) Fruit Extract, Phytic Acid, Actinidia Chinensis (Kiwi) Fruit Extract, Vaccinium Myrtillus Leaf Extract, Tocopherol, Thioctic Acid, N-Hydroxysuccinimide, Chrysin, Mica, Ethylhexyl Palmitate, Phenoxyethanol, Pentylene Glycol, Sodium Lauroyl Lactylate, Titanium Dioxide, Hydroxypropyl Cyclodextrin, Sodium Benzoate, Xanthan Gum, Carbomer, Tocopheryl Acetate, Sodium Dextran Sulfate, Sorbitan Isostearate, Caprylyl Glycol, Steareth-20, Chlorhexidine Digluconate, Citric Acid, Chlorphenesin, Polysorbate 60, Potassium Sorbate, Ethylhexylglycerin.",https://www.sephora.com/product/c-tango-multivitamin-eye-cream-P429515?icid2=products%20grid:p429515:product
Drunk Elephant,The Littles™,A travel-sized collection that helps balance and reset your skin to a healthy youthful and glowing state.,['- Dullness and uneven texture- Dark spots and uneven skin tone- Dryness'], Developed to balance and reset your skin to a healthy youthful and glowing state Drunk Elephant’s small but mighty minis deliver unparalleled results when used together and are compatible with all skin types. ,"Beste™ No.9 Jelly Cleanser:,Water, Sodium Lauroyl Methyl Isethionate, Glycerin, Cocamidopropyl Betaine, Cocamidopropyl Hydroxysultaine, Sodium Methyl Oleoyl Taurate, Propanediol, Aloe Barbadensis Leaf Extract, Coco-Glucoside, Lauryl Glucoside, Cucumis Melo Cantalupensis Fruit Extract, Sclerocarya Birrea Seed Oil, Dipotassium Glycyrrhizate, Citric Acid, Phenoxyethanol, Sodium Benzoate, Sodium Chloride.,,C-Firma™ Day Serum:,Water, Ethoxydiglycol, Ascorbic Acid, Glycerin, Laureth-23, Lactobacillus/Pumpkin Ferment Extract, Sclerocarya Birrea Seed Oil, Ferulic Acid, Sodium Hyaluronate, Chondrus Crispus Extract, Camellia Sinensis Leaf Extract, Lactobacillus/Punica Granatum Fruit Ferment Extract, Glycyrrhiza Glabra (Licorice) Root Extract, Vitis Vinifera (Grape) Juice Extract, Phyllanthus Emblica Fruit Extract, Hydrolyzed Wheat Protein, Tocopherol, Caprylhydroxamic Acid, Acetyl Glucosamine, Hydrolyzed Quinoa, Glutamylamidoethyl Imidazole, Dipotassium Glycyrrhizate, Tetrahydrodiferuloylmethane, Tetrahydrodemethoxydiferuloylmethane, Tetrahydrobisdemethoxydiferuloylmethane, Sodium Hyaluronate Crosspolymer, Glycine, Sucrose, Maltodextrin, Propanediol, Caprylyl Glycol, Sodium Hydroxide, Xanthan gum, Hydroxyethyl Acrylate/Sodium Acryloyldimethyl Taurate Copolymer, Isohexadecane, Polysorbate 60.,,B-Hydra™ Intensive Hydration Serum:,Water,Coconut Alkanes, Ammonium Acryloyldimethyltaurate/VP Copolymer, Glycerin, Pentylene Glycol, Sclerocarya Birrea Seed Oil, Wheat Amino Acids, Ananas Sativus (Pineapple) Fruit Extract, Berberis Vulgaris Root Extract, Citrullus Lanatus (Watermelon) Fruit Extract, Lens Esculenta (Lentil) Fruit Extract, Pyrus Malus (Apple) Fruit Extract, Coco-Caprylate/Caprate, Panthenol, Sodium PCA, Sodium Hyaluronate Crosspolymer, Dipotassium Glycyrrhizate, Niacinamide, Cyclodextrin, Sodium Hyaluronate, Sodium Lactate, Phenoxyethanol, Hydroxyproline, Trisodium Ethylenediamine Disuccinate, Citric Acid, Caprylyl Glycol, Chlorphenesin, Ethylhexylglycerin.,,T.L.C. Framboos™ Glycolic Night Serum:,Water, Glycolic Acid, Butylene Glycol, Glycerin, Sodium Hydroxide, Salicylic Acid, Lactic Acid, Citric Acid, Vitis Vinifera (Grape) Juice Extract, Aloe Barbadensis Leaf Juice, Opuntia Ficus-Indica Extract, Aesculus Hippocastanum (Horse Chestnut) Seed Extract, Camellia Sinensis Leaf Extract, Rubus Idaeus (Raspberry) Fruit Extract, Saccharomyces Cerevisiae Extract, Buddleja Davidii Meristem Cell Culture, Sclerocarya Birrea Seed Oil, Sodium Hyaluronate Crosspolymer, Allantoin, Hydroxyethylcellulose, Galactoarabinan, Propanediol, Disodium EDTA, Xanthan Gum, Hexylene Glycol, Phenoxyethanol, Caprylyl Glycol, Ethylhexylglycerin, Sodium Nitrate, Potassium Sorbate, Pentylene Glycol, Sodium Benzoate.,,Virgin Marula Luxury Facial Oil:,Sclerocarya Birrea Seed OilLala Retro™Whipped CreamWater,Glycerin, Caprylic/ Capric Triglyceride, Isopropyl Isostearate, Pseudozyma Epicola/Camellia Sinensis Seed Oil/Glucose/Glycine Soja Meal/Malt Extract/Yeast Extract Ferment Filtrate (Pseudozyma Epicola/Camellia Sinensis Seed Oil/Glucose/Yeast Extract Ferment Filtrate), Stearic Acid, Glyceryl Stearate SE, Cetearyl Alcohol, Pentylene Glycol, Plantago Lanceolata Leaf Extract, Adansonia Digitata Seed Oil, Citrullus Lanatus (Watermelon) Seed Oil, Passiflora Edulis Seed Oil, Schinziophyton Rautanenii Kernel Oil, Sclerocarya Birrea Seed Oil, Polyglyceryl-6 Ximenia Americana Seedate, Sodium Hyaluronate Crosspolymer, Ceteareth-20, Trisodium Ethylenediamine Disuccinate, Sodium Hydroxide, Citric Acid, Carbomer, Xanthan Gum, Caprylyl Glycol, Chlorphenesin, Phenoxyethanol, Ethylhexylglycerin.,,Umbra™ Sheer Physical Daily Defense SPF 30:,Zinc Oxide 20%, Water, Caprylic/Capric Triglyceride, Dicaprylyl Carbonate, Glycerin,Pentylene Glycol, Steareth-2, Propanediol, Steareth-21, Polyhydroxystearic Acid, Cetearyl Alcohol, Silica, Sclerocarya Birrea Seed Oil, Aloe Barbadensis Leaf Extract, Chondrus Crispus Extract, Haematococcus Pluvialis Extract, Helianthus Annuus (Sunflower) Sprout Extract, Vitis Vinifera (Grape) Juice Extract, Helianthus Annuus (Sunflower) Seed Oil, Simmondsia Chinensis (Jojoba) Seed Oil, Raspberry Seed Oil/Tocopheryl Succinate Aminopropanediol Esters, Hydrolyzed Wheat Protein,Tocopheryl Acetate, Tocopherol, Sea Water, Acetyl Glucosamine, Cetearyl Glucoside, Sodium Stearoyl Glutamate, Tetrahexyldecyl Ascorbate, Glycine, Sucrose, Lecithin, Triethoxycaprylylsilane, Xanthan Gum, Trisodium Ethylenediamine Disuccinate, Caprylhydroxamic Acid, Mica, Caprylyl Glycol, Phenoxyethanol, Titanium Dioxide (CI 77891), Iron Oxides (CI 77491).,,Shaba Complex™ Eye Serum:,Water, Octyldodecanol, Glycerin, Boron Nitride, Saccharomyces/Xylinum/Black Tea Ferment, Coconut Alkanes, Cetyl Alcohol, Cetearyl Olivate, Sorbitan Olivate, Niacinamide, Copper Tripeptide-1, Leontopodium Alpinum Meristem Cell Culture, Dipeptide-2, Palmitoyl Tripeptide-1, Palmitoyl Tetrapeptide-7, Copper Lysinate/Prolinate, Hesperidin Methyl Chalcone, Chondrus Crispus (Carrageenan), Mangifera Indica (Mango) Seed Butter, Glycine Soja (Soybean) Oil, Hippophae Rhamnoides Oil, Sclerocarya Birrea Seed Oil, Sodium Hyaluronate Crosspolymer, Hydroxyethylcellulose, Coco-Caprylate/Caprate, Steareth-20, Lecithin, Panthenol, N-Hydroxysuccinimide, Ubiquinone, Citric Acid, Thioctic Acid, Tocopherol, Chrysin, Sclerotium Gum, Methylglucoside Phosphate, Xanthan Gum, Potassium Sorbate, Sodium Benzoate, Chlorphenesin, Caprylyl Glycol, Sodium Hydroxide, Phenoxyethanol, Pentylene Glycol, Ethylhexylglycerin.",https://www.sephora.com/product/the-littles-tm-P429239?icid2=products%20grid:p429239:product
