Brand,Product,What it is,what is product used for,If you want to know more,Ingredients,Item Link
Drunk Elephant,Protini™ Polypeptide Cream,A protein moisturizer that combines an unprecedented array and concentration of actives for improvement in the appearance of skin’s tone texture and firmness.,['- Loss of firmness and elasticity\xa0- Dryness\xa0- Dullness and uneven texture\xa0 '],[],"-9 Signal Peptide Complex ,-Pygmy Waterlily Stem Cell Extract ,-Soybean Folic Acid Ferment Extract ,,Water, Dicaprylyl Carbonate, Glycerin, Cetearyl Alcohol, Cetearyl Olivate, Sorbitan Olivate, Sclerocarya Birrea Seed Oil, Bacillus/Soybean/ Folic Acid Ferment Extract, Nymphaea Alba Root Extract, sh-Oligopeptide-1, sh-Oligopeptide-2, sh-Polypeptide-1, sh-Polypeptide-9, sh-Polypeptide-11, Copper Palmitoyl Heptapeptide-14, Heptapeptide-15 Palmitate, Palmitoyl Tetrapeptide-7, Palmitoyl Tripeptide-1, Alanine, Arginine, Glycine, Histidine, Isoleucine, Phenylalanine, Proline, Serine, Threonine, Valine, Acetyl Glutamine, Coconut Alkanes , Coco-Caprylate/Caprate, Sodium Hyaluronate, Aspartic Acid, Linoleic Acid, Linolenic Acid, Lecithin, Butylene Glycol, Polyvinyl Alcohol, Sodium Lactate, Sodium PCA, PCA, Sorbitan Isostearate, Carbomer, Polysorbate 20, Polysorbate 60, Lactic Acid/Glycolic Acid Copolymer, Hydroxyethyl Acrylate/Sodium Acryloyldimethyl Taurate Copolymer, Xanthan Gum, Isomalt, 1,2-Hexanediol, Caprylyl Glycol, Chlorphenesin, Phenoxyethanol, Tocopherol, Sodium Benzoate, Phenylpropanol, Glyceryl Caprylate, Symphytum Officinale Callus Culture Extract.",https://www.sephora.com/product/protini-tm-polypeptide-cream-P427421?icid2=products%20grid:p427421:product
Drunk Elephant,The Trunk,[],[],[],"T.L.C. Sukari Babyfacial™:,Water, Glycolic Acid, Hydroxyethyl Acrylate/Sodium Acryloyldimethyl Taurate Copolymer, Glycerin, Sodium Hydroxide, Salicylic Acid, Aloe Barbadensis Leaf Extract, Camellia Oleifera Leaf Extract, Lactobacillus/Pumpkin Ferment Extract, Lactobacillus/Punica Granatum Fruit Ferment Extract, Opuntia Ficus-Indica Extract, Pyrus Malus (Apple) Fruit Extract, Silybum Marianum Seed Extract, Saccharomyces Cerevisiae Extract, Vitis Vinifera (Grape) Juice Extract, Camellia Sinensis Leaf Powder, Cicer Arietinum Seed Powder, Sclerocarya Birrea Seed Oil, Passiflora Edulis Seed Oil, Leuconostoc/Radish Root Ferment Filtrate, Sodium Hyaluronate Crosspolymer, Sodium PCA, Allantoin, Dipotassium Glycyrrhizate, Dextrin, Polydextrose, Sorbitan Isostearate, Amylopectin, Niacinamide, Phytosphingosine, Lactic Acid, Propanediol, Citric Acid, Titanium Dioxide, Trisodium Ethylenediamine Disuccinate, Polysorbate 60, Caprylyl Glycol, Chlorphenesin, Phenoxyethanol.,,Beste™ No.9:,Water, Glycerin, Cocamidopropyl Betaine, Coco-Glucoside, Sodium Lauroyl Methyl Isethionate, Cocamidopropyl Hydroxysultaine, Sodium Methyl Oleoyl Taurate, Propanediol, Aloe Barbadensis Leaf Extract, Glycolipids, Linoleic Acid, Linolenic Acid, Lauryl Glucoside, Cucumis Melo Cantalupensis Fruit Extract, Sclerocarya Birrea Seed Oil, Dipotassium Glycyrrhizate, Tocopherol, Citric Acid, Phenoxyethanol, Sodium Hydroxide, Sodium Benzoate, Sodium Chloride, Polylysine.,,B-Hydra™ Intensive Hydration Serum:,Water, Coconut Alkanes, Ammonium Acryloyldimethyltaurate/VP Copolymer, Glycerin, Pentylene Glycol, Sclerocarya Birrea Seed Oil, Wheat Amino Acids, Ananas Sativus (Pineapple) Fruit Extract, Berberis Vulgaris Root Extract, Citrullus Lanatus (Watermelon) Fruit Extract, Lens Esculenta (Lentil) Fruit Extract, Pyrus Malus (Apple) Fruit Extract, Coco-Caprylate/Caprate, Panthenol, Sodium PCA, Sodium Hyaluronate Crosspolymer, Dipotassium Glycyrrhizate, Niacinamide, Cyclodextrin, Sodium Hyaluronate, Sodium Lactate, Phenoxyethanol, Hydroxyproline, Trisodium Ethylenediamine Disuccinate, Citric Acid, Caprylyl Glycol, Chlorphenesin, Ethylhexylglycerin.,,Virgin Marula Luxury Facial Oil:,100% Unrefined Sclerocraya Birrea (Marula) Kernel Oil.,,C-Tango™ Multivitamin Eye Cream:,Water, Glycerin, Dicaprylyl Carbonate, Cetearyl Alcohol, Caprylic/Capric Triglyceride, Hydroxyethyl Acrylate/Sodium Acryloyldimethyl Taurate Copolymer, Sodium Ascorbyl Phosphate, Cetearyl Olivate, Sorbitan Olivate, Sclerocarya Birrea Seed Oil, Persea Gratissima (Avocado) Oil, Plukenetia Volubilis Seed Oil, Magnesium Ascorbyl Phosphate, Ceteareth-6 Olivate, Tetrahexyldecyl Ascorbate, Ascorbyl Glucoside, Ascorbyl Palmitate, Palmitoyl Tripeptide-1, Glycine Soja (Soybean) Sterols, Linoleic Acid, Phospholipids, Ceramide NP, Glycine Soja (Soybean) Protein, Ceramide AP, Phytosphingosine, Cholesterol, Ceramide EOP, Cucumis Sativus (Cucumber) Fruit Extract, Camellia Sinensis Leaf Extract, Palmitoyl Dipeptide-5 Diaminobutyroyl Hydroxythreonine, Palmitoyl Dipeptide-5 Diaminohydroxybutyrate, Dipeptide Diaminobutyroyl Benzylamide Diacetate, Sodium Hyaluronate Crosspolymer, C12-15 Alkyl Benzoate, Panthenol, Dipotassium Glycyrrhizate, Hesperidin Methyl Chalcone, Dipeptide-2, Palmitoyl Tetrapeptide-7, Fragaria Ananassa (Strawberry) Seed Extract, Medicago Sativa (Alfalfa) Extract, Morus Alba Leaf Extract, Hydrolyzed Rice Protein, Spilanthes Acmella Flower Extract, Aloe Barbadensis Leaf Juice, Ubiquinone, Superoxide Dismutase, Palmitoyl Tripeptide-38, Acetyl Hexapeptide-8, Pyrus Malus (Apple) Fruit Extract, Phytic Acid, Actinidia Chinensis (Kiwi) Fruit Extract, Vaccinium Myrtillus Leaf Extract, Tocopherol, Thioctic Acid, N-Hydroxysuccinimide, Chrysin, Mica, Ethylhexyl Palmitate, Phenoxyethanol, Pentylene Glycol, Sodium Lauroyl Lactylate, Titanium Dioxide, Hydroxypropyl Cyclodextrin, Sodium Benzoate, Xanthan Gum, Carbomer, Tocopheryl Acetate, Sodium Dextran Sulfate, Sorbitan Isostearate, Caprylyl Glycol, Steareth-20, Chlorhexidine Digluconate, Citric Acid, Chlorphenesin, Polysorbate 60, Potassium Sorbate, Ethylhexylglycerin.,,Umbra Sheer™ Physical Daily Defense SPF 30:,Water, Caprylic/Capric Triglyceride, Dicaprylyl Carbonate, Glycerin, Pentylene Glycol, Steareth-2, Propanediol, Steareth-21, Polyhydroxystearic Acid, Cetearyl Alcohol, Silica, Sclerocarya Birrea Seed Oil, Aloe Barbadensis Leaf Extract, Chondrus Crispus Extract, Haematococcus Pluvialis Extract, Helianthus Annuus (Sunflower) Sprout Extract, Vitis Vinifera (Grape) Juice Extract, Helianthus Annuus (Sunflower) Seed Oil, Simmondsia Chinensis (Jojoba) Seed Oil, Raspberry Seed Oil/Tocopheryl Succinate Aminopropanediol Esters, Hydrolyzed Wheat Protein, Tocopheryl Acetate, Tocopherol, Sea Water, Acetyl Glucosamine, Cetearyl Glucoside, Sodium Stearoyl Glutamate, Tetrahexyldecyl Ascorbate, Glycine, Sucrose, Lecithin,Triethoxycaprylylsilane,Xanthan Gum, Trisodium Ethylenediamine Disuccinate, Caprylhydroxamic Acid, Mica, Caprylyl Glycol, Phenoxyethanol, Titanium Dioxide (CI 77891), Iron Oxides (CI 77491).,,Protini™ Polypeptide Cream:,Water, Dicaprylyl Carbonate, Glycerin, Cetearyl Alcohol, Cetearyl Olivate, Sorbitan Olivate, Sclerocarya Birrea Seed Oil, Bacillus/Soybean/ Folic Acid Ferment Extract, Nymphaea Alba Root Extract, sh-Oligopeptide-1, sh-Oligopeptide-2, sh-Polypeptide-1, sh-Polypeptide-9, sh-Polypeptide-11, Copper Palmitoyl Heptapeptide-14, Heptapeptide-15 Palmitate, Palmitoyl Tetrapeptide-7, Palmitoyl Tripeptide-1,Alanine, Arginine, Glycine, Histidine, Isoleucine, Phenylalanine, Proline, Serine, Threonine, Valine, Acetyl Glutamine, Coconut Alkanes, Coco-Caprylate/Caprate, Sodium Hyaluronate, Aspartic Acid, Linoleic Acid, Linolenic Acid, Lecithin, Butylene Glycol, Polyvinyl Alcohol, Sodium Lactate, Sodium PCA, PCA, Sorbitan Isostearate, Carbomer, Polysorbate 20, Polysorbate 60, Lactic Acid/Glycolic Acid Copolymer, Hydroxyethyl Acrylate/Sodium Acryloyldimethyl Taurate Copolymer, Xanthan Gum, Isomalt, 1,2-Hexanediol, Caprylyl Glycol, Chlorphenesin, Phenoxyethanol, Tocopherol, Sodium Benzoate, Phenylpropanol, Glyceryl Caprylate, Symphytum Officinale Callus Culture Extract.,,C-Firma™ Day Serum:,Water, Ethoxydiglycol, Ascorbic Acid, Glycerin, Laureth-23, Lactobacillus/Pumpkin Ferment Extract, Sclerocarya Birrea Seed Oil, Ferulic Acid, Sodium Hyaluronate, Chondrus Crispus Extract, Camellia Sinensis Leaf Extract, Lactobacillus/Punica Granatum Fruit Ferment Extract, Glycyrrhiza Glabra (Licorice) Root Extract, Vitis Vinifera (Grape) Juice Extract, Phyllanthus Emblica Fruit Extract, Hydrolyzed Wheat Protein, Tocopherol, Caprylhydroxamic Acid, Acetyl Glucosamine, Hydrolyzed Quinoa, Glutamylamidoethyl Imidazole, Dipotassium Glycyrrhizate, Tetrahydrodiferuloylmethane, Tetrahydrodemethoxydiferuloylmethane, Tetrahydrobisdemethoxydiferuloylmethane, Sodium Hyaluronate Crosspolymer, Glycine, Sucrose, Maltodextrin, Propanediol, Caprylyl Glycol, Sodium Hydroxide, Xanthan gum, Hydroxyethyl Acrylate/Sodium Acryloyldimethyl Taurate Copolymer, Isohexadecane, Polysorbate 60.,,TLC Framboos™ Glycolic Night Serum:,Water, Glycolic Acid, Butylene Glycol, Glycerin, Sodium Hydroxide, Salicylic Acid, Lactic Acid, Citric Acid, Vitis Vinifera (Grape) Juice Extract, Aloe Barbadensis Leaf Juice, Opuntia Ficus-Indica Extract, Aesculus Hippocastanum (Horse Chestnut) Seed Extract, Camellia Sinensis Leaf Extract, Rubus Idaeus (Raspberry) Fruit Extract, Saccharomyces Cerevisiae Extract, Buddleja Davidii Meristem Cell Culture, Sclerocarya Birrea Seed Oil, Sodium Hyaluronate Crosspolymer, Allantoin, Hydroxyethylcellulose, Galactoarabinan, Propanediol, Disodium EDTA, Xanthan Gum, Hexylene Glycol, Phenoxyethanol, Caprylyl Glycol, Ethylhexylglycerin, Sodium Nitrate, Potassium Sorbate, Pentylene Glycol, Sodium Benzoate.,,Lippe Balm:,Cocos Nucifera (Coconut) Oil, Sclerocarya Birrea Seed Oil, Butyrospermum Parkii (Shea) Butter, Caprylic/Capric Triglyceride, Bis-Diglyceryl Polyacyladipate-2, Beeswax/Cera Alba/Cire d’abeille, Ozokerite, Polyisobutene, Glycine Soja (Soybean) Oil, Copernicia Cerifera (Carnauba) Wax/Cera Carnauba/Cire de carnauba, Euphorbia Cerifera (Candelilla) Wax/Candelilla Cera/Cire de candelilla, Camellia Oleifera Leaf Extract, Dictyopteris Membranacea Extract, Magnolia Grandiflora Bark Extract, Carthamus Tinctorius (Safflower) Seed Oil, Persea Gratissima (Avocado) Oil, Schinziophyton Rautanenii (Mongongo) Kernel Oil, Vaccinium Macrocarpon (Cranberry) Seed Oil, Tocopheryl Acetate, Dipotassium Glycyrrhizate, Palmitoyl Tripeptide-1, Tetrahexyldecyl Ascorbate, Ethylhexyl Palmitate, Dicaprylyl Ether, Tribehenin, Sorbitan Isostearate, Lauryl Alcohol, Linoleic Acid, Linolenic Acid, Caprylyl Glycol, Phenoxyethanol.",https://www.sephora.com/product/the-trunk-P436923?icid2=products%20grid:p436923:product
Drunk Elephant,C-Firma™ Day Serum,A super-potent vitamin C day serum that is packed with a powerful antioxidant complex essential nutrients and fruit enzymes that all work together to firm and brighten the appearance of skin. ,['- Uneven skin tone- Loss of firmness and elasticity- Dullness and uneven texture'],[],"-Potent Antioxidant Complex (L-Ascorbic Acid Plus Ferulic Acid 15% and Vitamin E 1%): Works to firm and brighten the look and feel of skin.,-Chronocyclin: Mimics the antioxidant benefits of vitamin D for more youthful-looking skin.,-Pumpkin Ferment and Pomegranate Extract: Work together to enzymatically dissolve dead surface skin cells, minimizing the appearance of pores.,-Sodium Hyaluronate Crosspolymer: Hydrates, reduces the appearance of fine lines and wrinkles, and promotes firmness.,,Water, Ethoxydiglycol, Ascorbic Acid, Glycerin, Laureth-23, Lactobacillus/Pumpkin Ferment Extract, Sclerocarya Birrea Seed Oil, Ferulic Acid, Sodium Hyaluronate, Chondrus Crispus Extract, Camellia Sinensis Leaf Extract, Lactobacillus/Punica Granatum Fruit Ferment Extract, Glycyrrhiza Glabra (Licorice) Root Extract, Vitis Vinifera (Grape) Juice Extract, Phyllanthus Emblica Fruit Extract, Hydrolyzed Wheat Protein, Tocopherol, Caprylhydroxamic Acid, Acetyl Glucosamine, Hydrolyzed Quinoa, Glutamylamidoethyl Imidazole, Dipotassium Glycyrrhizate, Tetrahydrodiferuloylmethane, Tetrahydrodemethoxydiferuloylmethane, Tetrahydrobisdemethoxydiferuloylmethane, Sodium Hyaluronate Crosspolymer, Glycine, Sucrose, Maltodextrin, Propanediol, Caprylyl Glycol, Sodium Hydroxide, Xanthan gum, Hydroxyethyl Acrylate/Sodium Acryloyldimethyl Taurate Copolymer, Isohexadecane, Polysorbate 60.",https://www.sephora.com/product/c-firma-day-serum-P400259?icid2=products%20grid:p400259:product
Drunk Elephant,Inspector Drunk™ Night Kit,['A set with everything you need for your nighttime skincare routine. '],['- Dullness and uneven texture- Uneven skin tone- Loss of firmness and elasticity'], How to play: Using the magnifying glass search the ingredients in your current beauty routine for the six suspects (the #suspicious6) listed on the enclosed playing cards. Once you have located and set aside any products containing them you may begin taking #acleanbreak using the Inspector Drunk™ Night Kit to reset your skin back to a healthy balance. Products that do not contain the #suspicious6 may remain in the game. The winner is your skin.This set contains:- 1 oz/ 30 mL TLC Framboos™ Glycolic Night Serum- 1 oz/ 30 mL Beste™ No. 9 Jelly Cleanser- 0.27 oz/ 8 mL B-Hydra™ Intensive Hydration Serum- 0.5 oz/ 15 mL Lala Retro™ Whipped Cream- 0.17 oz/ 5 mL C-Tango™ Multivitamin Eye Cream,"Lala Retro™ Whipped Cream:,Water, Glycerin, Caprylic/ Capric Triglyceride, Isopropyl Isostearate, Pseudozyma Epicola/Camellia Sinensis Seed Oil/Glucose/Glycine Soja Meal/Malt Extract/Yeast Extract Ferment Filtrate (Pseudozyma Epicola/Camellia Sinensis Seed Oil/Glucose/Yeast Extract Ferment Filtrate), Stearic Acid, Glyceryl Stearate SE, Cetearyl Alcohol, Pentylene Glycol, Plantago Lanceolata Leaf Extract, Adansonia Digitata Seed Oil, Citrullus Lanatus (Watermelon) Seed Oil, Passiflora Edulis Seed Oil, Schinziophyton Rautanenii Kernel Oil, Sclerocarya Birrea Seed Oil, Polyglyceryl-6 Ximenia Americana Seedate, Sodium Hyaluronate Crosspolymer, Ceteareth-20, Trisodium Ethylenediamine Disuccinate, Sodium Hydroxide, Citric Acid, Carbomer, Xanthan Gum, Caprylyl Glycol, Chlorphenesin, Phenoxyethanol, Ethylhexylglycerin.,,Beste™ No.9:,Water, Glycerin, Cocamidopropyl Betaine, Coco-Glucoside, Sodium Lauroyl Methyl Isethionate, Cocamidopropyl Hydroxysultaine, Sodium Methyl Oleoyl Taurate, Propanediol, Aloe Barbadensis Leaf Extract, Glycolipids, Linoleic Acid, Linolenic Acid, Lauryl Glucoside, Cucumis Melo Cantalupensis Fruit Extract, Sclerocarya Birrea Seed Oil, Dipotassium Glycyrrhizate, Tocopherol, Citric Acid, Phenoxyethanol, Sodium Hydroxide, Sodium Benzoate, Sodium Chloride, Polylysine.,,B-Hydra™ Intensive Hydration Serum:,Water, Coconut Alkanes, Ammonium Acryloyldimethyltaurate/VP Copolymer, Glycerin, Pentylene Glycol, Sclerocarya Birrea Seed Oil, Wheat Amino Acids, Ananas Sativus (Pineapple) Fruit Extract, Berberis Vulgaris Root Extract, Citrullus Lanatus (Watermelon) Fruit Extract, Lens Esculenta (Lentil) Fruit Extract, Pyrus Malus (Apple) Fruit Extract, Coco-Caprylate/Caprate, Panthenol, Sodium PCA, Sodium Hyaluronate Crosspolymer, Dipotassium Glycyrrhizate, Niacinamide, Cyclodextrin, Sodium Hyaluronate, Sodium Lactate, Phenoxyethanol, Hydroxyproline, Trisodium Ethylenediamine Disuccinate, Citric Acid, Caprylyl Glycol, Chlorphenesin, Ethylhexylglycerin.,,C-Tango™ Multivitamin Eye Cream:,Water, Glycerin, Dicaprylyl Carbonate, Cetearyl Alcohol, Caprylic/Capric Triglyceride, Hydroxyethyl Acrylate/Sodium Acryloyldimethyl Taurate Copolymer, Sodium Ascorbyl Phosphate, Cetearyl Olivate, Sorbitan Olivate, Sclerocarya Birrea Seed Oil, Persea Gratissima (Avocado) Oil, Plukenetia Volubilis Seed Oil, Magnesium Ascorbyl Phosphate, Ceteareth-6 Olivate, Tetrahexyldecyl Ascorbate, Ascorbyl Glucoside, Ascorbyl Palmitate, Palmitoyl Tripeptide-1, Glycine Soja (Soybean) Sterols, Linoleic Acid, Phospholipids, Ceramide NP, Glycine Soja (Soybean) Protein, Ceramide AP, Phytosphingosine, Cholesterol, Ceramide EOP, Cucumis Sativus (Cucumber) Fruit Extract, Camellia Sinensis Leaf Extract, Palmitoyl Dipeptide-5 Diaminobutyroyl Hydroxythreonine, Palmitoyl Dipeptide-5 Diaminohydroxybutyrate, Dipeptide Diaminobutyroyl Benzylamide Diacetate, Sodium Hyaluronate Crosspolymer, C12-15 Alkyl Benzoate, Panthenol, Dipotassium Glycyrrhizate, Hesperidin Methyl Chalcone, Dipeptide-2, Palmitoyl Tetrapeptide-7, Fragaria Ananassa (Strawberry) Seed Extract, Medicago Sativa (Alfalfa) Extract, Morus Alba Leaf Extract, Hydrolyzed Rice Protein, Spilanthes Acmella Flower Extract, Aloe Barbadensis Leaf Juice, Ubiquinone, Superoxide Dismutase, Palmitoyl Tripeptide-38, Acetyl Hexapeptide-8, Pyrus Malus (Apple) Fruit Extract, Phytic Acid, Actinidia Chinensis (Kiwi) Fruit Extract, Vaccinium Myrtillus Leaf Extract, Tocopherol, Thioctic Acid, N-Hydroxysuccinimide, Chrysin, Mica, Ethylhexyl Palmitate, Phenoxyethanol, Pentylene Glycol, Sodium Lauroyl Lactylate, Titanium Dioxide, Hydroxypropyl Cyclodextrin, Sodium Benzoate, Xanthan Gum, Carbomer, Tocopheryl Acetate, Sodium Dextran Sulfate, Sorbitan Isostearate, Caprylyl Glycol, Steareth-20, Chlorhexidine Digluconate, Citric Acid, Chlorphenesin, Polysorbate 60, Potassium Sorbate, Ethylhexylglycerin.,,TLC Framboos™ Glycolic Night Serum:,Water, Glycolic Acid, Butylene Glycol, Glycerin, Sodium Hydroxide, Salicylic Acid, Lactic Acid, Citric Acid, Vitis Vinifera (Grape) Juice Extract, Aloe Barbadensis LeafJuice, Opuntia Ficus-Indica Extract, Aesculus Hippocastanum (Horse Chestnut) Seed Extract, Camellia Sinensis Leaf Extract, Rubus Idaeus (Raspberry) Fruit Extract, Saccharomyces Cerevisiae Extract, Buddleja Davidii Meristem Cell Culture, Sclerocarya BirreaSeed Oil, Sodium Hyaluronate Crosspolymer, Allantoin, Hydroxyethylcellulose, Galactoarabinan, Propanediol, Disodium EDTA, Xanthan Gum, Hexylene Glycol, Phenoxyethanol, Caprylyl Glycol, Ethylhexylglycerin, Sodium Nitrate, Potassium Sorbate, Pentylene Glycol, Sodium Benzoate.",https://www.sephora.com/product/inspector-drunk-night-kit-P436098?icid2=products%20grid:p436098:product
Drunk Elephant,T.L.C. Framboos™ Glycolic Night Serum,['A 12 percent AHA/BHA night serum that refines and resurfaces skin to reveal a smoother and more radiant complexion.'],['- Uneven skin tone- Dullness and uneven texture- Pores'],[],"-T.L.C. Framboos™ AHA Blend 12%: Exfoliates dead skin cells, resurfacing dull, uneven skin for a smoother, brighter, more even-looking complexion.,-Salicylic Acid (BHA) 1%: Loosens sebum to unclog pores while soothing skin.,-Raspberry Fruit Extract: Rehydrates and soothes damaged skin.,-Sodium Hyaluronate Crosspolymer: Hydrates and reduces the appearance of fine lines and wrinkles, while promoting firmness.,,Water, Glycolic Acid, Butylene Glycol, Glycerin, Sodium Hydroxide, Salicylic Acid, Lactic Acid, Citric Acid, Vitis Vinifera (Grape) Juice Extract, Aloe Barbadensis Leaf Juice, Opuntia Ficus-Indica Extract, Aesculus Hippocastanum (Horse Chestnut) Seed Extract, Camellia Sinensis Leaf Extract, Rubus Idaeus (Raspberry) Fruit Extract, Saccharomyces Cerevisiae Extract, Buddleja Davidii Meristem Cell Culture, Sclerocarya Birrea Seed Oil, Sodium Hyaluronate Crosspolymer, Allantoin, Hydroxyethylcellulose, Galactoarabinan, Propanediol, Disodium EDTA, Xanthan Gum, Hexylene Glycol, Phenoxyethanol, Caprylyl Glycol, Ethylhexylglycerin, Sodium Nitrate, Potassium Sorbate, Pentylene Glycol, Sodium Benzoate.",https://www.sephora.com/product/t-l-c-framboos-tm-glycolic-night-serum-P392246?icid2=products%20grid:p392246:product
