Brand,Product,Ingredients,Image Link,Item Link
MARIO BADESCU,"Facial Spray With Aloe, Herbs and Rosewater",Water/Aqua/Eau Propylene Glycol Aloe Barbadensis Leaf Juice Rosa Canina Extract Thymus Vulgaris (Thyme) Leaf Extract Fucus Vesiculosus Extract Gardenia Florida Fruit Extract Caprylyl Glycol Hexylene Glycol Polysorbate 20 Parfum (Fragrance) Phenoxyethanol Sodium Chloride Citronellol Geraniol CI 17200 (Red 33) CI 42090 (Blue 1),"https://images.ulta.com/is/image/Ulta/2209889?id=1WLaK2&fmt=jpg&fit=constrain,1&wid=100&hei=360&op_sharpen=1&resMode=bilin",https://www.ulta.com/facial-spray-with-aloe-herbs-rosewater?productId=xlsImpprod6200727
IT COSMETICS,Bye Bye Foundation Full Coverage Moisturizer with SPF 50+,Active: Titanium Dioxide 9.0% Zinc Oxide 6.3%. Inactive: Aqua/Water/Eau Snail Secretion Filtrate Phenyl Trimethicone Dimethicone Butylene Glycol Butylene Glycol Dicaprylate/Dicaprate Orbignya Oleifera Seed Oil Butyloctyl Salicylate Cetyl PEG/PPG-10/1 Dimethicone Cyclopentasiloxane Cyclohexasiloxane Magnesium Sulfate Polyglyceryl-4 Isostearate Dimethicone/Vinyl Dimethicone Crosspolymer Aluminum Hydroxide Hexyl Laurate Stearic Acid Calcium Stearate Caprylyl Glycol Triethoxycaprylylsilane Ethylhexylglycerin Citrus Limon (Lemon) Peel Oil Tocopheryl Acetate Sorbitan Isostearate Phenoxyethanol Citrus Aurantium Bergamia (Bergamot) Fruit Oil 12-Hexanediol Disodium Edta Citrus Aurantium Dulcis (Orange) Peel Oil Citrus Aurantifolia (Lime) Oil Niacinamide Hydrolyzed Hyaluronic Acid Lactobacillus/Kelp Ferment Filtrate Saccharomyces/Rice Ferment Filtrate Hydrolyzed Silk Aloe Barbadensis Leaf Extract Cholesteryl Nonanoate Cholesteryl Isostearate Cholesteryl Chloride Punica Granatum Seed Oil Lactobacillus/Pumpkin Ferment Extract Cholesterol Vitis Vinifera (Grape) Seed Oil Cholesteryl Oleyl Carbonate Persea Gratissima (Avocado) Oil Pinus Sylvestris Leaf Oil Polymethylsilsesquioxane Anthemis Nobilis Flower Water Lactobacillus/Dipteryx Odorata Seed Ferment Filtrate Panax Ginseng Root Extract Avena Sativa (Oat) Kernel Extract Cocos Nucifera (Coconut) Fruit Extract Saccharum Officinarum (Sugar Cane) Extract Hydrolyzed Collagen Caprylhydroxamic Acid Tocopherol Thiamine HCl Riboflavin Retinyl Palmitate Pantothenic Acid Niacin Folic Acid Carnitine HCl Biotin Ascorbic Acid Bacillus/Cordyceps Sinensis/Ganoderma Lucidum/Inonotus Obliquus/Lentinus Edodes/Phellinus Linteus/Schizophyllum Commune/Tricholoma Matsutake Extract Ferment Filtrate Phaseolus Angularis Seed Extract Lactobacillus/Rice Ferment Filtrate Saccharomyces/Camellia Sinensis Extract Ferment Filtrate Lactobacillus Ferment Lactobacillus/Centella Asiatica/Gleditsia Sinensis Thorn/Houttuynia Cordata Extract/Phellodendron Amurense Bark/Polygonum Cuspidatum Root/Prunella Vulgaris/Torilis Japonica Extract Ferment Filtrate Eucalyptus Globulus Leaf Oil Curcuma Longa (Turmeric) Root Extract Magnolia Kobus Bark Extract Lactobacillus/Honeysuckle Flower/Licorice Root/Morus Alba Root/Pueraria Lobata Root/Schizandra Chinensis Fruit/Scutellaria Baicalensis Root/Sophora Japonica Flower Extract Ferment Filtrate Glycine Soja (Soybean) Sprout Extract Perfluorohexane Glycerin Leuconostoc/Radish Root Ferment Filtrate Camellia Sinensis Leaf Extract Silk Extract Perfluorodecalin Olea Europaea (Olive) Leaf Extract Chrysanthemum Indicum Flower Extract Diamond Powder Morus Alba Fruit Extract Pueraria Lobata Root Extract Cinnamomum Cassia Bark Extract Artemisia Princeps Leaf Extract Diospyros Kaki Leaf Extract N-Hydroxysuccinimide Palmitoyl Oligopeptide Chrysin Palmitoyl Tetrapeptide-7 Pentafluoropropane Steareth-20 Citric Acid Sodium Benzoate Potassium Sorbate Chlorhexidine Digluconate. May Contain: Iron Oxides (CI 77492 CI 77491 CI 77499),"https://images.ulta.com/is/image/Ulta/2523624?id=LMpaY1&fmt=jpg&fit=constrain,1&wid=99&hei=362&op_sharpen=1&resMode=bilin",https://www.ulta.com/bye-bye-foundation-full-coverage-moisturizer-with-spf-50?productId=xlsImpprod17611001
CLINIQUE,Moisture Surge 72 Hour Auto-Replenishing Hydrator,Water\Aqua\Eau Dimethicone Butylene Glycol Glycerin Trisiloxane Trehalose Sucrose Ammonium Acryloyldimethyltaurate/Vp Copolymer Hydroxyethyl Urea Camellia Sinensis (Green Tea) Leaf Extract Silybum Marianum (Lady'S Thistle) Extract Betula Alba (Birch) Bark Extract Saccharomyces Lysate Extract Aloe Barbadensis Leaf Water Thermus Thermophillus Ferment Caffeine Sorbitol Palmitoyl Hexapeptide-12 Sodium Hyaluronate Caprylyl Glycol Oleth-10 Sodium Polyaspartate Saccharide Isomerate Hydrogenated Lecithin Tocopheryl Acetate Acrylates/C10-30 Alkyl Acrylate Crosspolymer Glyceryl Polymethacrylate Tromethamine PEG-8 Hexylene Glycol Magnesium Ascorbyl Phosphate Disodium EDTA BHT Phenoxyethanol Red 4 (CI 14700) Yellow 5 (CI 19140),"https://images.ulta.com/is/image/Ulta/2521825?id=__YaF2&fmt=jpg&fit=constrain,1&wid=260&hei=305&op_sharpen=1&resMode=bilin",https://www.ulta.com/moisture-surge-72-hour-auto-replenishing-hydrator?productId=xlsImpprod17391255
IT COSMETICS,Confidence in a Cream Moisturizing Super Cream,Water/Aqua/Eau Butylene Glycol Cyclopentasiloxane Glycerin Butylene Glycol Dicaprylate / Dicaprate Ethylhexyl Isononanoate Hydrogenated Polyisobutene Caprylic / Capric / Myristic / Stearic Triglyceride Glyceryl Stearate PEG - 100 Stearate Polyglyceryl - 3 Methylglucose Distearate Stearyl Behenate Dimethicone Pentaerythrityl Tetraethylhexanoate Biosaccharide Gum - 1 Dimethicone / Vinyl Dimethicone Crosspolymer Cetearyl Alcohol Palmitic Acid Stearic Acid Polyethylene PEG / PPG - 20 / 15 Dimethicone Phenyl Methicone Portulaca Oleracea Extract Cocos Nucifera (Coconut) Oil Aloe Barbadensis Leaf Extract Butyrospermum Parkii (Shea) Butter Hydroxyethyl Acrylate / Sodium Acryloyldimethyl Taurate Copolymer Sodium Hyaluronate Hydrogenated Lecithin Polyquaternium - 51 Niacinamide Hydrolyzed Collagen Camellia Sinensis Leaf Extract Tocopheryl Acetate Carbomer PEG - 150 Distearate Ceramide Ap Glycosphingolipids Glyceryl Polymethacrylate Meadowfoam Estolide Sorbitan Isostearate Squalane Palmitoyl Pentapeptide - 4 Polysorbate 20 Steareth - 20 N - Hydroxysuccinimide Chrysin Palmitoyl Tripeptide - 1 Palmitoyl Tetrapeptide - 7 Polysorbate 60 Aleuritic Acid Yeast Extract Glycoproteins Betaine Hydrogenated Polydecene Ceramide NP Allantoin Colloidal Oatmeal Retinyl Retinoate Polylactic Acid Canola Oil Cholesteryl Nonanoate Ascorbyl Tetraisopalmitate Glycyrrhiza Glabra (Licorice) Root Extract Chamomilla Recutita (Matricaria) Flower Water Curcuma Longa (Turmeric) Root Extract Leuconostoc/Radish Root Ferment Filtrate Eruca Sativa Leaf Extract Glyceryl Citrate / Lactate/Linoleate / Oleate Ceteareth - 20 Hydroxypropyl Bispalmitamide Mea Glycine Soja (Soybean) Sterols Melaleuca Alternifolia (Tea Tree) Leaf Oil  Phytosteryl/Isostearyl/Cetyl/Stearyl/Behenyl Dimer Dilinoleate Santalum Album (Sandalwood) Oil Chamomilla Recutita (Matricaria) Flower Oil Caprylhydroxamic Acid Cetearyl Glucoside Glucose Stearyl Stearate Tromethamine Citric Acid 1 2 - Hexanediol Chlorhexidine Digluconate Potassium Sorbate Dipropylene Glycol Lavandula Angustifolia (Lavender) Oil Citrus Paradisi (Grapefruit) Peel Oil Cymbopogon Citratus Leaf Oil Pelargonium Graveolens Oil Citrus Aurantium Dulcis (Orange) Peel Oil Pogostemon Cablin Oil Citrus Aurantium Bergamia (Bergamot) Fruit Oil Ethylhexylglycerin Caramel Disodium EDTA Phenoxyethanol Caprylyl Glycol Limonene Linalool,"https://images.ulta.com/is/image/Ulta/2298658?id=tn0bU0&fmt=jpg&fit=constrain,1&wid=260&hei=141&op_sharpen=1&resMode=bilin",https://www.ulta.com/confidence-in-a-cream-moisturizing-super-cream?productId=xlsImpprod13641053
MARIO BADESCU,Spritz. Mist. Glow. Set,Facial Spray with Aloe Cucumber and Green Tea: Aqua (Water Eau) Propylene Glycol Mentha Piperita (Peppermint) Leaf Water Cucumis Sativus (Cucumber) Fruit Water Aloe Barbadensis Leaf Juice Camellia Sinensis Leaf Extract Cucumis Sativus (Cucumber) Fruit Extract Fucus Vesiculosus Extract Propanediol Polysorbate 20 Ethylhexylglycerin Benzophenone-4 Parfum (Fragrance) Sodium Chloride Citric Acid Potassium Sorbate Sodium Benzoate CI 19140 (Yellow 5) CI 42090 (Blue 1) Hexyl Cinnamal Limonene Linalool.<br/><br/>Facial Spray with Aloe Herbs and Rosewater: Aqua (Water Eau) Propylene Glycol Aloe Barbadensis Leaf Juice Rosa Canina Extract Thymus Vulgaris (Thyme) Leaf Extract Fucus Vesiculosus Extract Gardenia Florida Fruit Extract Caprylyl Glycol Hexylene Glycol Polysorbate 20 Parfum (Fragrance) Phenoxyethanol Sodium Chloride Citronellol Geraniol CI 17200 (Red 33) CI 42090 (Blue 1).<br/><br/>Facial Spray with Aloe Chamomile and Lavender: Aqua (Water Eau) Lavandula Angustifolia (Lavender) Flower Water Propylene Glycol Polysorbate 20 Aloe Barbadensis Leaf Juice Lavandula Angustifolia (Lavender) Oil Chamomilla Recutita (Matricaria) Flower Extract Fucus Vesiculosus Extract Ethyl Ascorbic Acid Thymus Vulgaris (Thyme) Leaf Extract Silver Citrate Potassium Sorbate Sodium Benzoate Benzophenone-4 Triethanolamine Zeolite Sodium Sulfate Citric Acid Sodium Chloride CI 60730 (Violet 2),"https://images.ulta.com/is/image/Ulta/2523667?id=ErQai2&fmt=jpg&fit=constrain,1&wid=260&hei=199&op_sharpen=1&resMode=bilin",https://www.ulta.com/spritz-mist-glow-set?productId=xlsImpprod17671011
CLINIQUE,Dramatically Different Moisturizing Lotion+,Water / Aqua / Eau Mineral Oil / Paraffinum Liquidum / Huile Minérale Glycerin Petrolatum Stearic Acid Glyceryl Stearate Sesamum Indicum (Sesame) Oil Urea Lanolin Alcohol Triethanolamine Hordeum Vulgare (Barley) Extract / Extrait D'Orge Cucumis Sativus (Cucumber) Fruit Extract Helianthus Annuus (Sunflower) Seedcake Propylene Glycol Dicaprate Sodium Hyaluronate Butylene Glycol Pentylene Glycol Trisodium EDTA Phenoxyethanol Yellow 6 (CI 15985) Yellow 5 (CI 19140) Red 33 (CI 17200),"https://images.ulta.com/is/image/Ulta/2261902?id=JghbW3&fmt=jpg&fit=constrain,1&wid=151&hei=361&op_sharpen=1&resMode=bilin",https://www.ulta.com/dramatically-different-moisturizing-lotion?productId=xlsImpprod10791743
NEUTROGENA,Hydro Boost Water Gel,Water Dimethicone Glycerin Dimethicone/Vinyl Dimethicone Crosspolymer Phenoxyethanol Polyacrylamide Cetearyl Olivate Sorbitan Olivate Dimethiconol C13_14 Isoparaf_n Dimethicone Crosspolymer Chlorphenesin Carbomer Laureth_7 Sodium Hyaluronate Ethylhexylglycerin Fragrance C12_14 Pareth_12 Sodium Hydroxide Blue 1,"https://images.ulta.com/is/image/Ulta/2284291?id=vmvaf3&fmt=jpg&fit=constrain,1&wid=260&hei=249&op_sharpen=1&resMode=bilin",https://www.ulta.com/hydro-boost-water-gel?productId=xlsImpprod12041835
MARIO BADESCU,"Facial Spray with Aloe, Cucumber and Green Tea",Water/Aqua/Eau Propylene Glycol Mentha Piperita (Peppermint) Leaf Water Cucumis Sativus (Cucumber) Fruit Water Aloe Barbadensis Leaf Juice Camellia Sinensis Leaf Extract Cucumis Sativus (Cucumber) Fruit Extract Fucus Vesiculosus Extract Propanediol Polysorbate 20 Ethylhexylglycerin Benzophenone-4 Parfum (Fragrance) Sodium Chloride Citric Acid Potassium Sorbate Sodium Benzoate CI 19140 (Yellow 5) CI 42090 (Blue 1) Hexyl Cinnamal Limonene Linalool,"https://images.ulta.com/is/image/Ulta/2507284?id=nqBaM0&fmt=jpg&fit=constrain,1&wid=100&hei=360&op_sharpen=1&resMode=bilin",https://www.ulta.com/facial-spray-with-aloe-cucumber-green-tea?productId=xlsImpprod15471023
CLINIQUE,Dramatically Different Moisturizing Gel,Water / Aqua / Eau Dimethicone Isododecane Butylene Glycol Bis-PEG-18 Methyl Ether Dimethyl Silane Glycerin Laminaria Saccharina Extract Polygonum Cuspidatum Root Extract Saccharomyces Lysate Extract Cucumis Sativus (Cucumber) Fruit Extract Hordeum Vulgare (Barley) Extract / Extrait D'Orge Helianthus Annuus (Sunflower) Seedcake Caffeine Trehalose Sodium Hyaluronate Tocopheryl Acetate Chamomilla Recutita (Matricaria) Polysilicone-11 Silica Propylene Glycol Dicaprate Oleth-10 Lactobacillus Ferment Laureth-23 Laureth-4 Ammonium Acryloyldimethyltaurate / VP Copolymer Carbomer Caprylyl Glycol Hexylene Glycol Tromethamine Disodium EDTA Phenoxyethanol Potassium Sorbate Yellow 5 (CI 19140) Red 4 (CI 14700) Yellow 6 (CI 15985),"https://images.ulta.com/is/image/Ulta/2153924?id=qcSaM0&fmt=jpg&fit=constrain,1&wid=152&hei=360&op_sharpen=1&resMode=bilin",https://www.ulta.com/dramatically-different-moisturizing-gel?productId=xlsImpprod10791745
STRIVECTIN,TL Advanced Tightening Neck Cream Plus,Water/Aqua/Eau Butyrospermum Parkii (Shea) Butter Butylene Glycol Glycerin Isononyl Isononanoate Caprylic/Capric Triglyceride Myristyl Nicotinate C12-15 Alkyl Benzoate Glyceryl Stearate PEG-100 Stearate Hydrogenated Ethylhexyl Olivate Dimethicone Stearyl Alcohol Cetyl Alcohol Pentylene Glycol Steareth-2 Behenyl Alcohol Ethylene/Acrylic Acid Copolymer Brassica Campestris (Rapeseed) Seed Oil Sorghum Bicolor Stalk Juice Sorbitan Laurate Tetrapeptide-21 Ceramide NG Hydrolyzed Hyaluronic Acid Plukenetia Volubilis Seed Oil/Oleic Acid Aminopropanediol Amides/Esters Acetyl Dipeptide-1 Cetyl Ester C13-14 Isoparaffin Fragrance (Parfum) Polyglyceryl-3 Diisostearate Glycyrrhiza Glabra (Licorice) Root Extract Cyathea Cumingii Leaf Extract Arctostaphylos Uva Ursi Leaf Extract Zingiber Officinale (Ginger) Root Extract Plantago Lanceolata Leaf Extract Nannochloropsis Oculata Extract Althaea Officinalis Root Extract Oryza Sativa (Rice) Bran Extract Bisabolol Pullulan Panthenol Hydrogenated Olive Oil Unsaponifiables Laureth-7 Polyacrylamide Acrylates/C10-30 Alkyl Acrylate Crosspolymer Sodium Polystyrene Sulfonate Xanthan Gum Hydroxyethylcellulose Sodium Hydroxide Lactic Acid Tetrasodium EDTA BHT Caprylyl Glycol Phenoxyethanol Chlorphenesin Poloxamer Silica Arachidyl Alcohol Lignoceryl Alcohol Glyceryl Caprylate Cinnamic Acid Levulinic Acid Sodium Levulinate Citric Acid Sodium Benzoate Potassium Sorbate Sorbic Acid Benzoic Acid Benzyl Alcohol Limonene,"https://images.ulta.com/is/image/Ulta/2533950?id=PuIaK2&fmt=jpg&fit=constrain,1&wid=260&hei=254&op_sharpen=1&resMode=bilin",https://www.ulta.com/tl-advanced-tightening-neck-cream-plus?productId=xlsImpprod18931446
DERMALOGICA,Active Moist,Water/Aqua/Eau Caprylic/Capric Triglyceride Methyl Gluceth-20 Pentylene Glycol Butylene Glycol Dimethicone Lactamide MEA Ethylhexyl Methoxycinnamate PEG-100 Stearate Cetearyl Alcohol Stearic Acid Glyceryl Stearate Lavandula Angustifolia (Lavender) Extract Malva Sylvestris (Mallow) Flower/Leaf/Stem Extract Hedera Helix (Ivy) Leaf/Stem Extract Cucumis Sativus (Cucumber) Fruit Extract Sambucus Nigra Flower Extract Arnica Montana Flower Extract Parietaria Officinalis Extract Nasturtium Officinale Flower/Leaf Extract Arctium Lappa Root Extract Salvia Officinalis (Sage) Leaf Extract Citrus Medica Limonum (Lemon) Fruit Extract Saponaria Officinalis Leaf/Root Extract Silk Amino Acids Glycolipids Sodium Hyaluronate Leuconostoc/Radish Root Ferment Filtrate Palmitoyl Hydroxypropyltrimonium Amylopectin/Glycerin Crosspolymer Lecithin Vitis Vinifera (Grape) Seed Extract Allantoin Panthenol Cetyl Alcohol Polyquaternium-10 Acrylates/C10-30 Alkyl Acrylate Crosspolymer Polysorbate 60 Aminomethyl Propanol Disodium EDTA Linalool Lavandula Hybrida Oil,"https://images.ulta.com/is/image/Ulta/2152590?id=f4vap0&fmt=jpg&fit=constrain,1&wid=115&hei=361&op_sharpen=1&resMode=bilin",https://www.ulta.com/active-moist?productId=VP12690
FIRST AID BEAUTY,Ultra Repair Cream,Water/Aqua/Eau Stearic Acid Glycerin C12-15 Alkyl Benzoate Caprylic/Capric Triglyceride Glyceryl Stearate Se Glyceryl Stearate Cetearyl Alcohol Butyrospermum Parkii Butter Dimethicone Squalane Allantoin Camellia Sinensis Leaf Extract Caprylyl Glycol Ceramide 3 Chrysanthemum Parthenium Extract Colloidal Oatmeal Disodium EDTA Eucalyptus Globulus Leaf Oil Glycyrrhiza Glabra Root Extract Sodium Hydroxide Xanthan Gum Phenoxyethanol,"https://images.ulta.com/is/image/Ulta/2295764?id=p0WaQ1&fmt=jpg&fit=constrain,1&wid=260&hei=288&op_sharpen=1&resMode=bilin",https://www.ulta.com/ultra-repair-cream?productId=xlsImpprod13491031
PHILOSOPHY,Renewed Hope In A Jar,Aqua/Water/Eau Cyclopentasiloxane Stearic Acid Glycerin Butylene Glycol C12-15 Alkyl Benzoate Glycolic Acid Dimethicone Polyacrylamide Cetearyl Alcohol Phenoxyethanol Sodium Hydroxide C13-14 Isoparaffin Dimethicone Crosspolymer Ceteareth-20 Ammonium Acryloyldimethyltaurate/Vp Copolymer Polysilicone-11 Acrylates/C10-30 Alkyl Acrylate Crosspolymer Laureth-7 Citric Acid Chlorphenesin Mandelic Acid Tocopheryl Acetate Synthetic Fluorphlogopite Ethlhexyl Palmitate Propanediol Parfum/Fragrance Disodium EDTA Adenosine Evodia Rutaecarpa Fruit Extract Limonene Faex/Yeast Extract/Extrait De Levure Magnesium Stearate Opuntia Coccinellifera Flower Extract Silica Dimethyl Silylate Caprylyl Glycol BHT Ethylhexylglycerin Hyaluronic Acid Silanetriol Sodium Hyaluronate Sorbic Acid Hexylene Glycol Bismuth Oxychloride (CI 77163),"https://images.ulta.com/is/image/Ulta/2281911?id=effbe2&fmt=jpg&fit=constrain,1&wid=260&hei=313&op_sharpen=1&resMode=bilin",https://www.ulta.com/renewed-hope-in-a-jar?productId=xlsImpprod11751089
MURAD,Multi-Vitamin Infusion Oil,Coconut Alkanes Simmondsia Chinensis (Jojoba) Seed Oil Cocos Nucifera (Coconut) Oil Moringa Oleifera Seed Oil Coco-Caprylate/Caprate Ethylene/Propylene/Styrene Copolymer Tocopheryl Acetate Tetrahexyldecyl Ascorbate Cannabis Sativa Seed Oil Rosa Canina Seed Oil Retinyl Propionate Linoleic Acid Linolenic Acid Tocopherol Panthenyl Triacetate Hexylresorcinol 7-Dehydrocholesterol Salicylic Acid Punica Granatum Sterols Rosmarinus Officinalis (Rosemary) Leaf Extract Oryza Sativa (Rice) Bran Extract Helianthus Annuus (Sunflower) Extract Zea Mays (Corn) Oil Butylene/Ethylene/Styrene Copolymer Fragrance (Parfum) Citral Linalool Limonene,"https://images.ulta.com/is/image/Ulta/2521324?id=Jxoac2&fmt=jpg&fit=constrain,1&wid=92&hei=361&op_sharpen=1&resMode=bilin",https://www.ulta.com/multi-vitamin-infusion-oil?productId=xlsImpprod17491041
DERMALOGICA,Dynamic Skin Recovery Broad Spectrum SPF 50,Active: Avobenzone (3.0%) Octinoxate (7.5%) Octisalate (5.0%) Oxybenzone (5.0%). Inactive: Water/Aqua/Eau Octyldodecyl Neopentanoate Butylene Glycol Pentylene Glycol Arachidyl Alcohol Behenyl Alcohol Nylon-12 Leuconostoc/Radish Root Ferment Filtrate Arachidyl Glucoside Allantoin Glycine Soja (Soybean) Protein Sodium Hyaluronate Saccharomyces Lysate Extract Oenothera Biennis (Evening Primrose) Oil Glucosamine HCI Squalane Algae Extract Yeast Extract Urea Palmitoyl Tripeptide-5 Arginine/Lysine Polypeptide Camellia Sinensis Leaf Extract Chrysanthemum Parthenium (Feverfew) Extract Colloidal Oatmeal Hydroxyethyl Acrylate/Sodium Acryloyldimethyl Taurate Copolymer Squalane Polysorbate 60. Cocamidopropyl PG_Dimonium Chloride Phosphate Glycerin Hydroxyethyl Acrylate/Sodium Acryloyldimethyl Taurate Copolymer Disodium EDTA Citronellol Geraniol Limonene Linalool Healianthus Annuus (Sunflower) Seed Oil Rose Flower Oil Citrus Medica Limonum (Lemon) Peel Oil Pelargonium Graveolens Oil Citrus Medica Limonum (Lemon) Peel Extract Eugenia Caryophyllus (Clove) Flower Oil Pelargonium Graveolens Flower Oil Aniba Rosaeodora (Rosewood) Wood Oil,"https://images.ulta.com/is/image/Ulta/2274104?id=dR5bu3&fmt=jpg&fit=constrain,1&wid=88&hei=361&op_sharpen=1&resMode=bilin",https://www.ulta.com/dynamic-skin-recovery-broad-spectrum-spf-50?productId=xlsImpprod6490064
NARS,Pure Radiant Tinted Moisturizer,St. Moritz: Water Dimethicone Butylene Glycol Propanediol Diethylhexyl Succinate Glycerin Nylon-12 Cyclomethicone PEG-9 Polydimethylsiloxyethyl Dimethicone PEG-10 Dimethicone Aluminum Hydroxide Sorbitan Sesquiisostearate Disteardimonium Hectorite Diphenylsiloxy Phenyl Trimethicone Stearic Acid Phenoxyethanol Polymethylsilsesquioxane Fragrance Trisodium EDTA Dimethicone/Vinyl Dimethicone Crosspolymer Aluminum Distearate Ascorbyl Glucoside Polysilicone-2 Vibrio Alginolyticus Ferment Filtrate Talc Tocopherol Alteromonas Ferment Filtrate Sea Salt BHT Algae Extract Sodium Metabisulfite Hydrogen Dimethicone Curcuma Longa (Turmeric) Root Extract Potassium Sorbate. May Contain: Titanium Dioxide Iron Oxides,"https://images.ulta.com/is/image/Ulta/2504413?id=xdsal3&fmt=jpg&fit=constrain,1&wid=166&hei=360&op_sharpen=1&resMode=bilin",https://www.ulta.com/pure-radiant-tinted-moisturizer?productId=xlsImpprod15251329
NO7,Lift and Luminate Triple Action Night Cream,Aqua (Water) Glycerin Butyrospermum parkii (Shea) butter Cyclopentasiloxane Steareth-21 Caprylic/capric triglyceride C12-15 alkyl benzoate Cyclohexasiloxane Dimethicone Steareth-2 Glyceryl stearate Cetearyl alcohol Polyacrylamide Butylene glycol Alcohol denat. C13-14 isoparaffin Phenoxyethanol Dimethiconol Caprylyl glycol Ascorbyl glucoside Laureth-7 Parfum (Fragrance) Propylene glycol Sodium benzoate Tocopheryl acetate Sodium hyaluronate Pentylene glycol Hibiscus abelmoschus extract Ethylhexylglycerin Retinyl palmitate Phyllanthus emblica fruit extract Hydrolyzed rice protein Tetrasodium EDTA Sorbitan laurate Panax ginseng root extract Carbomer Dipropylene glycol Dimethylmethoxy chromanol Xanthan gum Polysorbate 20 Hydroxyethylcellulose Acetyl dipeptide-1 cetyl ester Morus alba leaf extract Tocopherol Palmitoyl tripeptide-1 Palmitoyl tetrapeptide-7,"https://images.ulta.com/is/image/Ulta/2521838?id=GIPab3&fmt=jpg&fit=constrain,1&wid=260&hei=214&op_sharpen=1&resMode=bilin",https://www.ulta.com/lift-luminate-triple-action-night-cream?productId=xlsImpprod17162831
CREPE ERASE,Intensive Body Repair Treatment,Water (Aqua) Butyrospermum Parkii (Shea) Butter Theobroma Cacao (Cocoa) Seed Butter Cocos Nucifera (Coconut) Oil Olea Europaea (Olive) Fruit Oil Cetearyl Alcohol PEG-6 Dimethicone Cetyl Alcohol Beeswax (Cera Alba) Butylene Glycol Polysorbate 60 Tocopheryl Acetate BHT Olea Europaea (Olive) Fruit Extract Peucedanum Graveolens (Dill) Extract Malus Sylvestris Flower Extract Maltooligosyl Glucoside Hydrogenated Starch Hydrolysate Humic Acids Ursolic Acid Ethylhexylglycerin Ceteareth-20 Hydroxypropyl Guar Disodium EDTA Xanthan Gum Phenoxyethanol Chlorphenesin,"https://images.ulta.com/is/image/Ulta/2525117?id=kkYaz1&fmt=jpg&fit=constrain,1&wid=260&hei=260&op_sharpen=1&resMode=bilin",https://www.ulta.com/intensive-body-repair-treatment?productId=xlsImpprod17441019
DERMALOGICA,Age Smart Super Rich Repair,Water/Aqua/Eau Isohexadecane Dipropylene Glycol Caprylic/Capric/Myristic/Stearic Triglyceride Lauryl PEG-9 Polydimethylsiloxyethyl Dimethicone Simmondsia Chinensis (Jojoba) Seed Oil Butyrospermum Parkii (Shea Butter) Dimethicone Glycerin Octyldodecyl Neopentanoate Sodium Chloride Isostearic Acid Arginine/Lysine Polypeptide Palmitoyl Tripeptide-5 Avena Sativa (Oat) Kernel Extract Pyrus Malus (Apple) Seed Extract Borago Officinalis Seed Oil Oenothera Biennis (Evening Primrose) Oil Hydrogenated Coconut Oil Gardenia Tahitensis Flower Algae Extract Yeast Extract Glucosamine HC Tocopheryl Acetate Sodium Hyaluronate Colloidal Oatmeal Madecassoside Urea Hexyldecanol Polyglyceryl-4 Isostearate Cetyl Dimethicone Hydrogenated Castor Oil Butylene Glycol Phenoxyethanol Caprylyl Glycol Ethylhexylglycerin Hexylene Glycol Linalool Citronellol Geraniol Cedrus Atlantica Bark Oil Cupressus Sempervirens Leaf/Stem Extract Eucalyptus Globulus Leaf Oil Helianthus Annuus (Sunflower) Seed Oil Pelargonium Graveolens Flower Oil Aniba Rosaeodora (Rosewood) Wood Oil Abies Sibirica Oil Santalum Album (Sandalwood) Oil,"https://images.ulta.com/is/image/Ulta/2152651?id=1vBaY1&fmt=jpg&fit=constrain,1&wid=167&hei=360&op_sharpen=1&resMode=bilin",https://www.ulta.com/age-smart-super-rich-repair?productId=prod2152651
JUICE BEAUTY,STEM CELLULAR Anti-Wrinkle Moisturizer,Juice Beauty Proprietary Blend Of Fruit Stem Cells: Apple Buds Grape Buds &amp; Lemon Leaf.<br/>Ingredients: Pyrus Malus (Organic Apple Juice/Jus De Pomme Bio)* Vitis Vinifera (Organic White Grape Juice/Jus De Raisin Blanc Bio)* Citrus Medica Limonum (Organic Lemon Juice/Jus De Citron Bio)* Aloe Barbadensis (Organic Aloe Juice/Jus D'Aloès Bio)* Caprylic/Capric Triglyceride+ Simmondsia Chinensis (Organic Jojoba Seed Oil/Huile De Graines De Jojoba Bio)* Cetearyl Alcohol+  Glyceryl Stearate+ Stearic Acid+ Glycerin+ Helianthus Annuus (Organic Sunflower Seed Oil/Huile De Graines De Tournesol Bio)* Ethylhexyl Palmitate+ Xanthan Gum Butyrospermum Parkii (Organic Shea Butter/Beurre De Karaté Bio)* Malus Domestica (Apple Fruit Cell Culture Extract/Extrait De Culture Cellulaire De Pomme) Vitis Vinifera (Grape Fruit Cell Extract/Extrait De Cellule De Raisin) Citrus Medica Limonum (Lemon Leaf Cell Extract/Extrait De Cellule Des Feuilles De Citron) Tocopherol (Vitamin E/Vitamine E) Oenothera Biennis (Organic Evening Primrose/Huile D'Onagre Bio)* Linum Usitatissimum (Organic Linseed Oil/Huile De Lin Bio)* Borago Officinalis (Organic Borage Seed Oil/Huile De Graines De Bourrache Bio)* Sodium Benzoate Potassium Sorbate Ethylhexylglycerin+ Magnesium Ascorbyl Phosphate (Vitamin C/Vitamine C) Panthenol (Vitamin B5/Vitamine B5) Allantoin Citrus Reticulata (Mandarin Oil/Huile De Mandarine) Litsea Cubeba (May Chang Oil/Huile De Chang Mai) Cinnamomum Camphora (Ho Wood Oil/Huile De Camphre),"https://images.ulta.com/is/image/Ulta/2236870?id=akvaP3&fmt=jpg&fit=constrain,1&wid=260&hei=347&op_sharpen=1&resMode=bilin",https://www.ulta.com/stem-cellular-anti-wrinkle-moisturizer?productId=xlsImpprod3670097
NEUTROGENA,Hydro Boost Gel-Cream,Water Dimethicone Glycerin Cetearyl Olivate Polyacrylamide Sorbitan Olivate Phenoxyethanol Dimethicone/Vinyl Dimethicone Crosspolymer Synthetic Beeswax C13_14 Isoparaf_n Dimethiconol Dimethicone Crosspolymer Chlorphenesin Laureth_7 Carbomer Sodium Hyaluronate Ethylhexylglycerin C12_14 Pareth _12 Sodium Hydroxide,"https://images.ulta.com/is/image/Ulta/2284292?id=M7JaT2&fmt=jpg&fit=constrain,1&wid=260&hei=240&op_sharpen=1&resMode=bilin",https://www.ulta.com/hydro-boost-gel-cream?productId=xlsImpprod12041837
