Brand,Product,Ingredients,Image Link,Item Link
THE BODY SHOP,Lip Butter Kiss Me Cube,Strawberry Lip Butter: Butyrospermum Parkii Butter/Butyrospermum Parkii (Shea) Butter (Skin Conditioning Agent - Emollient) Ricinus Communis Seed Oil/Ricinus Communis (Castor) Seed Oil (Emollient) Brassica Campestris/Aleurites Fordii Oil Copolymer (Skin-Conditioning Agent - Occlusive) Cera Alba/Beeswax (Emulsifier/Emollient) PEG-8 Beeswax (Emulsifier) Hydrogenated Castor Oil (Emollient) Aroma/Flavor (Flavoring Agent) Tocopheryl Acetate (Antioxidant) Ammonium Glycyrrhizate (Flavour) Fragaria Ananassa Seed Oil/Fragaria Ananassa (Strawberry) Seed Oil (Natural Additive) Tocopherol (Antioxidant) Citric Acid (pH Adjuster) CI 77891/Titanium Dioxide (Colorant) CI 45410/Red 28 Lake (Colorant) CI 19140/Yellow 5 Lake (Colorant).<br/><br/>Coconut Lip Butter: Butyrospermum Parkii Butter (Skin-Conditioning Agent/Emollient) Ricinus Communis Oil (Emollient) Aroma (Flavour) Brassica Campestris/Aleurites Fordi Oil Copolymer (Skin-Conditioning Agent) Cera Alba (Emulsifier/Emollient) Cocos Nucifera Oil (Emollient/Hair Conditioner) Lanolin (Emollient) PEG-8 Beeswax (Emulsifier) Hydrogenated Castor Oil (Emollient) Silica (Absorbent) Tocopheryl Acetate (Antioxidant) Ammonium Glycyrrhizate (Flavour) Tocopherol (Antioxidant) Cinnamal (Fragrance Ingredient) CI 77891 (Colour) CI 19140 (Colour).<br/><br/>Mango Lip Butter: Butyrospermum Parkii Butter/Butyrospermum Parkii (Shea) Butter (Skin Conditioning Agent - Emollient) Ricinus Communis Seed Oil/Ricinus Communis (Castor) Seed Oil (Emollient) Brassica Campestris/Aleurites Fordii Oil Copolymer (Skin-Conditioning Agent - Occlusive) Cera Alba/Beeswax (Emulsifier/Emollient) Lanolin (Emollient) Mangifera Indica Seed Oil/Mangifera Indica (Mango) Seed Oil (Emollient) PEG-8 Beeswax (Emulsifier) Aroma/Flavor (Flavour) Hydrogenated Castor Oil (Emollient) Silica [NANO] (Absorbent) Limonene (Fragrance Ingredient) Tocopheryl Acetate (Antioxidant) Ammonium Glycyrrhizate (Flavour) Tocopherol (Antioxidant) Geraniol (Fragrance Ingredient) Linalool (Fragrance Ingredient) Citric Acid (pH Adjuster) CI 77891/Titanium Dioxide (Colorant) CI 19140/Yellow 5 Lake (Colorant) CI 15850/Red 7 Lake (Colorant).<br/><br/>Shea Lip Butter: Butyrospermum parkii (Shea Butter) (Emollient) Ricinus communis (Castor Oil) (Emollient) Brassica Campestris/Aleurites Fordi Oil Copolymer (Brassica Campestris/Aleurites Fordi Oil Copolymer) (Skin-conditioning Agent) Cera Alba (Beeswax) (Emulsifier/Emollient) Lanolin (Emollient) PEG-8 Beeswax (Emulsifier) Aroma (Flavour) Hydrogenated Castor Oil (Emollient) Silica (Absorbent) Tocopheryl Acetate (Antioxidant) Ammonium Glycyrrhizate (Flavour) Tocopherol (Antioxidant) Limonene (Fragrance Ingredient) Citral (Fragrance Ingredient) Linalool (Fragrance Ingredient) Geraniol (Fragrance Ingredient) CI 77891 (Colour) CI 19140 (Colour) CI 15850 (Colour),"https://images.ulta.com/is/image/Ulta/2521374?id=z1ma-0&fmt=jpg&fit=constrain,1&wid=260&hei=209&op_sharpen=1&resMode=bilin",https://www.ulta.com/lip-butter-kiss-me-cube?productId=xlsImpprod17911049
ROSEBUD PERFUME CO.,Online Only Smith's Minted Rose Lip Balm Tin,Petrolatum Peppermint Oil Cotton Seed Oil Trade Secret Perfume Premix (6113806) CI 73360,"https://images.ulta.com/is/image/Ulta/2294432?id=vDabC2&fmt=jpg&fit=constrain,1&wid=260&hei=155&op_sharpen=1&resMode=bilin",https://www.ulta.com/smiths-minted-rose-lip-balm-tin?productId=xlsImpprod13001043
FORMULA 10.0.6,Be Berry Balanced Grape + Vitamin B3 Nourishing Spray Toner,Water Isopentyldiol Glycerin Niacinamide* Vaccinium Myrtillus Fruit/Leaf Extract Vitis Vinifera (Grape) Fruit Extract Saccharum Officinarum (Sugar Cane) Extract Citrus Aurantium Dulcis (Orange) Fruit Extract Citrus Limon (Lemon) Fruit Extract Acer Saccharum (Sugar Maple) Extract Hydrolyzed Jojoba Esters Polysorbate 80 Sodium Pca  Phenoxyethanol Fragrance Xanthan Gum,"https://images.ulta.com/is/image/Ulta/2523342?id=4HCaf0&fmt=jpg&fit=constrain,1&wid=72&hei=360&op_sharpen=1&resMode=bilin",https://www.ulta.com/be-berry-balanced-grape-vitamin-b3-nourishing-spray-toner?productId=xlsImpprod17762015
SHEAMOISTURE,Superfruit Complex Shea Butter Lip Balm,Ricinus Communis (Castor) Seed Oil Euphorbia Cerifera (Candelilla) Wax Hydrogenated Castor Oil Copernicia Cerifera (Carnauba) Wax Flavor Helianthus Annuus (Sunflower) Seed Oil Butyrospermum Parkii (Shea) Butter*¿ Lycium Barbarum Fruit Extract Euterpe Oleracea Fruit Extract Psidium Guajava Fruit Extract Rubus ldaeus (Raspberry) Leaf Extract Citrus Paradisi (Grapefruit) Peel Oil Coffea Arabica (Coffee) Extract Nelumbo Nucifera Leaf Extract Sclerocarya Birrea Seed Oil Mangifera lndica (Mango) Seed Butter Silica,"https://images.ulta.com/is/image/Ulta/2504244?id=QFWaj3&fmt=jpg&fit=constrain,1&wid=108&hei=362&op_sharpen=1&resMode=bilin",https://www.ulta.com/superfruit-complex-shea-butter-lip-balm?productId=xlsImpprod15691717
SHISEIDO,Essential Energy Moisturizing Gel Cream,Water(Aqua/Eau) Dipropylene Glycol Glycerin Betaine Alcohol Denat. Dimethicone Isodecyl Neopentanoate PPG-3 Dipivalate Xylitol Phytosteryl/Octyldodecyl Lauroyl Glutamate Phenoxyethanol Hdi/Trimethylol Hexyllactone Crosspolymer Ammonium Acryloyldimethyltaurate/Beheneth-25 Methacrylate Crosspolymer Carbomer Alcohol Potassium Hydroxide Erythritol PEG/PPG-14/7 Dimethyl Ether PEG/PPG-17/4 Dimethyl Ether Tocopheryl Acetate Fragrance (Parfum) Butylene Glycol Xanthan Gum Disodium Edta Acrylates/C10-30 Alkyl Acrylate Crosspolymer Aminopropyl Dimethicone Caffeine Tremella Fuciformis Polysaccharide Silica Sodium Metaphosphate Hexyl Cinnamal Tocopherol Limonene Linalool Sodium Metabisulfite Citronellol Scutellaria Baicalensis Root Extract Angelica Keiskei Leaf/Stem Extract Geraniol Camellia Sinensis Leaf Extract Sodium Acetylated Hyaluronate Iron Oxides (CI 77491) Citrus Unshiu Peel Extract Zingiber Aromaticus Extract Hydrolyzed Conchiolin Protein Cinnamomum Cassia Bark Extract Pyrola Incarnata Extract Panax Ginseng Root Extract,"https://images.ulta.com/is/image/Ulta/2521768?id=grLaI0&fmt=jpg&fit=constrain,1&wid=260&hei=286&op_sharpen=1&resMode=bilin",https://www.ulta.com/essential-energy-moisturizing-gel-cream?productId=xlsImpprod17491049
LAB SERIES SKINCARE FOR MEN,PRO LS All-In One Face Treatment,,"https://images.ulta.com/is/image/Ulta/2256646?id=w0Gap1&fmt=jpg&fit=constrain,1&wid=122&hei=359&op_sharpen=1&resMode=bilin",https://www.ulta.com/pro-ls-all-in-one-face-treatment?productId=xlsImpprod5160055
NEUTROGENA,Healthy Skin Face Lotion SPF 15,Active Ingredients: Octinoxate (7.5%) Oxybenzone (5%) Inactive Ingredients: Water Purified Glycolic Acid C12 15 Alkyl Benzoate Dicaprylyl Maleate Cetyl Alcohol Glycerin Stearic Acid Glyceryl Stearate PEG 100 Stearate Sodium Glycolate Tocopheryl Acetate Retinyl Palmitate Ascorbic Acid Polypeptide Panthenol Bisabolol Tetrasodium EDTA Xanthan Gum Methylparaben Propylparaben Diazolidinyl Urea Fragrance,"https://images.ulta.com/is/image/Ulta/5022331?id=y2CaJ1&fmt=jpg&fit=constrain,1&wid=260&hei=290&op_sharpen=1&resMode=bilin",https://www.ulta.com/healthy-skin-face-lotion-spf-15?productId=4044
EXUVIANCE,Multi-Protective Day Creme SPF 20,Active: Ethylhexyl Methoxycinnamate (Octinoxate) 6.0% Titanium Dioxide 4.0%. Inactive: Aqua (Water) C12-15 Alkyl Benzoate Triethylhexanoin Cetearyl Alcohol PEG-100 Stearate Gluconolactone Dimethicone Butylene Glycol Dimethicone PEG-7 Phosphate Ethoxydiglycol Glyceryl Stearate Ammonium Acryloyldimethyltaurate/VP Copolymer Propylene Glycol Lactobionic Acid Tocopheryl (Vitamin E) Acetate Aloe Barbadensis Leaf Extract Cucumis Sativus (Cucumber) Fruit Extract Althaea Officinalis Root Extract Chamomilla Recutita (Matricaria) Flower Extract Rosmarinus Officinalis (Rosemary)Leaf Extract Vitis Vinifera (Grape) Seed Extract Cyclopentasiloxane Glycerin Dimethiconol Methicone Alumina Magnesium Aluminum Silicate Ammonium Hydroxide Polyhydroxystearic Acid Citric Acid Disodium EDTA Sodium Citrate Xanthan Gum Polysorbate 20 Caprylyl Glycol Phenoxyethanol Chlorphenesin,"https://images.ulta.com/is/image/Ulta/2266862?id=l9Ma-3&fmt=jpg&fit=constrain,1&wid=163&hei=360&op_sharpen=1&resMode=bilin",https://www.ulta.com/multi-protective-day-creme-spf-20?productId=xlsImpprod5970162
BOTANICS,93% Organic Hydrating Super Balm,Olea europaea (Olive) fruit oil* Prunus amygdalus dulcis (Sweet almond) oil* Cera alba (Beeswax)* Butyrospermum parkii (Shea) butter* Cetearyl alcohol Simmondsia chinensis (Jojoba) seed oil* Rosa canina fruit oil*,"https://images.ulta.com/is/image/Ulta/2502289?id=N4Ca12&fmt=jpg&fit=constrain,1&wid=260&hei=239&op_sharpen=1&resMode=bilin",https://www.ulta.com/93-organic-hydrating-super-balm?productId=xlsImpprod15381037
H2O PLUS,Sea Greens Body Butter,Water/Aqua/Eau Ethylhexyl Palmitate Glyceryl Stearate Cetyl Alcohol Parfum/Fragrance Glycerin Hydrogenated Polydecene Dimethicone Stearic Acid Cyclopentasiloxane PEG-100 Stearate Butyrospermum Parkii (Shea) Butter Cocos Nucifera (Coconut) Oil Prunus Amygdalus Dulcis (Sweet Almond) Oil Argania Spinosa Kernel Oil Aloe Barbadensis Leaf Juice Aphanizomenon Flos-Aquae Extract Macrocystis Pyrifera (kelp) Extract  Spirulina Maxima Extract Ulva Lactuca Extract Caprylyl Methicone Palmitic Acid Xanthan Gum Potassium Sorbate Ethylhexylglycerin Disodium EDTA Dimethicone Crosspolymer Triethanolamine Panthenol Myristyl Alcohol Stearyl Alcohol Lauryl Alcohol Maltodextrin Hydrogenerated Starch Hydrolysate  Hydrogenerated Vegetable Oil Citric Acid Sodium Benzoate Tocopherol Geraniol Limonene Hexyl Cinnamal Citral Alpha-Isomethyl-Ionone Phenoxyethanol,"https://images.ulta.com/is/image/Ulta/2511615?id=dtwaf3&fmt=jpg&fit=constrain,1&wid=136&hei=359&op_sharpen=1&resMode=bilin",https://www.ulta.com/sea-greens-body-butter?productId=xlsImpprod16541353
JULEP,You Got This Pressed Serum Daily Moisturizer,Triethylhexanoin Polyethylene C12-15 Alkyl Benzoate Vinyl Dimethicone/Methicone Silsesquioxane Crosspolymer Talc Silica Microcrystalline Wax Paraffin Caprylyl Methicone Jojoba Esters Helianthus Annuus (Sunflower) Seed Wax Camellia Japonica Seed Oil Ceramide Np Cera Microcristallina Citrus Aurantium Bergamia (Bergamot) Fruit Oil Water/Aqua (Eau) Methicone Tocopheryl Acetate Triethoxycaprylylsilane Polyglycerin-3 Acacia Decurrens Flower Wax Ricinus Communis (Castor) Seed Oil Pentaerythrityl Tetra-Di-T-Butyl Hydroxyhydrocinnamate Sodium Hyaluronate Glycerin Hydrogenated Castor Oil Propanediol Prunus Yedoensis Leaf Extract Galactoarabinan,"https://images.ulta.com/is/image/Ulta/2521591?id=i0JaD2&fmt=jpg&fit=constrain,1&wid=136&hei=360&op_sharpen=1&resMode=bilin",https://www.ulta.com/you-got-this-pressed-serum-daily-moisturizer?productId=xlsImpprod17571111
CETAPHIL,Daily Advance Lotion,Water Glycerin Hydrogenated Polyisobutene Cetearyl Alcohol Macadamia Ternifolia (Nut) Seed Oil (Macadamia Nut Oil) Butyrospermum Parkii (Shea Butter) Acrylates/C10 30 Alkyl Acrylate Crosspolymer Sodium Polyacrylate Phenoxyethanol Tocopheryl Acetate (Vitamin E) Ceteareth 20 Stearoxytrimethylsilane Stearyl Alcohol Benzyl Alcohol Farnesol Sodium PCA Panthenol Cyclopentasiloxane Dimethiconol Citric Acid Sodium Hydroxide,"https://images.ulta.com/is/image/Ulta/2283357?id=xuGaM3&fmt=jpg&fit=constrain,1&wid=190&hei=360&op_sharpen=1&resMode=bilin",https://www.ulta.com/daily-advance-lotion?productId=xlsImpprod12041661
SHISEIDO,Online Only Benefiance NutriPerfect Night Cream,Water (Aqua) Butylene Glycol Glycerin Dimethicone Hydrogenated Polyisobutene Glyceryl Stearate Se Peg-40 Stearate Isodecyl Neopentanoate Myristyl Myristate Mineral Oil (Paraffinum Liquidum) Carnosine Limnanthes Alba (Meadowfoam) Seed Oil Behenyl Alcohol Stearyl Alcohol Dimethylacrylamide/Sodium Acryloyldimethyltaurate Crosspolymer Microcrystalline Wax (Cera Microcristallina) Cetyl Alcohol Phenoxyethanol Paraffin Fragrance (Parfum) Methylparaben Citric Acid Sorbitan Tristearate Erythritol Tocopheryl Acetate Panthenyl Ethyl Ether Potassium Ascorbyl Tocopheryl Phosphate Butylphenyl Methylpropional Sodium Metaphosphate Trisodium Edta Glucosyl Hesperidin Titanium Dioxide (Ci 77891) Limonene Linalool Alpha-Isomethyl Ionone Geraniol Benzyl Benzoate Citronellol Iron Oxides (Ci 77491) Iron Oxides (Ci 77492) Sodium Acetylated Hyaluronate Aluminum Hydroxide Bht Tocopherol,"https://images.ulta.com/is/image/Ulta/2509498?id=b_Ea22&fmt=jpg&fit=constrain,1&wid=260&hei=283&op_sharpen=1&resMode=bilin",https://www.ulta.com/benefiance-nutriperfect-night-cream?productId=xlsImpprod15821011
DIONIS,Milk & Honey Lip Balm,Cera Alba (Beeswax) Carthamus Tinctorius (Sunflower Seed) Oil Cocos Nucifera (Coconut) Oil Flavor Butyrospermum Parkii (Shea Butter) Goat Milk Tocopheryl Acetate Ricinus Communis (Castor) Seed Oil Ammonium Glycyrrhizate Phenoxyethanol,"https://images.ulta.com/is/image/Ulta/2299510?id=lBFbx0&fmt=jpg&fit=constrain,1&wid=208&hei=359&op_sharpen=1&resMode=bilin",https://www.ulta.com/milk-honey-lip-balm?productId=xlsImpprod13681871
SHEAMOISTURE,Fruit Fusion Shea Butter Lip Balm,Ricinus Communis (Castor) Seed Oil Hydrogenated Castor Oil Euphorbia Cerifera (Candelilla) Wax Copernicia Cerifera (Carnauba) Wax Flavor Butyrospermum Parkii (Shea) Butter*¿ Litchi Chinensis (Lychee) Fruit Extract Hylocereus Undatus (Dragon Fruit) Fruit Extract Garcinia Mangostana Peel (African Mangosteen) Extract Cocos Nucifera (Coconut) Fruit Juice Myrciaria Dubia Fruit Extract Pyrus Malus (Apple) Fruit Extract Helianthus Annuus (Sunflower) Seed Oil Silica,"https://images.ulta.com/is/image/Ulta/2504249?id=aQNaM1&fmt=jpg&fit=constrain,1&wid=107&hei=360&op_sharpen=1&resMode=bilin",https://www.ulta.com/fruit-fusion-shea-butter-lip-balm?productId=xlsImpprod15691713
HEY HONEY,Online Only Besame Mucho Lip Balm,Butyrospermum Parkii (Shea) Butter  Dicaprylyl Ether Squalane Beeswax Caprylic/Capric Triglyceride PEG-45/Dodecyl Glycol Copolymer Stearalkonium Hectorite Hydrogenated Castor Oil Propolis Propylene Carbonate Lecithin Tocopherol Ascorbyl Palmitate Hydrogenated Palm Glycerides Citrate Vanilla Panifolia Extract,"https://images.ulta.com/is/image/Ulta/2502434?id=k9KaA0&fmt=jpg&fit=constrain,1&wid=105&hei=360&op_sharpen=1&resMode=bilin",https://www.ulta.com/besame-mucho-lip-balm?productId=xlsImpprod15001109
RODIAL,Online Only Bee Venom Moisturiser,Aqua (Water) Cyclopentasiloxane Butyrospermum Parkii (Shea Butter) Glycerin Oryza Sativa (Rice) Germ Oil Dimethicone Ethylhexyldodecanol Squalane Caprylic/ Capric Triglyceride Cetyl Alcohol Cyclohexasiloxane Polysilicone-11 Cetearyl Alcohol Glyceryl Dibehenate Phenoxyethanol Gryceryl Stearate PEG-75 Stearate Tribehenin Alcohol Ascorbyl Tetraisopalmitate Ceteth-20  Steareth-20 Glyceryl Behenate Ectoin Lecithin Polyacrylamide Xanthan Gum Capsicum Annuum Meristem Cell Culture Parfum (Fragrance) Ethylhexylglycerin Sodium Hyaluronate Tocopherol C13-14 isoparaffin Disodium EDTA Geranylgeranylisopropanol Helianthus Annuus (Sunflower) Seed Oil Laureth-7 Triethanolamine Citric Acid Alpha-Isomethyl Ionone Hydroxycitronellal Limonene Citronellol Sodium Benzoate Potassium Sorbate Beta-Carotene Daucus Carota Sativa (Carrot) Root Extract Daucus Carota Sativa (Carrot) Seed Oil Cyclotetrapeptide-24 Aminocyclohexane Carboxylate Ascorbyl Palmitate Bee Venom,"https://images.ulta.com/is/image/Ulta/2278559?id=1K6bj0&fmt=jpg&fit=constrain,1&wid=260&hei=238&op_sharpen=1&resMode=bilin",https://www.ulta.com/bee-venom-moisturiser?productId=xlsImpprod10761091
ANTHONY,Day Cream SPF 30,Aqua (Water) Caprylic/Capric Triglyceride Corn Starch Modified Cetearyl Olivate Diethylhexyl 26-Naphthalate c12-15 Alkyl Benzoate Sorbitan Olivate Gluconolactone Squalene Glycerin Cyclopentasiloxane Tocopheryl Acetate (D-alpha) Glycine Sojo (Soybean) Oil Sodium Hyaluronate (L) Xanthan Gum Carbomer Aminomethyl Porpanol Sodium Benzoate Phenethyl Alcohol Caprylyl Glycol Phenoxyethanol Trisodium Ethylenediamine Disuccinate Potassium Sorbate</div>,"https://images.ulta.com/is/image/Ulta/2310419?id=NY5bc1&fmt=jpg&fit=constrain,1&wid=150&hei=360&op_sharpen=1&resMode=bilin",https://www.ulta.com/day-cream-spf-30?productId=xlsImpprod15001043
PATCHOLOGY,Online Only AquaFlash Daily Gel Moisturizer,Water (Aqua/Eau) Glycerin 12-Hexanediol Saccharomyces Ferment Filtrate Panthenol (Vitamin B5) Melia Azadirachta (Neem) Leaf Extract Sodium Hyaluronate Aloe Barbadensis Leaf Juice Allantoin Sclerotium Gum Phenoxyethanol Cetyl Ethylhexanoate Sodium Polyacrylate Sodium Carbomer Ceteth-20 Cyclopentasiloxane Steareth-20 Triethylhexanoin Ethylhexylglycerin Butylene Glycol Cetearyl Alcohol Glyceryl Stearate PEG-40 Hydrogenated Castor Oil PVM/MA Copolymer Menthyl PCA Ethyl Menthane Carboxamide Tocopheryl Acetate Disodium EDTA Fragrance (Parfum) CI 42090 CI 19140,"https://images.ulta.com/is/image/Ulta/2531476?id=asga-3&fmt=jpg&fit=constrain,1&wid=260&hei=274&op_sharpen=1&resMode=bilin",https://www.ulta.com/aquaflash-daily-gel-moisturizer?productId=xlsImpprod18431040
PHILOSOPHY,Online Only Renewed Hope for Men,Aqua/Water/Eau Glycerin Pentylene Glycol Glycolic Acid Polyacrylamide Dimethicone Sodium Hydroxide Cetearyl Alcohol C13-14 Isoparaffin Cetyl Alcohol Ammonium Acryloyldimethyltaurate/VP Copolymer C12-14 Isoparaffin Phenoxyethanol Xanthan Gum Parfum/Fragrance C13-16 Isoparaffin Laureth-7 Cetearyl Glucoside Polysilicone-11 C13-15 Alkane Tocopheryl Acetate Disodium EDTA Limonene Beta-Glucan 12-Hexanediol Caprylyl Glycol Linalool Benzoic Acid Sodium Benzoate Citral Geraniol BHT,"https://images.ulta.com/is/image/Ulta/2301755?id=Yx-an2&fmt=jpg&fit=constrain,1&wid=146&hei=360&op_sharpen=1&resMode=bilin",https://www.ulta.com/renewed-hope-men?productId=xlsImpprod13671013
CLINIQUE,CliniqueFIT Post-Workout Mattifying Moisturizer,Water\Aqua\Eau Isododecane Butylene Glycol Polypropylene Dimethicone Bis-PEG-18 Methyl Ether Dimethyl Silane Glycerin Trehalose Polygonum Cuspidatum Root Extract Cucumis Sativus (Cucumber) Fruit Extract Ammonium Acryloyldimethyltaurate/Vp Copolymer Saccharomyces Lysate Extract Hordeum Vulgare (Barley) Extract\Extrait D'Orge Laminaria Saccharina Extract Lactobacillus Ferment Caffeine Oleth-10 Sodium Hyaluronate Polysilicone-11 Tromethamine Acrylates/C10-30 Alkyl Acrylate Crosspolymer Caprylyl Glycol Propylene Glycol Dicaprate Helianthus Annuus (Sunflower) Seedcake Tocopheryl Acetate Hexylene Glycol Laureth-23 Laureth-4 Silica Disodium EDTA Yellow 5 (CI 19140) Red 4 (CI 14700) Yellow 6 (CI 15985) Phenoxyethanol,"https://images.ulta.com/is/image/Ulta/2512308?id=BTFaC1&fmt=jpg&fit=constrain,1&wid=136&hei=361&op_sharpen=1&resMode=bilin",https://www.ulta.com/cliniquefit-post-workout-mattifying-moisturizer?productId=xlsImpprod16321424
THANK YOU FARMER,True Water Light Gel Cream,Water Cyclopentasiloxane Glycerin Ammonium Acryloyldimethyltaurate/Vp Copolymer Betaine Niacinamide Pentylene Glycol Squalane Panthenol Trehalose Butylene Glycol 12-Hexanediol Polyacrylamide Hydrogenated Lecithin Xanthan Gum Piper Methysticum Leaf/Root/Stem Extract C13-14 Isoparaffin Sodium Hyaluronate Soluble Collagen Aloe Barbadensis Leaf Extract Fragrance Inositol Portulaca Oleracea Extract Pueraria Thunbergiana Root Extract Cnidium Officinale Root Extract Glycyrrhiza Glabra (Licorice) Root Extract Paeonia Lactiflora Root ExtractAmaranthus Caudatus Seed Extract Ulmus Davidiana Root Extract Ethylhexylglycerin Aloe Barbadensis Leaf Juice Disodium EDTA Laureth-7 CI 15985 CI 17200,"https://images.ulta.com/is/image/Ulta/2504882?id=_Iuay2&fmt=jpg&fit=constrain,1&wid=260&hei=197&op_sharpen=1&resMode=bilin",https://www.ulta.com/true-water-light-gel-cream?productId=xlsImpprod15641034
GARNIER,SkinActive Soothing Facial Mist with Rose Water,Aqua/Water Glycerin Alcohol Denat. Rosa Damascena Flower Water  Sodium Hydroxide Sodium Phytate Arginine Propanediol Caprylyl/Capryl Glucoside Citric Acid Salicylic Acid Linalool Parfum/Fragrance F,"https://images.ulta.com/is/image/Ulta/2520190?id=7muaQ2&fmt=jpg&fit=constrain,1&wid=88&hei=359&op_sharpen=1&resMode=bilin",https://www.ulta.com/skinactive-soothing-facial-mist-with-rose-water?productId=xlsImpprod17162699
H2O PLUS,Oasis Lip Gel,Clear as Day: Isotridecyl Isononanoate Diisostearyl Malate Ethylenediamine/Hydrogenated Dimer Dilinoleate Copolymer Bis-Di-C14-18 Alkyl Amide Octyldodecanol Dibutyl Lauroyl Glutamide Dibutyl Ethylhexanoyl Glutamide Flavor/Aroma Rosa Centifolia Flower Extract Tectona Grandis Wood Extract Lilium Candidum Bulb Extract Zostera Marina Extract Helianthus Annuus (Sunflower) Seed Oil Portulaca Pilosa Extract Cetearyl Ethylhexanoate Sorbitan Isostearate Caprylyl Glycol Sucrose Cocoate Palmitoyl Tripeptide-38 Limonene Eugenol.  May Contain (+/-): Titanium Dioxide (CI 77891) Blue 1 Lake (CI 42090) Red 7 Lake (CI 15850) Red 21 (CI 45380) Red 27 (CI 45410) Red 28 Lake (CI 45410) Yellow 5 Lake (CI 19140),"https://images.ulta.com/is/image/Ulta/2505253?id=aQOaV3&fmt=jpg&fit=constrain,1&wid=77&hei=362&op_sharpen=1&resMode=bilin",https://www.ulta.com/oasis-lip-gel?productId=xlsImpprod15871023
NIVEA,A Kiss of Mint & Minerals Refreshing Lip Care,,"https://images.ulta.com/is/image/Ulta/2234547?id=c0naa3&fmt=jpg&fit=constrain,1&wid=99&hei=361&op_sharpen=1&resMode=bilin",https://www.ulta.com/a-kiss-of-mint-minerals-refreshing-lip-care?productId=xlsImpprod3530003
EOS,Visibly Soft Cucumber Melon Lip Balm,Beeswax/Cera Alba (Cire d¿abeille) Helianthus Annuus (Sunflower) Seed Oil Ricinus Communis (Castor) Seed Oil Bis-Diglyceryl Polyacyladipate-2 Jojoba Esters Cocos Nucifera (Coconut) Oil Fragrance (Parfum) Oryza Sativa (Rice) Bran Wax Helianthus Annuus (Sunflower) Seed Wax Butyrospermum Parkii (Shea) Butter Theobroma Cacao (Cocoa) Seed Butter Acacia Decurrens Flower Wax Cucumis Sativus (Cucumber) Fruit Extract Cucumis Melo (Melon) Fruit Extract Ficus Carica (Fig) Fruit/Leaf Extract Stevia Rebaudiana Leaf/Stem Extract Tocopherol Polyglycerin-3 Glycine Soja (Soybean) Oil Citric Acid,"https://images.ulta.com/is/image/Ulta/2531465?id=9mfbv3&fmt=jpg&fit=constrain,1&wid=260&hei=152&op_sharpen=1&resMode=bilin",https://www.ulta.com/visibly-soft-cucumber-melon-lip-balm?productId=xlsImpprod19011113
H2O PLUS,Oasis Smooth Lip Conditioner,Ricinus Communis (Castor) Seed Oil Methyl Soyate Flavor Beeswax/Cera Alba/Cire d'Abeille Cera Microcristallina/Microcrystalline Wax/Cire Microcrystalline Butyrospermum Parkii (Shea) Butter Macadamia Ternifolia Seed Oil Hydrogenated Castor Oil Ethylhexyl Methoxycinnamate Phenyl Trimethicone Mentha Piperita (Peppermint) Oil Cera Carnauba/Copernicia Cerifera (Carnauba) Wax/Cire de Carnauba Tocopheryl Acetate Phenoxyethanol Limonene Linalool</div>,"https://images.ulta.com/is/image/Ulta/2305726?id=1FDaB1&fmt=jpg&fit=constrain,1&wid=97&hei=361&op_sharpen=1&resMode=bilin",https://www.ulta.com/oasis-smooth-lip-conditioner?productId=xlsImpprod14361553
NIVEA,A Kiss of Cherry Fruity LIp Care,Active: Avobenzone 1.0% Octinoxate 3.0%. Inactive: Polyisobutene Ricinus Communis (Castor) Seed Oil Octyldodecanol Pentaerythrityl Tetraisostearate Hydrogenated Polydecene Euphorbia Cerifera (Candelilla) Wax Myristyl Myristate Butyrospermum Parkii (Shea) Butter Microcrystalline Wax Isopropyl Palmitate Synthetic Wax Polyglyceryl-3 Diisostearate Prunus Amygdalus Dulcis (Sweet Almond) Oil Simmondsia Chinensis (Jojoba) Seed Oil Mangifera Indica (Mango) Juice Citrus Aurantifolia (Lime) Juice Tocopheryl Acetate Vitis Vinifera (Grape) Seed Oil Bisabolol Glycerin Mica Propylene Glycol Water Neohesperidin Dihydrochalcone BHT Silica Citric Acid Trideceth-9 Fragrance Titanium Dioxide Red 7 Lake Red 21 Lake Yellow 6 Lake Iron Oxides,"https://images.ulta.com/is/image/Ulta/2163561?id=0_La_2&fmt=jpg&fit=constrain,1&wid=96&hei=358&op_sharpen=1&resMode=bilin",https://www.ulta.com/a-kiss-of-cherry-fruity-lip-care?productId=xlsImpprod700214
AQUAPHOR,Online Only Healing Ointment No Touch Applicator,Petrolatum (41%) Mineral Oil Ceresin Lanolin Alcohol Panthenol Glycerin Bisabolol,"https://images.ulta.com/is/image/Ulta/2285365?id=YRkb-2&fmt=jpg&fit=constrain,1&wid=139&hei=360&op_sharpen=1&resMode=bilin",https://www.ulta.com/healing-ointment-no-touch-applicator?productId=xlsImpprod11821029
PETER THOMAS ROTH,Travel Size Hungarian Thermal Water Mineral-Rich Moisturizer,Water/Aqua/Eau Dimethicone Peg/Ppg-18/18 Dimethicone Cetyl Alcohol Glyceryl Stearate PEG-100 Stearate Cholesterol C12-15 Alkyl Benzoate Lauryl PEG-9 Polydimethylsiloxyethyl Dimethicone Ceramide NP Retinyl Palmitate Tocopheryl Acetate Ascorbyl Palmitate Glycerin Adenosine Honey (Mel) Diamond Powder Phospholipids Trehalose Helianthus Annuus (Sunflower) Seed Oil Linum Usitatissimum (Linseed) Seed Oil Oenothera Biennis (Evening Primrose) Oil Prunus Armeniaca (Apricot) Kernel Oil Prunus Persica (Peach) Kernel Oil Hippophae Rhamnoides Oil Rosmarinus Officinalis (Rosemary) Leaf Extract Paeonia Lactiflora Root Extract Fagus Sylvatica Bud Extract Saccharomyces/Magnesium Ferment Leuconostoc/Radish Root Ferment Filtrate Saccharomyces/Iron Ferment Saccharomyces/Copper Ferment Saccharomyces/Silicon Ferment Saccharomyces/Zinc Ferment Lecithin Sodium PCA Sodium Hydroxide Polysilicone-11 Polymethylsilsesquioxane Mica Decyl Glucoside Ethoxydiglycol Carbomer Disodium EDTA Butylene Glycol Propylene Glycol Hexylene Glycol Caprylyl Glycol Benzoic Acid Benzyl Alcohol Sodium Benzoate Potassium Sorbate Phenoxyethanol,"https://images.ulta.com/is/image/Ulta/2526948?id=ji8a_2&fmt=jpg&fit=constrain,1&wid=260&hei=192&op_sharpen=1&resMode=bilin",https://www.ulta.com/travel-size-hungarian-thermal-water-mineral-rich-moisturizer?productId=xlsImpprod18341013
