Brand,Product,Ingredients,Image Link,Item Link
AHAVA,Online Only Mineral Radiance Overnight De-Stressing Cream,Aqua (Mineral Spring Water) Hydrogenated Polyisobutene Myristyl Myristate Dimethicone Isodecyl Isononanoate Isodecyl Neopentanoate Aloe Barbadensis Leaf Juice Glycerin Glyceryl Stearate Trehalose Biosaccharide Gum-4 Thermus Thermophillus Ferment Cetearyl Alcohol Caprylyl Methicone Panthenol (Pro Vitamin B5) Peg-40 Stearate Simmondsia Chinensis (Jojoba) Seed Oil Phenoxyethanol Limnanthes Alba (Meadowfoam) Seed Oil Maris Aqua (Dead Sea Water) Sorbitan Tristearate Ceteareth-20 PEG-12 Dimethicone/PPG-20 Crosspolymer Polyacrylate-13 Polyisobutene Polysorbate-20 Allantoin Cetyl Alcohol Stearyl Alcohol Cetyl Palmitate Sorbitan Oleate Sorbitan Palmitate Bisabolol Dimethiconol Olea Europaea (Olive)Fruit Oil Simmondsia Chinensis (Jojoba) Seed Extract Ethylhexylglycerin 12 Hexanediol Parfum (Fragrance),"https://images.ulta.com/is/image/Ulta/2507565?id=eTJan2&fmt=jpg&fit=constrain,1&wid=260&hei=118&op_sharpen=1&resMode=bilin",https://www.ulta.com/mineral-radiance-overnight-de-stressing-cream?productId=xlsImpprod15623081
PHILOSOPHY,Online Only Ultimate Miracle Worker Fix Lip Serum Stick,Phytosteryl/Isostearyl/Cetyl/Stearyl/Behenyl Dimer Dilinoleate Squalane Triethylhexanoin Caprylic/Capric Triglyceride Diisostearyl Malate Mica Polyethylene Dipentaerythrityl Hexahydroxystearate/Hexastearate/Hexarosinate Hydrogenated Polyisobutene Cetearyl Ethylhexanoate Stearyl Heptanoate Phytosteryl Isostearyl Dimer Dilinoleate Stearalkonium Hectorite Sorbitan Sesquioleate Hdi/Trimethylol Hexyllactone Crosspolymer Microcristallina Cera/Microcrystalline Wax/Cire Microcrystalline Ethylhexyl Palmitate Isopropyl Palmitate Propylene Carbonate 12-Hexanediol Quaternium-18 Bentonite Tocopheryl Acetate Tribehenin Caprylyl Glycol Dimethicone Ethylhexylglycerin Sorbitan Isostearate Silica Borago Officinalis Seed Oil Helianthus Annuus (Sunflower) Seed Oil Linum Usitatissimum (Linseed) Seed Oil Prunus Amygdalus Dulcis (Sweet Almond) Oil Tocopherol Silica Dimethyl Silylate Butylene Glycol Palmitoyl Tripeptide-1 Hexylene Glycol Sodium Hyaluronate Phenoxyethanol,"https://images.ulta.com/is/image/Ulta/2530168?id=us8b-1&fmt=jpg&fit=constrain,1&wid=41&hei=364&op_sharpen=1&resMode=bilin",https://www.ulta.com/ultimate-miracle-worker-fix-lip-serum-stick?productId=xlsImpprod18191035
THE BODY SHOP,Drops Of Youth Youth Concentrate,Aqua/Water (Solvent/Diluent) Alcohol Denat. (Solvent/Diluent) Glycerin (Humectant) Chondrus Crispus Powder (Abrasive) Propanediol (Viscosity Modifier) Sodium Hyaluronate (Humectant) Benzyl Alcohol (Preservative) Fagus Sylvatica Bud Extract (Skin Conditioning Agent) Aloe Barbadensis Leaf Juice (Skin Conditioning Agent) Adenosine (Skin-Conditioning Agent) Parfum/Fragrance (Fragrance) Linalool (Fragrance Ingredient) Crithmum Maritimum Callus Culture Filtrate (Skin Protectant) Orbignya Oleifera Seed Oil (Emollient) Citric Acid (pH Adjuster) Citronellol (Fragrance Ingredient) Buddleja Davidii Extract (Skin-Conditioning Agent) Malva Sylvestris Flower/Leaf/Stem Extract/Malva Sylvestris (Mallow) Flower/Leaf/Stem Extract (Skin Conditioning Agent) Thymus Vulgaris Flower/Leaf Extract/Thymus Vulgaris (Thyme) Flower/Leaf Extract (Skin-Conditioning Agent) Benzoic Acid (Preservative) Sorbic Acid (Preservative) Limonene (Fragrance Ingredient) Sodium Benzoate (Preservative) Potassium Sorbate (Preservative),"https://images.ulta.com/is/image/Ulta/2305198?id=mECay1&fmt=jpg&fit=constrain,1&wid=133&hei=359&op_sharpen=1&resMode=bilin",https://www.ulta.com/drops-of-youth-youth-concentrate?productId=xlsImpprod14621257
REBELS REFINERY,Skull Lip Balm Mint Black,Cocos Nucifera (Coconut) Oil Prunus Amygdalus Dulcis (Sweet Almond) Oil Beeswax (Cera Alba / Cira d'abeille) Mentha Piperita (Peppermint) Oil Canola Oil (Canola / Huile de colza) Glycine Soja (Soybean) Oil Rosmarinus Officinalis (Rosemary) Leaf Extract Tocopherol Limonene,"https://images.ulta.com/is/image/Ulta/2533351?id=8uxaX3&fmt=jpg&fit=constrain,1&wid=250&hei=359&op_sharpen=1&resMode=bilin",https://www.ulta.com/skull-lip-balm-mint-black?productId=xlsImpprod19011087
ESTÉE LAUDER,DayWear Advanced Multi-Protection Anti-Oxidant Creme Oil-Free Broad Spectrum SPF 25,Active: Octisalate 5.00% Avobenzone 3.00% Octocrylene 2.70%. Inactive: Water\Aqua\Eau Butyloctyl Salicylate Ethyl Macadamiate Methyl Trimethicone Jojoba Esters Butylene Glycol PEG-100 Stearate Neopentyl Glycol Diheptanoate Dimethicone Glyceryl Stearate Cetyl Alcohol Silica Potassium Cetyl Phosphate Gentiana Lutea (Gentian) Root Extract Polygonum Cuspidatum Root Extract Hordeum Vulgare (Barley) Extract\Extrait D'orge Triticum Vulgare (Wheat) Germ Extract Fumaria Officinalis Flower/Leaf/Stem Extract Citrus Medica Limonum (Lemon) Fruit Extract Hydrolyzed Rice Bran Extract Hydrolyzed Rice Extract Laminaria Saccharina Extract Rosmarinus Officinalis (Rosemary) Leaf Extract Vitis Vinifera (Grape) Seed Extract Artemia Extract Hydrogenated Lecithin Thermus Thermophillus Ferment Squalane Glycerin Linoleic Acid Caffeine Ethylhexylglycerin Cholesterol Lecithin Dipotassium Glycyrrhizate Ergothioneine Sodium Hyaluronate Polyquaternium-51 Lauryl PEG-9 Polydimethylsiloxyethyl Dimethicone Trehalose Palmitoyl Hydroxypropyltrimonium Amylopectin/Glycerin Crosspolymer Ammonium Acryloyldimethyltaurate/VP Copolymer Tetrahexyldecyl Ascorbate Caprylyl Glycol Sodium PCA Cyclodextrin Urea Dehydroxanthan Gum Stearic Acid Tocopheryl Acetate Nordihydroguaiaretic Acid Ascorbyl Tocopheryl Maleate Citric Acid Sodium Dehydroacetate Fumaric Acid Ethylbisiminomethylguaiacol Manganese Chloride Pentaerythrityl Tetra-Di-T-Butyl Hydroxyhydrocinnamate Phenoxyethanol Disodium EDTA BHT Fragrance (Parfum) Butylphenyl Methylpropional Benzyl Salicylate Linalool Hydroxyisohexyl 3-Cyclohexene Carboxaldehyde Mica Blue 1 (CI 42090) Chromium Hydroxide Green (CI 77289) Yellow 5 (CI 19140),"https://images.ulta.com/is/image/Ulta/2309611?id=mW6ai3&fmt=jpg&fit=constrain,1&wid=260&hei=269&op_sharpen=1&resMode=bilin",https://www.ulta.com/daywear-advanced-multi-protection-anti-oxidant-creme-oil-free-broad-spectrum-spf-25?productId=xlsImpprod14641489
LANCÔME,Visionnaire Advanced Multi-Correcting Cream,"Aqua / Water<div class=""ProductDetail__productContent collapse"">Aqua / Water Glycerin Dicaprylyl Ether Cyclohexasiloxane Butylene Glycol Isopropyl Isostearate Sodium Tetrahydrojasmonate Dimethicone Cetyl Alcohol Dipropylene Glycol Behenyl Alcohol Silica Arachidyl Alcohol Secale Cereale Extract / Rye Seed Extract Sodium Hydroxide Sodium Hyaluronate Stearic Acid Phenoxyethanol Stearyl Alcohol Adenosine PEG-10 Dimethicone PEG-100 Stearate Polysilicone-11 Palmitic Acid Poloxamer 338 Ammonium Polyacryldimethyltauramide / Ammonium Polyacryloyldimethyl Taurate Limonene Pentylene Glycol Linalool Caprylyl Glycol Carbomer Acrylonitrile/Methyl Methacrylate/Vinylidene Chloride Copolymer Disodium EDTA Cetearyl Alcohol Methyldihydrojasmonate Cetearyl Glucoside Citronellol Parfum / Fragrance","https://images.ulta.com/is/image/Ulta/2292805?id=D2Iap2&fmt=jpg&fit=constrain,1&wid=260&hei=228&op_sharpen=1&resMode=bilin",https://www.ulta.com/visionnaire-advanced-multi-correcting-cream?productId=xlsImpprod12841039
SHISEIDO,Ibuki Refining Moisturizer,Water (Aqua) Glycerin Butylene Glycol Dipropylene Glycol Hydrogenated Polydecene Triethylhexanoin HDI/Trimethylol Hexyllactone Crosspolymer Dimethicone Glyceryl Stearate SE Trehalose PEG-5 Glyceryl Stearate Behenyl Alcohol Phenoxyethanol Stearic Acid Isostearic Acid Behenic Acid Alcohol Carbomer Aminopropyl Dimethicone Betaine Fragrance (Parfum) Silica Potassium Hydroxide Glycyl Glycine Sodium Metabisulfite Disodium EDTA Limonene Hexyl Cinnamal Butylphenyl Methylpropional Benzyl Benzoate Linalool Paeonia Albiflora Root Extract Hamamelis Virginiana (Witch Hazel) Leaf Extract Lamium Album Flower Extract Citrus Junos Seed Extract Tocopherol Zingiber Aromaticus Extract Benzoic Acid,"https://images.ulta.com/is/image/Ulta/2305974?id=gG3b02&fmt=jpg&fit=constrain,1&wid=97&hei=361&op_sharpen=1&resMode=bilin",https://www.ulta.com/ibuki-refining-moisturizer?productId=xlsImpprod14351071
MURAD,Resurgence Age-Balancing Moisture Broad Spectrum SPF 30 / PA+++,Active Ingredients: Homosalate 4% Octisalate 4% Avobenzone 2% Octocrylene 2%. Inactive Ingredients: Water (Aqua) C12-15 Alkyl Benzoate Glycerin Tapioca Starch Polymethylsilsesquioxane Hydrogenated Vegetable Glycerides Butyrospermum Parkii (Shea Butter) Caprylyl Methicone Cetearyl Alcohol Dicaprylyl Carbonate Helianthus Annuus (Sunflower) Seed Oil Diethylhexyl 2 6-Naphthalate Ethoxydiglycol Phenyl Trimethicone Sodium Polyacrylate Butylene Glycol Vitis Vinifera (Grape) Seed Oil Jojoba Alcohol Potassium Jojobate Panthenol Arginine Allantoin Bisabolol Octadecyl Di-t-butyl-4 Hydroxyhydrocinnamate Persea Gratissima (Avocado) Oil Dioscorea Villosa (Wild Yam) Root Extract Benzoic Acid Dehydroacetic Acid Disodium Adenosine Triphosphate Dipotassium Glycyrrhizate Retinyl Palmitate Ascorbyl Palmitate Phospholipids Tocopheryl Acetate Selaginella Lepidophylla Extract Trifolium Pratense (Clover) Flower Extract Propylene Glycol Betaine Inositol Taurine Trehalose Urea Yeast Amino Acid Proline Glycine Sorbitol Carica Papaya Fruit Extract Algin Sodium Hyaluronate Hydrolyzed Soy Protein Copper Tripeptide-1 Iris Florentina Root Extract Phenoxyethanol Fragrance (Parfum) Limonene Linalool,"https://images.ulta.com/is/image/Ulta/2278743?id=dEAaV3&fmt=jpg&fit=constrain,1&wid=113&hei=359&op_sharpen=1&resMode=bilin",https://www.ulta.com/resurgence-age-balancing-moisture-broad-spectrum-spf-30-pa?productId=xlsImpprod11161037
CLINIQUE,Travel Size Moisture Surge 72 Hour Auto-Replenishing Hydrator,Water\Aqua\Eau Dimethicone Butylene Glycol Glycerin Trisiloxane Trehalose Sucrose Ammonium Acryloyldimethyltaurate/Vp Copolymer Hydroxyethyl Urea Camellia Sinensis (Green Tea) Leaf Extract Silybum Marianum (Lady'S Thistle) Extract Betula Alba (Birch) Bark Extract Saccharomyces Lysate Extract Aloe Barbadensis Leaf Water Thermus Thermophillus Ferment Caffeine Sorbitol Palmitoyl Hexapeptide-12 Sodium Hyaluronate Caprylyl Glycol Oleth-10 Sodium Polyaspartate Saccharide Isomerate Hydrogenated Lecithin Tocopheryl Acetate Acrylates/C10-30 Alkyl Acrylate Crosspolymer Glyceryl Polymethacrylate Tromethamine PEG-8 Hexylene Glycol Magnesium Ascorbyl Phosphate Disodium EDTA BHT Phenoxyethanol Red 4 (CI 14700) Yellow 5 (CI 19140),"https://images.ulta.com/is/image/Ulta/2521822?id=Gunbt1&fmt=jpg&fit=constrain,1&wid=260&hei=254&op_sharpen=1&resMode=bilin",https://www.ulta.com/travel-size-moisture-surge-72-hour-auto-replenishing-hydrator?productId=prod18961001
ROSEBUD PERFUME CO.,Lip Balm Trio,"Rosebud Salve Tube: Cotton Seed Oil<div class=""ProductDetail__productContent collapse"">Rosebud Salve Tube: Cotton Seed Oil Trade Secret Perfume Premix (6113806) formulated by Dr. G. F. Smith in 1892 CI 73360.<br/> <br/> Minted Rose Lip Balm Tube: Petrolatum Peppermint Oil Cotton Seed Oil Trade Secret Perfume Premix (6113806) CI 73360.<br/> <br/> Rose &amp; Mandarin Lip Balm Tube: Petrolatum Cotton Seed Oil Trade Secret Orange Spice All Natural Blend","https://images.ulta.com/is/image/Ulta/2294507?id=xP_aK3&fmt=jpg&fit=constrain,1&wid=260&hei=273&op_sharpen=1&resMode=bilin",https://www.ulta.com/lip-balm-trio?productId=xlsImpprod13001055
ESTÉE LAUDER,Online Only DayWear Multi-Protection Anti-Oxidant Sheer Tint Release Moisturizer SPF 15,Water\Aqua\Eau Ethylhexyl Methoxycinnamate Ethylhexyl Salicylate Dimethicone Caprylic/Capric/Myristic/Stearic Triglyceride Butylene Glycol Cyclopentasiloxane Steareth-2 Cetyl Ricinoleate Di-C12-15 Alkyl Fumarate Polysilicone-11 Butyl Methoxydibenzoylmethane Pentylene Glycol Steareth-21 Hydrogenated Lecithin Aspalathus Linearis (Red Tea) Leaf Extract Camellia Sinensis (White Tea) Leaf Extract Coffea Arabica (Coffee) Seed Extract Polygonum Cuspidatum Root Extract Triticum Vulgare (Wheat) Germ Extract Betula Alba (Birch) Bark Extract Laminaria Ochroleuca Extract Hordeum Vulgare (Barley) Extract\Extrait D'orge Saccharomyces Lysate Extract Rosmarinus Officinalis (Rosemary) Leaf Extract Vitis Vinifera (Grape) Seed Extract Ethylbisiminomethylguaiacol Manganese Chloride Cholesterol Maltodextrin Ascorbyl Tocopheryl Maleate Cyclodextrin Sodium Hyaluronate Trehalose Nordihydroguaiaretic Acid Palmitoyl Hydroxypropyltrimonium Amylopectin/Glycerin Crosspolymer Pantethine Linolenic Acid Oryzanol Lecithin Squalane Linoleic Acid Glycerin Sodium PCA Urea Caprylic/Capric Triglyceride Polyethylene Isopropyl Myristate Behenyl Alcohol Tromethamine Stearyl Alcohol PVP/Hexadecene Copolymer Polymethyl Methacrylate Polyquaternium-51 Carbomer Fragrance (Parfum) Sodium Hydroxide Disodium EDTA Sorbic Acid Potassium Sorbate Sodium Dehydroacetate Chlorphenesin Phenoxyethanol Linalool Butylphenyl Methylpropional Hydroxyisohexyl 3-Cyclohexene Carboxaldehyde Benzyl Salicylate Titanium Dioxide (CI 77891) Iron Oxides (CI 77491 CI 77492 CI 77499),"https://images.ulta.com/is/image/Ulta/2309621?id=bLDaF3&fmt=jpg&fit=constrain,1&wid=142&hei=359&op_sharpen=1&resMode=bilin",https://www.ulta.com/daywear-multi-protection-anti-oxidant-sheer-tint-release-moisturizer-spf-15?productId=xlsImpprod14641495
TOO FACED,Lip Insurance Lip Primer,"Isododecane<div class=""ProductDetail__productContent collapse"">Isododecane Silica Talc Ethylenediamine/Stearyl Dimer Dilinoleate Copolymer Trimethylsiloxysilicate Isobutyl Methacrylate/ Trifluoroethylmethacrylate/Bis-Hydroxypropyl Dimethicone Acrylate Copolymer Acrylates Copolymer Disteardimonium Hectorite VP/Eicosene Copolymer Jojoba Esters Polymethyl Methacrylate Trihydroxystearin C12-15 Alkyl Benzoate Triethylhexanoin Cetearyl Ethylhexanoate Ethylhexyl Palmitate Tribehenin Propylene Carbonate Tocopheryl Acetate Sorbitan Isostearate o-Cymen-5-oL Ceramide 2 PEG-10 Rapeseed Sterol Portulaca Pilosa Extract Sucrose Cocoate Palmitoyl Tripeptide-38 Palmitoyl Oligopeptide Mica","https://images.ulta.com/is/image/Ulta/2217530?id=In1bw2&fmt=jpg&fit=constrain,1&wid=54&hei=361&op_sharpen=1&resMode=bilin",https://www.ulta.com/lip-insurance-lip-primer?productId=xlsImpprod2110075
TULA,Online Only Aqua Infusion Oil-Free Gel Cream,Aqua/Water/Eau Pro-panediol Cyclopentasiloxane Cyclo-hexasiloxane Caprylyl Methicone Dimethicone Aspergillus/Rice Ferment Lactococcus Ferment Lysate Saccharomyces/Rice Ferment Filtrate Lactic Acid Aloe Barbadensis Flower Extract Sodium Yaluronate Citrullus Lanatus (Watermelon) Fruit Extract Coccinia Indica Fruit Extract Corallina Officinalis Extract Curcuma Longa (Turmeric) Root Extract Lens Esculenta (Lentil) Fruit Extract Melia Azadirachta Flower Extract Melia Azadirachta Leaf Extract Ocimum Sanctum Leaf Extract Opuntia Ficus-indica (Organic Prickly Pear) Stem Extract Pyrus Malus (Apple) Fruit Extract Chondrus Crispus Extract So-lanum Melongena (Eggplant) Fruit Extract Glycerin Gluconolactone Panthenol Pantolactone Sodium Lactate Sodium Pca Tocopherol Saccharide Isomerate Sodium Benzoate Sodium Chloride Sodium Citrate Citric Acid Caprylhydroxamic Acid Caprylyl Glycol Cetyl Peg/Ppg-10/1 Dimethicone Dimethicone/Peg-10/15 Crosspolymer Dipropylene Glycol 12- Hexanediol Butylene Glycol Potassium SorbateEthylhexylglycerin Parfum/Fragrance Phenoxyethanol,"https://images.ulta.com/is/image/Ulta/2532120?id=vSKa33&fmt=jpg&fit=constrain,1&wid=105&hei=359&op_sharpen=1&resMode=bilin",https://www.ulta.com/aqua-infusion-oil-free-gel-cream?productId=xlsImpprod18731031
OLAY,Complete All Day UV Moisturizer SPF 15 Sensitive Skin,Active Ingredients: 6.0% Octinoxate 3.0% Zinc Oxide. Inactive Ingredients: Water Glycerin Isohexadecane Polyacrylamide C13-14 Isoparaffin Laureth-7 Cyclopentasiloxane PEG/PPG-20/20 Dimethicone Steareth-21 Stearyl Alcohol Sucrose Polycotton-Seedate Behenyl Alcohol Tocopheryl Acetate Cetyl Alcohol DMDM Hydantoin Iodopropynyl Butylcarbamate Steareth-2 Triethoxycaprylylsilane Disodium EDTA Aloe Barbadensis Leaf Juice Oleth-3 Phosphate,"https://images.ulta.com/is/image/Ulta/2091145?id=16mb41&fmt=jpg&fit=constrain,1&wid=219&hei=361&op_sharpen=1&resMode=bilin",https://www.ulta.com/complete-all-day-uv-moisturizer-spf-15-sensitive-skin?productId=xlsImpprod3310041
DERMALOGICA,PowerBright TRx Pure Light SPF 50,Water/Aqua/Eau Carthamus Tinctorius (Safflower) Oleosomes Butylene Glycol Glycerin C12-15 Alkyl Benzoate Polysorbate 80 Dimethyl Capramide Cananga Odorata Flower Oil Eucalyptus Globulus Leaf Oil Lavandula Hybrida Oil Lavendula Spica (Lavender) Flower Oil Laminaria Ochroleuca Extract Palmaria Palmata Extract Oligopeptide-34 Dipotassium Glycyrrhizate Lactobacillus/Pumpkin Fruit Ferment Filtrate Niacinamide Zinc Glycinate Sodium Hyaluronate Crosspolymer Polysorbate 60 Ammonium Acryloyldimethyltaurate/VP Copolymer Vinyl Dimethicone/Methicone Silsesquioxane Crosspolymer Hydroxyethyl Acrylate/Sodium Acryloyldimethyl Taurate Copolymer Isohexadecane Butylene Glycol Behenate Glyceryl Polyacrylate Disodium EDTA Sodium Hydroxide Ethylhexylglycerin Phenoxyethanol,"https://images.ulta.com/is/image/Ulta/2281033?id=S83b90&fmt=jpg&fit=constrain,1&wid=94&hei=360&op_sharpen=1&resMode=bilin",https://www.ulta.com/powerbright-trx-pure-light-spf-50?productId=xlsImpprod11271057
SKINFIX,Online Only Renewing Cream,Water/Aqua Aloe Barbadensis Leaf Juice Cocos Nucifera (Coconut) Oil Caprylic/Capric Triglyceride Stearyl Alcohol Polyglyceryl-2-Stearate Olus Oil Butyrospermum Parkii (Shea) Butter Caprylyl¿Caprylate/Caprate Glyceryl Stearate Propanediol Glycerin Betaine Vitis Vinifera (Grape) Seed Oil Vaccinium Myrtillus Fruit/Leaf Extract Saccharum Officinarum (Sugar Cane) Extract Acer Saccharum (Sugar Maple) Extract Citrus Aurantium Dulcis (Orange) Fruit Extract Citrus Medica Limonum (Lemon) Extract Salix Nigra (Willow) Bark Extract Citrus Aurantifolia (Lime) Oil Microcitrus Australasica Fruit Extract Simmondsia Chinensis (Jojoba) Seed Oil Prunus Amygdalus Dulcis (Sweet Almond) Oil Panthenol Oryza Sativa (Rice) Bran Extract Rosmarinus Officinalis (Rosemary) Leaf Extract Helianthus Annuus (Sunflower) Seed Extract Tocopherol Bisabolol Potassium Sorbate Allantoin Potassium Hydroxide Citric Acid Trisodium Ethylenediamine Disuccinate Xanthan Gum Ethylhexylglycerin Phenoxyethanol,"https://images.ulta.com/is/image/Ulta/2517101?id=WiHaS3&fmt=jpg&fit=constrain,1&wid=198&hei=359&op_sharpen=1&resMode=bilin",https://www.ulta.com/renewing-cream?productId=xlsImpprod16631043
TEAMI BLENDS,Repair Tea Infused Facial Oil,Caprylic / capric triglycerides Fractionated Coconut Oil Camellia Seed Oil Jojoba Oil Seabuckthorn Fruit Oil Vitamin E Chamomile Botanical Essence &amp; Chamomile Flowers,"https://images.ulta.com/is/image/Ulta/2533741?id=cTsbR2&fmt=jpg&fit=constrain,1&wid=113&hei=360&op_sharpen=1&resMode=bilin",https://www.ulta.com/repair-tea-infused-facial-oil?productId=xlsImpprod19011151
OLAY,Olay Regenerist Whip Fragrance-Free Moisturizer,Water Vinyl Dimethicone/Methicone Silsesquioxane Crosspolymer Glycerin Niacinamide Isohexadecane Isopropyl Isostearate Palmitoyl Pentapeptide-4 Sodium Hyaluronate Panthenol Ceratonia Siliqua (Carob) Fruit Extract Dimethicone Caprylyl Glycol Dimethiconol Cetearyl Alcohol Cetearyl Glucoside Stearic Acid Palmitic Acid Stearyl Alcohol Cetyl Alcohol Behenyl Alcohol Disodium EDTA PEG-100 Stearate Sodium Polyacrylate Starch 12-Hexanediol Phenoxyethanol,"https://images.ulta.com/is/image/Ulta/2533347?id=NS1b93&fmt=jpg&fit=constrain,1&wid=260&hei=228&op_sharpen=1&resMode=bilin",https://www.ulta.com/olay-regenerist-whip-fragrance-free-moisturizer?productId=pimprod2001381
CLINIQUE,Smart Night Custom-Repair Moisturizer For Combination Oily Skin,Water / Aqua / Eau Dimethicone Isohexadecane Glycerin Butylene Glycol Bis-PEG-18 Methyl Ether Dimethyl Silane PEG-10 Dimethicone Pentylene Glycol Disteardimonium Hectorite Laminaria Saccharina Extract Tamarindus Indica Seed Extract Biotin Ergothioneine Centaurium Erythraea (Centaury) Extract Sigesbeckia Orientalis (St. Paul'S Wort) Extract Caffeine Whey Protein / Lactis Protein / Protéine Du Petit-Lait Glycine Soja (Soybean) Protein Hydrolyzed Soy Protein Algae Extract Saccharomyces Ferment Filtrate Acetyl Hexapeptide-8 Micrococcus Lysate Ethylhexylglycerin Lecithin Yeast Extract / Faex / Extrait De Levure Soy Amino Acids Camellia Sinensis Leaf Extract Astrocaryum Murumuru Seed Butter Tocopheryl Acetate Acetyl Glucosamine Polysilicone-11 Propylene Carbonate Isododecane Sodium Hyaluronate Sodium Benzoate Citric Acid Polyethylene Aminopropyl Ascorbyl Phosphate Hydroxyethylcellulose Sodium Citrate Disodium EDTA Phenoxyethanol,"https://images.ulta.com/is/image/Ulta/2291716?id=94Caa2&fmt=jpg&fit=constrain,1&wid=260&hei=264&op_sharpen=1&resMode=bilin",https://www.ulta.com/smart-night-custom-repair-moisturizer-combination-oily-skin?productId=xlsImpprod13511131
BENEFIT COSMETICS,Triple Performing Facial Emulsion,Active: Avobenzone 3.00% Octinoxate 7.49% Octocrylene 2.00% Sulisobenzone 1.50%. Inactive: Aqua (Water) Glycerin Dicaprylyl Carbonate Butylene Glycol Pentylene Glycol Diglycerin C14-22 Alcohols Polymethyl Methacrylate Silica Betaine Steareth-21 Phenoxyethanol Phenyl Trimethicone Coco-Glucoside Parfum (Fragrance) C12-20 Alkyl Glucoside Coconut Alcohol Polyacrylamide C13-14 Isoparaffin Sodium Hydroxide Decyloxazolidinone Tetrasodium Edta Tocopheryl Acetate Carbomer Xanthan Gum Laureth-7 Xylitylglucoside Linalool Anhydroxylitol BHT Xylitol Hexyl Cinnamal Limonene Ajuga Turkestanica Extract Hyaluronic Acid Sodium Hyaluronate,"https://images.ulta.com/is/image/Ulta/2229453?id=doTav1&fmt=jpg&fit=constrain,1&wid=127&hei=361&op_sharpen=1&resMode=bilin",https://www.ulta.com/triple-performing-facial-emulsion?productId=xlsImpprod3200009
ROC,"Chest, Neck & Face Cream SPF 30",<b propylene glycol glycerin isononyl isononanoate dimethicone steareth-2 ethylhexyl palmitate styrene/acrylates copolymer butyrospermum parkii (shea) butter vinyl dimethicone/methicone silsesquioxane crosspolymer hexylresorcinol steareth-21 ammonium acryloyldimethyltaurate/VP copolymer behenyl alcohol phenoxyethanol dimethicone crosspolymer ascorbyl glucoside sclerotium gum chlorphenesin fragrance disodium EDTA tocopheryl acetate maltodextrin ethylhexylglycerin sodium hydroxide butylene glycol peucedanum graveolens (dill) extract rubus fruticosus (blackberry) leaf extract xanthan gum,"https://images.ulta.com/is/image/Ulta/2298357?id=ovpbm1&fmt=jpg&fit=constrain,1&wid=260&hei=137&op_sharpen=1&resMode=bilin",https://www.ulta.com/chest-neck-face-cream-spf-30?productId=xlsImpprod13762125
DERMA E,Skin Lighten,Water (Aqua) Caprylic/Capric Triglyceride Stearic Acid Cetyl Alcohol Stearyl Alcohol Glycyrrhiza Glabra (Licorice) Root Extract Silybum Marianum (Milk Thistle) Extract Zinc Oxide Alpha-Arbutin Ascorbyl Palmitate (C-Ester) Glyceryl Stearate and PEG-100 Stearate Tocopheryl Acetate (Vitamin E) Retinyl Palmitate (Vitamin A) Panax Ginseng Root Extract Dimethicone Phenoxyethanol Ethylhexylglycerin Potassium Sorbate,"https://images.ulta.com/is/image/Ulta/2242011?id=vaEag0&fmt=jpg&fit=constrain,1&wid=197&hei=359&op_sharpen=1&resMode=bilin",https://www.ulta.com/skin-lighten?productId=xlsImpprod4180705
YES TO,Coconut 2-Step Lip Kit Pucker Up!,,"https://images.ulta.com/is/image/Ulta/2503161?id=BZmaU1&fmt=jpg&fit=constrain,1&wid=254&hei=359&op_sharpen=1&resMode=bilin",https://www.ulta.com/coconut-2-step-lip-kit-pucker-up?productId=xlsImpprod15622895
MARIO BADESCU,Honey Moisturizer,Water/Aqua/Eau Propylene Glycol Arachis Hypogaea (Peanut) Oil Glyceryl Stearate Stearic Acid C10-30 Cholesterol/Lanosterol Esters Honey Extract Carbomer Parfum (Fragrance) Methylparaben Propylparaben Triethanolamine Diazolidinyl Urea Sodium Chloride Hexyl Cinnamal Benzyl Alcohol Isoeugenol Linalool Butylphenyl Methylpropional CI 19140 (Yellow 5) CI 15985 (Yellow 6) CI 16035 (Red 40),"https://images.ulta.com/is/image/Ulta/2209855?id=jTJaY0&fmt=jpg&fit=constrain,1&wid=155&hei=361&op_sharpen=1&resMode=bilin",https://www.ulta.com/honey-moisturizer?productId=xlsImpprod6200719
SMASHBOX,Photo Finish Primer Oil,Prunus Amygdalus Dulcis (Sweet Almond) Oil Prunus Armeniaca (Apricot) Kernel Oil Simmondsia Chinensis (Jojoba) Seed Oil Helianthus Annuus (Sunflower) Seed Oil Tocopheryl Acetate Squalane Tocopherol Anogeissus Leiocarpus Bark Extract Coffea Arabica (Coffee) Seed Extract Hordeum Vulgare (Barley) Extract\Extrait D'orge Triticum Vulgare (Wheat) Germ Extract Argania Spinosa Kernel Oil Calophyllum Inophyllum (Tamanu) Seed Oil Chamomilla Recutita (Matricaria) Flower Oil Lavandula Angustifolia (Lavender) Oil Oenothera Biennis (Evening Primrose) Oil Rosa Canina (Rose) Fruit Oil Rubus Idaeus (Raspberry) Seed Oil Cholesterol Water\Aqua\Eau Polysorbate 60 Linoleic Acid Linalool Tetrahexyldecyl Ascorbate,"https://images.ulta.com/is/image/Ulta/2297602?id=TmAae2&fmt=jpg&fit=constrain,1&wid=112&hei=361&op_sharpen=1&resMode=bilin",https://www.ulta.com/photo-finish-primer-oil?productId=xlsImpprod13511145
ROC,Deep Wrinkle Serum,Water cyclopentasiloxane glycerin tetrahydroxypropyl ethylenediamine dimethicone crosspolymer dimethicone ammonium acryloyldimethyltaurate/VP copolymer nylon-12 PEG-12 dimethicone tocopherol phenoxyethanol citric acid butylene glycol pentylene glycol laureth-23 hydrolyzed wheat protein fragrance laureth-4 methylparaben propylparaben ethylparaben polyacrylamide disodium EDTA allantoin BHT helianthus annuus (sunflower) seed oil C13-14 isoparaffin polysorbate 20 magnesium aspartate zinc gluconate bisabolol retinol ascorbic acid hydroxyphenyl propamidobenzoic acid laureth-7 copper gluconate yellow 5 (CI 19140)</div>,"https://images.ulta.com/is/image/Ulta/2125984?id=ngbbz3&fmt=jpg&fit=constrain,1&wid=260&hei=318&op_sharpen=1&resMode=bilin",https://www.ulta.com/deep-wrinkle-serum?productId=prod2125984
