Brand,Product,Ingredients,Image Link,Item Link
CLINIQUE,Travel Size Dramatically Different Hydrating Jelly,Water\Aqua\Eau Water\Aqua\Eau Bis-PEG-18 Methyl Ether Dimethyl Silane Butylene Glycol Glycerin Cucumis Sativus (Cucumber) Fruit Extract Hypnea Musciformis (Algae) Extract Gelidiella Acerosa Extract Hordeum Vulgare (Barley) Extract\Extrait D'orge Padina Pavonica Thallus Extract Helianthus Annuus (Sunflower) Seedcake Sucrose Caffeine Sodium Hyaluronate Hydroxyethyl Urea Hydrolyzed Rice Extract Sorbitol Sodium Polyaspartate PPG-6-Decyltetradeceth-30 Ethylhexylglycerin Propylene Glycol Dicaprate Caprylyl Glycol Trehalose Polysorbate 80 Carbomer Sodium Hydroxide Hexylene Glycol Citric Acid Sodium Citrate Disodium EDTA Phenoxyethanol Bis-PEG-18 Methyl Ether Dimethyl Silane Butylene Glycol Glycerin Cucumis Sativus (Cucumber) Fruit Extract Hypnea Musciformis (Algae) Extract Gelidiella Acerosa Extract Hordeum Vulgare (Barley) Extract\Extrait D'orge Padina Pavonica Thallus Extract Helianthus Annuus (Sunflower) Seedcake Sucrose Caffeine Sodium Hyaluronate Hydroxyethyl Urea Hydrolyzed Rice Extract Sorbitol Sodium Polyaspartate PPG-6-Decyltetradeceth-30 Ethylhexylglycerin Propylene Glycol Dicaprate Caprylyl Glycol Trehalose Polysorbate 80 Carbomer Sodium Hydroxide Hexylene Glycol Citric Acid Sodium Citrate Disodium EDTA Phenoxyethanol,"https://images.ulta.com/is/image/Ulta/2531784?id=oBWaa2&fmt=jpg&fit=constrain,1&wid=138&hei=360&op_sharpen=1&resMode=bilin",https://www.ulta.com/travel-size-dramatically-different-hydrating-jelly?productId=xlsImpprod18791011
L'ORÉAL,Revitalift Anti-Wrinkle + Firming Face & Neck Cream,Aqua / Water Cyclohexasiloxane Glycerin Paraffinum Liquidum / Mineral Oil Propanediol Myristyl Myristate Shorea Robusta Seed Butter Stearic Acid Palmitic Acid Peg-100 Stearate Cera Alba / Beeswax Glyceryl Stearate Peg-20 Stearate Acrylamide/Sodium Acryloyldimethyltaurate Copolymer Cetyl Alcohol Phenoxyethanol Stearyl Alcohol Hydrolyzed Soy Protein Isohexadecane Caprylyl Glycol Glycine Soja Protein / Soybean Protein Parfum / Fragrance Acrylonitrile/Methyl Methacrylate/Vinylidene Chloride Copolymer Triethanolamine Polysorbate 80 Retinyl Palmitate Pentaerythrityl Tetra-Di-T-Butyl Hydroxyhydrocinnamate Acetyl Trifluoromethylphenyl Valylglycine Myristic Acid Pentylene Glycol Sorbitan Oleate Sodium Cocoyl Glutamate Faex Extract / Yeast Extract Ethylhexylglycerin Sodium Benzoate Isobutane Phenethyl Alcohol Benzyl Salicylate Benzyl Alcohol Potassium Sorbate Benzyl Benzoate Centella Asiatica Extract Linalool Hexyl Cinnamal Citronellol Limonene Geraniol Alpha-Isomethyl Ionone Salicyloyl Phytosphingosine Tocopherol,"https://images.ulta.com/is/image/Ulta/2131024?id=rgXaj1&fmt=jpg&fit=constrain,1&wid=260&hei=204&op_sharpen=1&resMode=bilin",https://www.ulta.com/revitalift-anti-wrinkle-firming-face-neck-cream?productId=prod2131024
PACIFICA,Crystal Youth Gem Infused Face Lotion,Aqua Helianthus Annuus (Sunflower) Oil Aloe Barbadensis Leaf Juice Glycerin Octyl Palmitate Glyceryl Stearate Stearic Acid Palmitoyl Tripeptide-5 Acetyl Hexapeptide-8 Glyceryl Mono Laurate Curcuma Longa (Turmeric) Root Extract  Citrullus Lanatus (Watermelon) Fruit Extract Panthenol (Vitamin B) Allantoin Quartz Powder Mixed Tocopherols (Vitamin E) Prunus Amygdalus Dulcis (Sweet Almond) Oil Simmondsia Chinensis (Jojoba) Seed Oil Phenoxyethanol Ethylhexylglycerin  Xanthan Gum Parfum (Natural),"https://images.ulta.com/is/image/Ulta/2522645?id=EmSa01&fmt=jpg&fit=constrain,1&wid=115&hei=361&op_sharpen=1&resMode=bilin",https://www.ulta.com/crystal-youth-gem-infused-face-lotion?productId=xlsImpprod17762125
HEY HONEY,Online Only Boost It Up Daily Moisturizing Cream,Water (Aqua) Coco- Caprylate/Caprate Glycerin Glyceryl Stearate Octyldodecanol Cetyl Palmitate Cocoglycerides PEG-10 Soy Sterol Glycine Soja (Soybean) Sterol Honey Extract Glycol Palmitate Isopropyl Myristate Dimethicone Glycine Soja Oil  Calendula Officinalis Flower Extract Tocopheryl Acetate Allantoin Sodium Hyaluronate Glycine Soja (Soybean) Oil Daucus Carota Sativa (Carrot) Root  Phenoxyethanol  Caprylyl Glycol Acrylates/C10-30 Alkyl Acrylate Crosspolymer Chlorphenesin Fragrance Triethanolamine Phospholipids Tocopherol Carthamus Tinctorius Linoleic Acid Beta-Sitosterol Sphingolipids Squalene Hexyl Cinnamal Citronnellol Benzyl Salicylate Retinyl Palmitate Extract Beta-Carotene,"https://images.ulta.com/is/image/Ulta/2303375?id=sQBaN2&fmt=jpg&fit=constrain,1&wid=92&hei=358&op_sharpen=1&resMode=bilin",https://www.ulta.com/boost-it-up-daily-moisturizing-cream?productId=xlsImpprod13891031
PHILOSOPHY,Ultimate Miracle Worker Multi-Rejuvenating Lightweight Emulsion SPF 30,Active: Avobenzone (2.7%) Octinoxate (6.74%) Octocrylene (2%)<br/>Inactive: Water Butylene Glycol C12-15 Alkyl Benzoate Cyclopentasiloxane Gluconolactone Cetyl Alcohol Hydrogenated Lecithin Pentylene Glycol Aluminum Starch Octenylsuccinate Cyclohexasiloxane Polyacrylamide Bifida Ferment Lysate Phenoxyethanol Polysorbate 80 Bisabolol C13-14 Isoparaffin Sodium Benzoate Glycerin Sodium Hydroxide Glycine Soja (Soybean) Oil Choleth-24 Vinyl Dimethicone/Methicone Silsesquioxane Crosspolymer Ceteth-24 Acrylates/C10-30 Alkyl Acrylate Crosspolymer Silica Laureth-7 Iris Pallida Root Extract Ruby Powder Fragrance Disodium EDTA Alcohol Mica Lecithin Adenosine Retinol PEG-8 Polysorbate 20 BHT Cellulose Gum Chitosan Ethylhexylglycerin Glycolic Acid Sorbitan Oleate Calcium Gluconate Tocopherol Behentrimonium Chloride Ascorbyl Palmitate Potassium Phosphate Camellia Sinensis Leaf Extract Coffea Arabica (Coffee) Seed Extract Pongamia Pinnata Seed Extract Isopropyl Alcohol Acetic Acid Angelica Archangelica Root Extract Citrus Aurantium Amara (Bitter Orange) Peel Extract Maltodextrin Citric Acid Magnesium Aluminum Silicate Xanthan Gum Lactic Acid Ascorbic Acid Farnesol Caprylyl Glycol Sclerotium Gum BHA Sorbic Acid Titanium Dioxide (CI 77891),"https://images.ulta.com/is/image/Ulta/2500067?id=yMUaP1&fmt=jpg&fit=constrain,1&wid=82&hei=359&op_sharpen=1&resMode=bilin",https://www.ulta.com/ultimate-miracle-worker-multi-rejuvenating-lightweight-emulsion-spf-30?productId=xlsImpprod14391039
BOTANICS,All Bright Hydrating Night Cream,Aqua (Water) Glycerin Prunus amygdalus dulcis (Sweet almond) oil Dimethicone Cetearyl alcohol Cetearyl olivate Sorbitan olivate Sodium polyacrylate Hibiscus sabdariffa flower extract Butyrospermum parkii (Shea) butter Phenoxyethanol Xanthan gum Dimethicone crosspolymer Caprylyl glycol Parfum (Fragrance) Sodium hyaluronate Sodium benzoate Citric acid Ethylhexylglycerin Dipropylene glycol Tetrasodium EDTA Tocopheryl acetate Benzoic acid Dehydroacetic acid,"https://images.ulta.com/is/image/Ulta/2502283?id=2wCaH1&fmt=jpg&fit=constrain,1&wid=260&hei=158&op_sharpen=1&resMode=bilin",https://www.ulta.com/all-bright-hydrating-night-cream?productId=xlsImpprod15381025
BOSCIA,Revitalizing Black Charcoal Hydration Gel,Water/Aqua/Eau  Glycerin  Dimethicone  Butylene  Glycol  Glycereth-26  Isononyl  Isononanoate  Charcoal  Powder  Pelargonium  Graveolens  Flower  Oil  Lactobacillus/Punica  Granatum  Fruit  Ferment  Extract  Glycyrrhiza  Glabra  (Licorice)  Root  Extract  Simmondsia  Chinensis  (Jojoba)  Seed  Extract  Epilobium  Angustifolium  Flower/Leaf/Stem  Extract  Citrus  Paradisi  (Grapefruit)  Seed  Extract  Cynara  Scolymus  (Artichoke)  Leaf  Extract  Glycolic  Acid  Sodium  Hyaluronate  Leuconostoc/Radish  Root  Ferment  Filtrate  Lactobacillus  Ferment  12-Hexanediol  Ammonium  Acryloyldimethyltaurate/VP  Copolymer  Menthyl  Lactate  Carbomer  Caprylyl  Glycol  Dimethiconol  Dipotassium  Glycyrrhizate  Ascorbyl  Glucoside  Silica  Xanthan  Gum  Oleth-10  Ceteth-25  Cyclopentasiloxane  Sodium  Polyacrylate  Tocopheryl  Acetate  Potassium  Hydroxide  PEG-10  Dimethicone  Mica  (CI  77019)  Iron  Oxides  (CI  77499)  Titanium  Dioxide  (CI  77891),"https://images.ulta.com/is/image/Ulta/2533433?id=_Ezat2&fmt=jpg&fit=constrain,1&wid=88&hei=359&op_sharpen=1&resMode=bilin",https://www.ulta.com/revitalizing-black-charcoal-hydration-gel?productId=xlsImpprod18751547
L'ORÉAL,Age Perfect Hydra-Nutrition Golden Balm Face/Neck/Chest,Aqua/Water Glycerin Paraffinum Liquidum/Mineral Oil Isocetyl Stearate Hydrogenated Polyisobutene Dimethicone Butyrospermum Parkii Butter/Shea Butter Cera Alba/Beeswax Cetyl Alcohol Glyceryl Stearate Peg-100 Stearate Camelina Sativa Oil/Camelina Sativa Seed Oil Hydroxyethylpiperazine Ethane Sulfonic Acid Rosa Canina Fruit Oil Origanum Majorana Leaf Oil Anthemis Nobilis Flower Oil Prunus Armeniaca Kernel Oil/Apricot Kernel Oil Citrus Aurantium Amara Flower Oil/Bitter Orange Flower Oil Citrus Aurantium Dulcis Peel Oil/Orange Peel Oil Zea Mays Oil/Corn Oil Cera Microcristallina/Microcrystalline Wax Paraffin Royal Jelly Extract Sorbitan Tristearate Calcium Pantetheine Sulfonate Copernicia Cerifera Cera/Carnauba Wax Isohexadecane Ascorbyl Glucoside Disodium Edta Propylene Glycol Hydroxyapatite Caprylyl Glycol Passiflora Edulis Oil/Passiflora Edulis Seed Oil Xanthan Gum Polysorbate 80 Acrylamide/Sodium Acryloyldimethyltaurate Copolymer Acrylates Copolymer Oryza Sativa Bran Oil/Rice Bran Oil. Pentaerythrityl Tetra-Di-T-Butyl Hydroxyhydrocinnamate Ci 15985/Yellow 6 Ci 47005/Yellow 10 Linalool Geraniol Eugenol Coumarin Limonene Citral Citronellol Benzyl Alcohol Parfum/Fragrance,"https://images.ulta.com/is/image/Ulta/2234436?id=jJJao1&fmt=jpg&fit=constrain,1&wid=260&hei=220&op_sharpen=1&resMode=bilin",https://www.ulta.com/age-perfect-hydra-nutrition-golden-balm-faceneckchest?productId=xlsImpprod3530043
PHILOSOPHY,Travel Size Ultimate Miracle Worker SPF 30,Active Ingredients: Avobenzone (2.7%) Octinoxate (6.99%) Octocrylene (2%).<br/>Inactive Ingredients: Water C12-15 Alkyl Benzoate Carthamus Tinctorius (Safflower) Oleosomes Glycerin Cyclopentasiloxane Butylene Glycol Methyl Gluceth-20 Gluconolactone Polyacrylamide Hydrogenated Lecithin Cyclohexasiloxane Cetyl Alcohol Bifida Ferment Lysate Phenoxyethanol Ammonium Acryloyldimethyltaurate/Vp Copolymer C13-14 Isoparaffin Polysorbate 80 Acrylates/C10-30 Alkyl Acrylate Crosspolymer Sodium Benzoate Sodium Hydroxide Laureth-7 Glycine Soja (Soybean) Oil Fragrance Iris Pallida Root Extract Ruby Powder Disodium Edta Gluconic Acid Alcohol Mica Lecithin Adenosine Cellulose Gum Retinol Peg-8 Polysorbate 20 BHT Chitosan Ethylhexylglycerin Glycolic Acid Sorbitan Oleate Calcium Gluconate Tocopherol Behentrimonium Chloride Sodium Bicarbonate Ascorbyl Palmitate Beta-Glucan Potassium Phosphate Caprylyl Glycol 12-Hexanediol Camellia Sinensis Leaf Extract Coffea Arabica (Coffee) Seed Extract Pongamia Pinnata Seed Extract Isopropyl Alcohol Acetic Acid Angelica Archangelica Root Extract Benzoic Acid Citrus Aurantium Amara (Bitter Orange) Peel Extract Maltodextrin Citric Acid Magnesium Aluminum Silicate Xanthan Gum Lactic Acid Ascorbic Acid Sclerotium Gum BHA Sorbic Acid Titanium Dioxide (Ci 77891),"https://images.ulta.com/is/image/Ulta/2288780?id=S5Aao2&fmt=jpg&fit=constrain,1&wid=260&hei=279&op_sharpen=1&resMode=bilin",https://www.ulta.com/travel-size-ultimate-miracle-worker-spf-30?productId=xlsImpprod12661071
PERRICONE MD,Essential Fx Acyl-Glutathione Rejuvenating Moisturizer,,"https://images.ulta.com/is/image/Ulta/2532632?id=-RIai3&fmt=jpg&fit=constrain,1&wid=260&hei=239&op_sharpen=1&resMode=bilin",https://www.ulta.com/essential-fx-acyl-glutathione-rejuvenating-moisturizer?productId=xlsImpprod18931466
CLARINS,Extra-Firming Neck Anti-Wrinkle Rejuvenating Cream,Water Dimethicone Cetearyl Isononanoate Glycerin Alcohol Cetearyl Alcohol Cetearyl Ethylhexanoate C14-22 Alcohols Cetearyl Glucoside Phenoxyethanol Parfum/Fragrance C12-20 Alkyl Glucoside Hdi/Trimethylol Hexyllactone Crosspolymer Carbomer Tromethamine Tocopheryl Acetate Ethylhexylglycerin Avena Sativa (Oat) Kernel Extract Disodium Edta Hydrolyzed Ulva Lactuca Extract Potassium Cetyl Phosphate Musa Sapientum (Banana) Fruit Extract Bht Helianthus Annuus (Sunflower) Extract Silica Thymus Citriodorus Flower/Leaf Extract Sodium Benzoate Steareth-20 Potassium Sorbate Ci 15985/Yellow 6,"https://images.ulta.com/is/image/Ulta/2263451?id=lpZaQ0&fmt=jpg&fit=constrain,1&wid=260&hei=207&op_sharpen=1&resMode=bilin",https://www.ulta.com/extra-firming-neck-anti-wrinkle-rejuvenating-cream?productId=xlsImpprod11591237
ESTÉE LAUDER,Online Only Perfectly Clean Fresh Balancing Lotion,Water\Aqua\Eau Pentylene Glycol Polysorbate 20 Nymphaea Alba Root Extract Polygala Senega Root Extract Berberis Vulgaris Extract Hypnea Musciformis (Algae) Extract Caffeine Dipotassium Glycyrrhizate Trehalose Sodium Hyaluronate Sodium PCA Sucrose Urea Jojoba Wax PEG-120 Esters Glycerin Butylene Glycol PPG-5-Ceteth-20 Sodium Citrate Polyquaternium-51 Menthol Citric Acid Fragrance (Parfum) Disodium EDTA Chlorphenesin Phenoxyethanol,"https://images.ulta.com/is/image/Ulta/2309627?id=jQwaZ2&fmt=jpg&fit=constrain,1&wid=111&hei=360&op_sharpen=1&resMode=bilin",https://www.ulta.com/perfectly-clean-fresh-balancing-lotion?productId=xlsImpprod14641551
OLAY,Total Effects Whip Face Moisturizer SPF 25,Avobenzone 3.0% Homosalate 8.0% Octisalate 4.0% Octocrylene 5,"https://images.ulta.com/is/image/Ulta/2521454?id=ncqbT0&fmt=jpg&fit=constrain,1&wid=260&hei=228&op_sharpen=1&resMode=bilin",https://www.ulta.com/total-effects-whip-face-moisturizer-spf-25?productId=xlsImpprod17162849
FIRST AID BEAUTY,Skin Rescue Daily Face Cream,Water/Aqua Eau Glyceryl Stearate Se Glycerin Squalane Caprylic/Capric Triglyceride Dimethicone Cetearyl Alcohol Cetyl Alcohol Caprylyl Glycol Carbomer Chrysanthemum Parthenium Extract Ceramide 3 Sodium Hydroxide Camellia Sinensis Leaf Extract Glycyrrhiza Glabra Root Extract Phenoxyethanol,"https://images.ulta.com/is/image/Ulta/2506523?id=rYBa03&fmt=jpg&fit=constrain,1&wid=105&hei=360&op_sharpen=1&resMode=bilin",https://www.ulta.com/skin-rescue-daily-face-cream?productId=xlsImpprod15601041
MAMONDE,Floral Moisture Cream,Water / Aqua / Eau Butylene Glycol Glycerin Cetyl Ethylhexanoate Butylene Glycol Dicaprylate/Dicaprate Dimethicone Pentaerythrityl Tetraethylhexanoate Behenyl Alcohol Hydroxypropyl Bispalmitamide Mea C14-22 Alcohols Hydroxypropyl Bislauramide Mea Stearic Acid Arachidyl Alcohol Palmitic Acid Cholesterol C12-20 Alkyl Glucoside Polyacrylate-13 Arachidyl Glucoside Tromethamine Fragrance / Parfum Polyisobutene Glyceryl Caprylate Xanthan Gum Ethylhexylglycerin Adenosine Xylitylglucoside Anhydroxylitol Polysorbate 20 Sorbitan Isostearate Glucose Xylitol Disodium EDTA Ceramide NP Arachidic Acid Myristic Acid Hibiscus Syriacus Bark Extract Sucrose Tocopherol Rosa Canina Fruit Extract Indole Acetic Acid,"https://images.ulta.com/is/image/Ulta/2523751?id=jLCa32&fmt=jpg&fit=constrain,1&wid=260&hei=234&op_sharpen=1&resMode=bilin",https://www.ulta.com/floral-moisture-cream?productId=xlsImpprod17741133
LAB SERIES SKINCARE FOR MEN,Online Only AGE RESCUE+ Face Lotion,,"https://images.ulta.com/is/image/Ulta/2265306?id=6hYa81&fmt=jpg&fit=constrain,1&wid=104&hei=360&op_sharpen=1&resMode=bilin",https://www.ulta.com/age-rescue-face-lotion?productId=xlsImpprod5710321
AVEENO,Positively Radiant Sheer Daily Moisturizer SPF 30,Active Ingredients: Avobenzone (1.5%) Homosalate (5%) Octisalate (4%) Octocrylene (6%) Purpose Sunscreen<br/><br/>Inactive Ingredients: Water Caprylyl Methicone Glycerin Methyl Methacrylate Crosspolymer Glycine Soja (Soybean) Seed Extract Sodium Acryloyldimethyltaurate/VP Crosspolymer Pentylene Glycol Hydroxyacetophenone Fragrance Phenoxyethanol Glyceryl Stearate Polyacrylate-13 Chlorphenesin Tocopheryl Acetate Steareth-21 Polyisobutene Disodium EDTA Silica Polysorbate 20 Sodium Hydroxide Titanium Dioxide Mica,"https://images.ulta.com/is/image/Ulta/2523573?id=2GJat3&fmt=jpg&fit=constrain,1&wid=260&hei=331&op_sharpen=1&resMode=bilin",https://www.ulta.com/positively-radiant-sheer-daily-moisturizer-spf-30?productId=xlsImpprod17762083
TRILOGY,Rosehip Oil Antioxidant+,Rosa Canina (Rosehip) Seed Oil Solanum Lycopersicum (Tomato) Seed Oil (and) Caprylic/Capric Triglyceride (and) Vaccinium Macrocarpon (Cranberry) seed oil (and) Helianthus Annuus seed Oil (and) Tocopherol Lycopene Euterpe Oleracea (Acai) Fruit Oil (and) Tocopherol Avena Sativa (Oat) Kernel Extract,"https://images.ulta.com/is/image/Ulta/2522514?id=3Iyak3&fmt=jpg&fit=constrain,1&wid=113&hei=360&op_sharpen=1&resMode=bilin",https://www.ulta.com/rosehip-oil-antioxidant?productId=xlsImpprod17771057
EOS,Lip Balm,,"https://images.ulta.com/is/image/Ulta/2276373?id=_F_aw1&fmt=jpg&fit=constrain,1&wid=260&hei=156&op_sharpen=1&resMode=bilin",https://www.ulta.com/lip-balm?productId=xlsImpprod10951015
SWEET & SHIMMER,Salted Caramel & Winter Citrus Lip Balm Set,Petrolatum Ethylhexyl Palmitate Isopropyl Myristate Paraffin Ceresin Caprylic/Capric Triglyceride Beeswax Fragrance Phenoxyethanol Caprylyl Glycol,"https://images.ulta.com/is/image/Ulta/2534226?id=VAgbS2&fmt=jpg&fit=constrain,1&wid=158&hei=361&op_sharpen=1&resMode=bilin",https://www.ulta.com/salted-caramel-winter-citrus-lip-balm-set?productId=pimprod2001436
EXUVIANCE,Sheer Refining Fluid SPF 35,Active: Hylhexyl Methoxycinnamate (Octinoxate) 7.5% Ethylhexyl Salicylate (Octisalate) 5.0% Butyl Methoxydibenzoylmethane (Avobenzone) 3.0%. Inactive: Aqua (Water) Acetyl Glucosamine Butyloctyl Salicylate Cyclopentasiloxane Glycerin C12-C15 Alkyl Benzoate Dimethicone Butylene Glycol Glyceryl Stearate Octyldodecyl Neopentanoate Cetyl Alcohol PEG-100 Stearate Cetearyl Alcohol Tocopheryl (Vitamin E) Acetate Melia Azadirachta Leaf Extract Arctium Lappa Root Extract Vitis Vinifera (Grape) Seed Extract Lecithin Dimethicone Crosspolymer Propylene Glycol PEG-75 Stearate Xanthan Gum Disodium EDTA Ceteth-20 Steareth-20 Carbomer Ammonium Hydroxide Phenoxyethanol Caprylyl Glycol Chlorphenesin Sodium Bisulfite,"https://images.ulta.com/is/image/Ulta/2264306?id=2muaD1&fmt=jpg&fit=constrain,1&wid=134&hei=359&op_sharpen=1&resMode=bilin",https://www.ulta.com/sheer-refining-fluid-spf-35?productId=xlsImpprod5580047
PACIFICA,Lips Like Sugar Candied Lemon & Sugar Lip Scrub,Cocos Nucifera (Coconut) Oil Euphorbia Cerifera (Candelilla) Wax Olea Europaea (Olive) Fruit Oil Simmondsia Chinensis (Jojoba) Seed Oil Ricinus Communis (Castor) Seed Oil Flavor (Natural) Theobroma Cacao (Cocoa) Seed Butter Rosmarinus Officinalis (Rosemary) Leaf Extract Helianthus Annuus (Sunflower) Seed Oil Stevia Rebaudiana Extract Tocopherol (Vitamin E),"https://images.ulta.com/is/image/Ulta/2512215?id=2-Law2&fmt=jpg&fit=constrain,1&wid=198&hei=361&op_sharpen=1&resMode=bilin",https://www.ulta.com/lips-like-sugar-candied-lemon-sugar-lip-scrub?productId=xlsImpprod16671147
OLAY,Mist Ultimate Hydration Essence Calming,Water Dipropylene Glycol Glycerin Niacinamide Chamomilla Recutita (Matricaria) Flower Extract Aloe Barbadensis Leaf Juice Rosa Gallica Flower Extract PEG-32 Caprylyl Glycol Polysorbate 20 Disodium EDTA Aminomethyl Propanol 12-hexanediol Phenoxyethanol Sodium Benzoate Fragrance,"https://images.ulta.com/is/image/Ulta/2533344?id=GITaP1&fmt=jpg&fit=constrain,1&wid=78&hei=362&op_sharpen=1&resMode=bilin",https://www.ulta.com/mist-ultimate-hydration-essence-calming?productId=pimprod2001382
NEUTROGENA,Healthy Skin Anti Wrinkle Cream Night,Water C12 15 Alkyl Benzoate Glycerin Cetearyl Alcohol Cetearyl Alcohol Ethylhexyl Hydroxystearate Dimethicone Camellia Olefifera (Green Tea) Extract Retinal Panthenol Disodium EDTA Tocopherol (Natural Vitamin E) Cetearyl Glucoside Tocopheryl Acetate (Vitamin E) Polysorbate 20 Triethanolamine Methylparaben Propylparaben Butylene Glycol Diazolidinyl Urea BHT Carbomer,"https://images.ulta.com/is/image/Ulta/5022438?id=S2vbN3&fmt=jpg&fit=constrain,1&wid=152&hei=360&op_sharpen=1&resMode=bilin",https://www.ulta.com/healthy-skin-anti-wrinkle-cream-night?productId=xlsImpprod11601007
COSRX,Oil Free Moisturizing Lotion,Betula Platyphylla Japonica Juice Butylene Glycol Glycerin Dimethicone Betaine Cetearyl Alcohol12-Hexanediol Cetearyl Olivate Sorbitan Olivate Hydroxyethyl Acrylate/Sodium Acryloyldimethyl Taurate Copolymer Sodium Lactate Ethylhexylglycerin Sodium Hyaluronate Allantoin Panthenol Xanthan Gum Ethyl Hexanediol Citrus Medica Limonum (Lemon) Peel Oil Melaleuca Alternifolia (Tea Tree) Leaf Oil,"https://images.ulta.com/is/image/Ulta/2517357?id=wMTaG2&fmt=jpg&fit=constrain,1&wid=93&hei=360&op_sharpen=1&resMode=bilin",https://www.ulta.com/oil-free-moisturizing-lotion?productId=xlsImpprod16661015
CLINIQUE,Travel Size Dramatically Different Moisturizing Gel,Water / Aqua / Eau Dimethicone Isododecane Butylene Glycol Bis-PEG-18 Methyl Ether Dimethyl Silane Glycerin Laminaria Saccharina Extract Polygonum Cuspidatum Root Extract Saccharomyces Lysate Extract Cucumis Sativus (Cucumber) Fruit Extract Hordeum Vulgare (Barley) Extract / Extrait D'Orge Helianthus Annuus (Sunflower) Seedcake Caffeine Trehalose Sodium Hyaluronate Tocopheryl Acetate Chamomilla Recutita (Matricaria) Polysilicone-11 Silica Propylene Glycol Dicaprate Oleth-10 Lactobacillus Ferment Laureth-23 Laureth-4 Ammonium Acryloyldimethyltaurate / VP Copolymer Carbomer Caprylyl Glycol Hexylene Glycol Tromethamine Disodium EDTA Phenoxyethanol Potassium Sorbate Yellow 5 (CI 19140) Red 4 (CI 14700) Yellow 6 (CI 15985),"https://images.ulta.com/is/image/Ulta/2289602?id=5MFaG1&fmt=jpg&fit=constrain,1&wid=130&hei=359&op_sharpen=1&resMode=bilin",https://www.ulta.com/travel-size-dramatically-different-moisturizing-gel?productId=xlsImpprod12481039
COSRX,Advanced Snail 92 All In One Cream,Snail Secretion Filtrate Betaine Caprylic/Capric Triglyceride Cetearyl Olivate Sorbitan Olivate Sodium Hyaluronate Cetearyl Alcohol Stearic acid Arginine Dimethicone Carbomer Panthenol Allantoin Sodium Polyacrylate Xanthan Gum Ethyl Hexanediol Adenosine Phenoxyethanol,"https://images.ulta.com/is/image/Ulta/2517359?id=y__ax0&fmt=jpg&fit=constrain,1&wid=260&hei=173&op_sharpen=1&resMode=bilin",https://www.ulta.com/advanced-snail-92-all-in-one-cream?productId=xlsImpprod16661019
PHILOSOPHY,Travel Size Renewed Hope In A Jar,Aqua/Water/Eau Cyclopentasiloxane Stearic Acid Glycerin Butylene Glycol C12-15 Alkyl Benzoate Glycolic Acid Dimethicone Polyacrylamide Cetearyl Alcohol Phenoxyethanol Sodium Hydroxide C13-14 Isoparaffin Dimethicone Crosspolymer Ceteareth-20 Ammonium Acryloyldimethyltaurate/Vp Copolymer Polysilicone-11 Acrylates/C10-30 Alkyl Acrylate Crosspolymer Laureth-7 Citric Acid Chlorphenesin Mandelic Acid Tocopheryl Acetate Synthetic Fluorphlogopite Ethlhexyl Palmitate Propanediol Parfum/Fragrance Disodium EDTA Adenosine Evodia Rutaecarpa Fruit Extract Limonene Faex/Yeast Extract/Extrait De Levure Magnesium Stearate Opuntia Coccinellifera Flower Extract Silica Dimethyl Silylate Caprylyl Glycol BHT Ethylhexylglycerin Hyaluronic Acid Silanetriol Sodium Hyaluronate Sorbic Acid Hexylene Glycol Bismuth Oxychloride (Ci 77163),"https://images.ulta.com/is/image/Ulta/2287343?id=kaHaQ2&fmt=jpg&fit=constrain,1&wid=260&hei=305&op_sharpen=1&resMode=bilin",https://www.ulta.com/travel-size-renewed-hope-in-a-jar?productId=xlsImpprod12191219
OLAY,Total Effects Fragrance-Free UV Moisturizer with SPF 15,Water Glycerin Niacinamide Dimethicone Isopropyl Isostearate Panthenol Tocopheryl Acetate Hydroxyethyl Acrylate/Sodium Acryloyldimethyl Taurate Copolymer Ptfe Benzyl Alcohol Titanium Dioxide Stearyl Alcohol Behenyl Alcohol Isohexadecane Cetyl Alcohol Methylparaben Dimethiconol PEG-100 Stearate Ethylparaben Carbomer Propylparaben Sodium Ascorbyl Phosphate Cetearyl Glucoside Cetearyl Alcohol Polysorbate 60 Stearic Acid Sodium Hydroxide BHT Disodium EDTA Zinc Oxide Iodopropynyl Butylcarbamate Camellia Sinensis Leaf Extract Triethoxycaprylylsilane. Vitamin B3 Pro-Vitamin B5 Vitamin E,"https://images.ulta.com/is/image/Ulta/2057067?id=oXibF0&fmt=jpg&fit=constrain,1&wid=160&hei=360&op_sharpen=1&resMode=bilin",https://www.ulta.com/total-effects-fragrance-free-uv-moisturizer-with-spf-15?productId=prod2057067
ELIZABETH ARDEN,Online Only Visible Difference Refining Moisture Cream Complex,"Water<div class=""ProductDetail__productContent collapse"">Water Glycerin Stearyl Alcohol Isopropyl Myristate Squalane Cetyl Alcohol Polysorbate 60 Beeswax Olive Oil Retinyl Palmitate Allantoin Panthenol Sodium Borate Fragrance Imidazolidinyl Urea Methylparaben Propylparaben","https://images.ulta.com/is/image/Ulta/2047631?id=bT8bw2&fmt=jpg&fit=constrain,1&wid=260&hei=193&op_sharpen=1&resMode=bilin",https://www.ulta.com/visible-difference-refining-moisture-cream-complex?productId=prod2047631
YOURGOODSKIN,ProVitamin Overnight Cream,Water/Aqua Octyldodecanol Glycerin Sodium Polyacrylate Dimethicone Alcohol Denat. Phenoxyethanol Panthenol Acrylates/C10-30 Alkyl Acrylate Crosspolymer Tocopheryl Acetate Polysorbate 20 Ascorbyl Glucoside Caprylyl Glycol Sodium Benzoate Bisabolol Triethanolamine Parfum (Fragrance) Ethylhexylglycerin Sphinganine Sodium Hyaluronate Citric Acid Tetrasodium EDTA Dipropylene Glycol Dimethylmethoxy Chromanol Camellia Sinensis Leaf Extract,"https://images.ulta.com/is/image/Ulta/2530466?id=XhWa01&fmt=jpg&fit=constrain,1&wid=191&hei=360&op_sharpen=1&resMode=bilin",https://www.ulta.com/provitamin-overnight-cream?productId=xlsImpprod18751403
ANDALOU NATURALS,Dmae Lift & Firm Cream,,"https://images.ulta.com/is/image/Ulta/2298569?id=OYvbD3&fmt=jpg&fit=constrain,1&wid=260&hei=242&op_sharpen=1&resMode=bilin",https://www.ulta.com/dmae-lift-firm-cream?productId=xlsImpprod13762401
